"","binary","title","description","channel","id"
"675",0,"DNC Town Hall - SNL","Democratic presidential candidates Beto O’Rourke (Alex Moffat), Andrew Yang (Bowen Yang), Pete Buttigieg (Colin Jost), Cory Booker (Chris Redd), Elizabeth Warren (Kate McKinnon), Marianne Williamson (Chloe Fineman), Bernie Sanders (Larry David), Joe Biden (Woody Harrelson), Kamala Harris (Maya Rudolph) speak at CNN’s Impeachment Town Hall.#SNL #WoodyHarrelson #BillieEilish #SNL45Subscribe to SNL: https://goo.gl/tUsXwMStream Current Full Episodes: http://www.nbc.com/saturday-night-liveWatch Past SNL Seasons: Google Play - http://bit.ly/SNLGooglePlay iTunes - http://bit.ly/SNLiTunesFollow SNL Social -SNL Instagram: http://instagram.com/nbcsnl SNL Facebook: https://www.facebook.com/snlSNL Twitter: https://twitter.com/nbcsnlSNL Tumblr: http://nbcsnl.tumblr.com/SNL Pinterest: http://www.pinterest.com/nbcsnl/","NBC News","lgA0fjztqaQ"
"676",0,"Cut for Time: Cast List - SNL","A group of drama students (Beck Bennett, Heidi Gardner, Aidy Bryant, Mikey Day, Alex Moffat, Cecily Strong, Kyle Mooney, Bowen Yang) eagerly await their drama teacher’s (Will Ferrell) cast list for a show.Subscribe to SNL: https://goo.gl/tUsXwMStream Current Full Episodes: http://www.nbc.com/saturday-night-live WATCH PAST SNL SEASONSGoogle Play - http://bit.ly/SNLGooglePlayiTunes - http://bit.ly/SNLiTunes SNL ON SOCIALSNL Instagram: http://instagram.com/nbcsnlSNL Facebook: https://www.facebook.com/snlSNL Twitter: https://twitter.com/nbcsnlSNL Tumblr: http://nbcsnl.tumblr.com/SNL Pinterest: http://www.pinterest.com/nbcsnl/ GET MORE NBCLike NBC: http://Facebook.com/NBCFollow NBC: http://Twitter.com/NBCNBC Tumblr: http://NBCtv.tumblr.com/YouTube: http://www.youtube.com/nbcNBC Instagram: http://instagram.com/nbctv #SNL #WillFerrell #KingPrincess #SNL45","NBC News","Ve1kmdHTY24"
"677",0,"New Hampshire Democratic Debate Cold Open - SNL","2020 Democratic presidential candidates Tom Steyer (Pete Davidson), Amy Klobuchar (Rachel Dratch), Elizabeth Warren (Kate McKinnon), Joe Biden (Jason Sudeikis), Bernie Sanders (Larry David), Pete Buttigieg (Colin Jost) and Andrew Yang (Bowen Yang) face off in a debate.Subscribe to SNL: https://goo.gl/tUsXwMStream Current Full Episodes: http://www.nbc.com/saturday-night-live WATCH PAST SNL SEASONSGoogle Play - http://bit.ly/SNLGooglePlayiTunes - http://bit.ly/SNLiTunes SNL ON SOCIALSNL Instagram: http://instagram.com/nbcsnlSNL Facebook: https://www.facebook.com/snlSNL Twitter: https://twitter.com/nbcsnlSNL Tumblr: http://nbcsnl.tumblr.com/SNL Pinterest: http://www.pinterest.com/nbcsnl/ GET MORE NBCLike NBC: http://Facebook.com/NBCFollow NBC: http://Twitter.com/NBCNBC Tumblr: http://NBCtv.tumblr.com/YouTube: http://www.youtube.com/nbcNBC Instagram: http://instagram.com/nbctv #SNL #RuPaul #JustinBieber #SNL45","NBC News","qLz6ydbq3D8"
"678",0,"Weekend Update: Donald Trump Swears-In - SNL","Weekend Update anchors Colin Jost and Michael Che tackle the week's biggest news, including Donald Trump's inauguration and Sean Spicer's first appearance as White House press secretary. Leslie Jones stops by to discuss the film Hidden Figures.Subscribe to SNL: https://goo.gl/tUsXwMStream Current Full Episodes: http://www.nbc.com/saturday-night-liveWatch Past SNL Seasons: Google Play - http://bit.ly/SNLGooglePlay iTunes - http://bit.ly/SNLiTunesFollow SNL Social -SNL Instagram: http://instagram.com/nbcsnl SNL Facebook: https://www.facebook.com/snlSNL Twitter: https://twitter.com/nbcsnlSNL Tumblr: http://nbcsnl.tumblr.com/SNL Pinterest: http://www.pinterest.com/nbcsnl/","NBC News","Rp_3fvn61Mc"
"679",0,"Weekend Update Rewind: Pete Davidson (Part 1 of 2) - SNL","Watch a compilation of Pete Davidson’s best moments on SNL’s Weekend Update.See more of Pete on Weekend Update (Part 2 of 2): https://bit.ly/2Pl5KF2Subscribe to SNL: https://goo.gl/tUsXwMStream Current Full Episodes: http://www.nbc.com/saturday-night-live WATCH PAST SNL SEASONSGoogle Play - http://bit.ly/SNLGooglePlayiTunes - http://bit.ly/SNLiTunes SNL ON SOCIALSNL Instagram: http://instagram.com/nbcsnlSNL Facebook: https://www.facebook.com/snlSNL Twitter: https://twitter.com/nbcsnlSNL Tumblr: http://nbcsnl.tumblr.com/SNL Pinterest: http://www.pinterest.com/nbcsnl/ GET MORE NBCLike NBC: http://Facebook.com/NBCFollow NBC: http://Twitter.com/NBCNBC Tumblr: http://NBCtv.tumblr.com/YouTube: http://www.youtube.com/nbcNBC Instagram: http://instagram.com/nbctv #SNL #PeteDavidson","NBC News","bm_a2LXwPG0"
"680",0,"Weekend Update: Trump Loses Five Court Cases in One Day - SNL","Weekend Update anchors Colin Jost and Michael Che tackle the week's biggest news, like Rudy Giuliani's associates Lev Parnas and Igor Fruman getting arrested.#SNL #DavidHarbour #CamilaCabello #SNL45Subscribe to SNL: https://goo.gl/tUsXwMStream Current Full Episodes: http://www.nbc.com/saturday-night-liveWatch Past SNL Seasons: Google Play - http://bit.ly/SNLGooglePlay iTunes - http://bit.ly/SNLiTunesFollow SNL Social -SNL Instagram: http://instagram.com/nbcsnl SNL Facebook: https://www.facebook.com/snlSNL Twitter: https://twitter.com/nbcsnlSNL Tumblr: http://nbcsnl.tumblr.com/SNL Pinterest: http://www.pinterest.com/nbcsnl/","NBC News","4XGj478W8Fk"
"681",0,"Weekend Update: Chris Redd on Black History Month - SNL","Chris Redd stops by Weekend Update to discuss some of the terrible things that insulted black people during Black History Month.Subscribe to SNL: https://goo.gl/tUsXwMStream Current Full Episodes: http://www.nbc.com/saturday-night-live WATCH PAST SNL SEASONSGoogle Play - http://bit.ly/SNLGooglePlayiTunes - http://bit.ly/SNLiTunes SNL ON SOCIALSNL Instagram: http://instagram.com/nbcsnlSNL Facebook: https://www.facebook.com/snlSNL Twitter: https://twitter.com/nbcsnlSNL Tumblr: http://nbcsnl.tumblr.com/SNL Pinterest: http://www.pinterest.com/nbcsnl/ GET MORE NBCLike NBC: http://Facebook.com/NBCFollow NBC: http://Twitter.com/NBCNBC Tumblr: http://NBCtv.tumblr.com/YouTube: http://www.youtube.com/nbcNBC Instagram: http://instagram.com/nbctv #SNL #JohnMulaney #DavidByrne #SNL45","NBC News","inTOwXLgw4k"
"682",0,"Weekend Update Home Edition: Trump Suggests Injecting Disinfectant - SNL","Weekend Update anchors Colin Jost and Michael Che tackle the week's biggest news, like Trump’s comments about potential COVID-19 treatments and stay-at-home order protests.Subscribe to SNL: https://goo.gl/tUsXwMStream Current Full Episodes: http://www.nbc.com/saturday-night-live WATCH PAST SNL SEASONSGoogle Play - http://bit.ly/SNLGooglePlayiTunes - http://bit.ly/SNLiTunes SNL ON SOCIALSNL Instagram: http://instagram.com/nbcsnlSNL Facebook: https://www.facebook.com/snlSNL Twitter: https://twitter.com/nbcsnlSNL Tumblr: http://nbcsnl.tumblr.com/SNL Pinterest: http://www.pinterest.com/nbcsnl/ GET MORE NBCLike NBC: http://Facebook.com/NBCFollow NBC: http://Twitter.com/NBCNBC Tumblr: http://NBCtv.tumblr.com/YouTube: http://www.youtube.com/nbcNBC Instagram: http://instagram.com/nbctv #SNL #SNL45","NBC News","mor1CNii1VY"
"683",0,"John Mulaney Monologue - SNL","John Mulaney does stand-up about hosting the first Saturday Night Live on Leap Year Day, having a baby boomer dad with no friends and his Make-A-Wish experience.Subscribe to SNL: https://goo.gl/tUsXwMStream Current Full Episodes: http://www.nbc.com/saturday-night-live WATCH PAST SNL SEASONSGoogle Play - http://bit.ly/SNLGooglePlayiTunes - http://bit.ly/SNLiTunes SNL ON SOCIALSNL Instagram: http://instagram.com/nbcsnlSNL Facebook: https://www.facebook.com/snlSNL Twitter: https://twitter.com/nbcsnlSNL Tumblr: http://nbcsnl.tumblr.com/SNL Pinterest: http://www.pinterest.com/nbcsnl/ GET MORE NBCLike NBC: http://Facebook.com/NBCFollow NBC: http://Twitter.com/NBCNBC Tumblr: http://NBCtv.tumblr.com/YouTube: http://www.youtube.com/nbcNBC Instagram: http://instagram.com/nbctv #SNL #JohnMulaney #DavidByrne #SNL45","NBC News","jRLH8E_CpP0"
"684",0,"John Mulaney Stand-Up Monologue - SNL","Host John Mulaney does stand-up about his wife seeing Woody Allen while pushing their dog in a stroller, subway announcements and emergency siren sounds.Subscribe to SNL: https://goo.gl/tUsXwMStream Current Full Episodes: http://www.nbc.com/saturday-night-live WATCH PAST SNL SEASONSGoogle Play - http://bit.ly/SNLGooglePlayiTunes - http://bit.ly/SNLiTunes SNL ON SOCIALSNL Instagram: http://instagram.com/nbcsnlSNL Facebook: https://www.facebook.com/snlSNL Twitter: https://twitter.com/nbcsnlSNL Tumblr: http://nbcsnl.tumblr.com/SNL Pinterest: http://www.pinterest.com/nbcsnl/ GET MORE NBCLike NBC: http://Facebook.com/NBCFollow NBC: http://Twitter.com/NBCNBC Tumblr: http://NBCtv.tumblr.com/YouTube: http://www.youtube.com/nbcNBC Instagram: http://instagram.com/nbctv #SNL #JohnMulaney #ThomasRhett #SNL44","NBC News","-mSGwndFMp8"
"685",0,"John Mulaney Stand-Up Monologue - SNL","Host John Mulaney discusses his time as a Saturday Night Live writer and shares how he's gotten grumpier as he's gotten older.Subscribe to SNL: https://goo.gl/tUsXwMStream Current Full Episodes: http://www.nbc.com/saturday-night-live WATCH PAST SNL SEASONSGoogle Play - http://bit.ly/SNLGooglePlayiTunes - http://bit.ly/SNLiTunes SNL ON SOCIALSNL Instagram: http://instagram.com/nbcsnlSNL Facebook: https://www.facebook.com/snlSNL Twitter: https://twitter.com/nbcsnlSNL Tumblr: http://nbcsnl.tumblr.com/SNL Pinterest: http://www.pinterest.com/nbcsnl/ GET MORE NBCLike NBC: http://Facebook.com/NBCFollow NBC: http://Twitter.com/NBCNBC Tumblr: http://NBCtv.tumblr.com/YouTube: http://www.youtube.com/nbcNBC Instagram: http://instagram.com/nbctv #SNL #SNL43","NBC News","en5_JrcSTcU"
"686",0,"Airport Sushi - SNL","A man (Pete Davidson) surprises everyone (John Mulaney, Chris Redd) by buying sushi at LaGuardia Airport.Watch Diner Lobster: https://youtu.be/Pj-D0jc17D0Watch Bodega Bathroom: https://youtu.be/vgBxxEL-3TISubscribe to SNL: https://goo.gl/tUsXwMStream Current Full Episodes: http://www.nbc.com/saturday-night-live WATCH PAST SNL SEASONSGoogle Play - http://bit.ly/SNLGooglePlayiTunes - http://bit.ly/SNLiTunes SNL ON SOCIALSNL Instagram: http://instagram.com/nbcsnlSNL Facebook: https://www.facebook.com/snlSNL Twitter: https://twitter.com/nbcsnlSNL Tumblr: http://nbcsnl.tumblr.com/SNL Pinterest: http://www.pinterest.com/nbcsnl/ GET MORE NBCLike NBC: http://Facebook.com/NBCFollow NBC: http://Twitter.com/NBCNBC Tumblr: http://NBCtv.tumblr.com/YouTube: http://www.youtube.com/nbcNBC Instagram: http://instagram.com/nbctv #SNL #JohnMulaney #DavidByrne #SNL45","NBC News","6d7Vk_qaiB8"
"687",0,"Kumail Nanjiani Standup Monologue - SNL","Host Kumail Nanjiani shares some of the negative reactions he received to his film, The Big Sick, and explains how to be a better racist.#SNL #SNL43Subscribe to SNL: https://goo.gl/tUsXwMStream Current Full Episodes: http://www.nbc.com/saturday-night-liveWatch Past SNL Seasons: Google Play - http://bit.ly/SNLGooglePlay iTunes - http://bit.ly/SNLiTunesFollow SNL Social -SNL Instagram: http://instagram.com/nbcsnl SNL Facebook: https://www.facebook.com/snlSNL Twitter: https://twitter.com/nbcsnlSNL Tumblr: http://nbcsnl.tumblr.com/SNL Pinterest: http://www.pinterest.com/nbcsnl/","NBC News","z2X0TaXknVE"
"688",0,"Kavanaugh Hearing Cold Open - SNL","Judge Brett Kavanaugh (Matt Damon) takes questions from Senators Chuck Grassley (Alex Moffat), Dianne Feinstein (Cecily Strong), Amy Klobuchar (Rachel Dratch), Thom Tillis (Mikey Day), Cory Booker (Chris Redd), John Kennedy (Kyle Mooney), Sheldon Whitehouse (Pete Davidson), Lindsey Graham (Kate McKinnon) and prosecutor Rachel Mitchell (Aidy Bryant).#SNL #SNL44 #AdamDriver #KanyeWestSubscribe to SNL: https://goo.gl/tUsXwMStream Current Full Episodes: http://www.nbc.com/saturday-night-liveWatch Past SNL Seasons: Google Play - http://bit.ly/SNLGooglePlay iTunes - http://bit.ly/SNLiTunesFollow SNL Social -SNL Instagram: http://instagram.com/nbcsnl SNL Facebook: https://www.facebook.com/snlSNL Twitter: https://twitter.com/nbcsnlSNL Tumblr: http://nbcsnl.tumblr.com/SNL Pinterest: http://www.pinterest.com/nbcsnl/","NBC News","VRJecfRxbr8"
"689",0,"Cha Cha Slide - SNL","A software engineer from Indiana (John Mulaney) feels out of place at his girlfriend's (Ego Nwodim) cousin's wedding until they get out on the dance floor to do the ""Cha Cha Slide.""Subscribe to SNL: https://goo.gl/tUsXwMStream Current Full Episodes: http://www.nbc.com/saturday-night-live WATCH PAST SNL SEASONSGoogle Play - http://bit.ly/SNLGooglePlayiTunes - http://bit.ly/SNLiTunes SNL ON SOCIALSNL Instagram: http://instagram.com/nbcsnlSNL Facebook: https://www.facebook.com/snlSNL Twitter: https://twitter.com/nbcsnlSNL Tumblr: http://nbcsnl.tumblr.com/SNL Pinterest: http://www.pinterest.com/nbcsnl/ GET MORE NBCLike NBC: http://Facebook.com/NBCFollow NBC: http://Twitter.com/NBCNBC Tumblr: http://NBCtv.tumblr.com/YouTube: http://www.youtube.com/nbcNBC Instagram: http://instagram.com/nbctv #SNL #JohnMulaney #ThomasRhett #SNL44","NBC News","MC6xjO1JoR8"
"690",0,"2012 Town Hall Presidential Debate - SNL","Candy Crowley (Aidy Bryant) moderates the 2012 Town Hall Presidential Debate as Mitt Romney (Jason Sudeikis) and Barack Obama (Jay Pharoah) answer questions from undecided Long Island voters (Fred Armisen, Bill Hader and Tom Hanks). [Season 38, 2012]#SNLSubscribe to SNL: https://goo.gl/tUsXwMGet more SNL: http://www.nbc.com/saturday-night-liveFull Episodes: http://www.nbc.com/saturday-night-liv...Like SNL: https://www.facebook.com/snlFollow SNL: https://twitter.com/nbcsnlSNL Tumblr: http://nbcsnl.tumblr.com/SNL Instagram: http://instagram.com/nbcsnlSNL Pinterest: http://www.pinterest.com/nbcsnl/","NBC News","6qyIxXA0k3c"
"691",0,"Caravan Cold Open - SNL","Fox News’ Laura Ingraham (Kate McKinnon) talks to Judge Jeanine Pirro (Cecily Strong) and David Clarke (Kenan Thompson) about a caravan of illegal immigrants headed for the U.S. border.#SNL #SNL44 #JonahHill #MaggieRogersSubscribe to SNL: https://goo.gl/tUsXwMStream Current Full Episodes: http://www.nbc.com/saturday-night-liveWatch Past SNL Seasons: Google Play - http://bit.ly/SNLGooglePlay iTunes - http://bit.ly/SNLiTunesFollow SNL Social -SNL Instagram: http://instagram.com/nbcsnl SNL Facebook: https://www.facebook.com/snlSNL Twitter: https://twitter.com/nbcsnlSNL Tumblr: http://nbcsnl.tumblr.com/SNL Pinterest: http://www.pinterest.com/nbcsnl/","NBC News","kG7szS15O8Q"
"692",0,"Tucker Carlson Cold Open - SNL","Tucker Carlson (Alex Moffat), Jeannine Pirro (Cecily Strong), Ann Coulter (Heidi Gardner), Wilbur Ross (Kate McKinnon) talk about the government shutdown and Roger Stone (Steve Martin) stops by to talk about his arrest.#SNL #JamesMcAvoy #MeekMill #SNL44Subscribe to SNL: https://goo.gl/tUsXwMStream Current Full Episodes: http://www.nbc.com/saturday-night-liveWatch Past SNL Seasons: Google Play - http://bit.ly/SNLGooglePlay iTunes - http://bit.ly/SNLiTunesFollow SNL Social -SNL Instagram: http://instagram.com/nbcsnl SNL Facebook: https://www.facebook.com/snlSNL Twitter: https://twitter.com/nbcsnlSNL Tumblr: http://nbcsnl.tumblr.com/SNL Pinterest: http://www.pinterest.com/nbcsnl/","NBC News","Sld27PfAF3M"
"693",0,"Space Station Broadcast - SNL","An unexpected chain of events occurs while Captain Ed McGovern (Steve Carell) live streams from the International Space Station to children's classrooms across America.#SNL #SNL44 #SteveCarell #EllaMaiSubscribe to SNL: https://goo.gl/tUsXwMStream Current Full Episodes: http://www.nbc.com/saturday-night-liveWatch Past SNL Seasons: Google Play - http://bit.ly/SNLGooglePlay iTunes - http://bit.ly/SNLiTunesFollow SNL Social -SNL Instagram: http://instagram.com/nbcsnl SNL Facebook: https://www.facebook.com/snlSNL Twitter: https://twitter.com/nbcsnlSNL Tumblr: http://nbcsnl.tumblr.com/SNL Pinterest: http://www.pinterest.com/nbcsnl/","NBC News","Y7pf_Ue9gdw"
"694",0,"SNL Commercial Parodies: Food","Watch these SNL food commercial parodies for brands like Brownie Husband and Almost Pizza to see what whets your appetite.#SNLSubscribe to SNL: https://goo.gl/tUsXwMStream Current Full Episodes: http://www.nbc.com/saturday-night-liveWatch Past SNL Seasons: Google Play - http://bit.ly/SNLGooglePlay iTunes - http://bit.ly/SNLiTunesFollow SNL Social -SNL Instagram: http://instagram.com/nbcsnl SNL Facebook: https://www.facebook.com/snlSNL Twitter: https://twitter.com/nbcsnlSNL Tumblr: http://nbcsnl.tumblr.com/SNL Pinterest: http://www.pinterest.com/nbcsnl/","NBC News","5lC6yDYl_3w"
"695",0,"SNL Commercial Parodies: Health","Watch these SNL health commercial parodies for brands like Chantix and Flaritin to find the cure for what ails you.Subscribe to SNL: https://goo.gl/tUsXwMStream Current Full Episodes: http://www.nbc.com/saturday-night-live WATCH PAST SNL SEASONSGoogle Play - http://bit.ly/SNLGooglePlayiTunes - http://bit.ly/SNLiTunes SNL ON SOCIALSNL Instagram: http://instagram.com/nbcsnlSNL Facebook: https://www.facebook.com/snlSNL Twitter: https://twitter.com/nbcsnlSNL Tumblr: http://nbcsnl.tumblr.com/SNL Pinterest: http://www.pinterest.com/nbcsnl/ GET MORE NBCLike NBC: http://Facebook.com/NBCFollow NBC: http://Twitter.com/NBCNBC Tumblr: http://NBCtv.tumblr.com/YouTube: http://www.youtube.com/nbcNBC Instagram: http://instagram.com/nbctv #SNL","NBC News","wGYDWO5Fhtg"
"696",0,"SNL Commercial Parodies: Fashion","Watch these SNL fashion commercial parodies for brands like Fashion Coward and Chonk to find your signature style.#SNLSubscribe to SNL: https://goo.gl/tUsXwMStream Current Full Episodes: http://www.nbc.com/saturday-night-liveWatch Past SNL Seasons: Google Play - http://bit.ly/SNLGooglePlay iTunes - http://bit.ly/SNLiTunesFollow SNL Social -SNL Instagram: http://instagram.com/nbcsnl SNL Facebook: https://www.facebook.com/snlSNL Twitter: https://twitter.com/nbcsnlSNL Tumblr: http://nbcsnl.tumblr.com/SNL Pinterest: http://www.pinterest.com/nbcsnl/","NBC News","AjlDTeOtq-c"
"697",0,"Drug Company Hearing - SNL","A woman (Octavia Spencer) sues her former employer (Vanessa Bayer, Alex Moffat) for intellectual property theft.Subscribe to SNL: https://goo.gl/tUsXwMStream Current Full Episodes: http://www.nbc.com/saturday-night-liveWatch Past SNL Seasons: Google Play - http://bit.ly/SNLGooglePlay iTunes - http://bit.ly/SNLiTunesFollow SNL Social -SNL Instagram: http://instagram.com/nbcsnl SNL Facebook: https://www.facebook.com/snlSNL Twitter: https://twitter.com/nbcsnlSNL Tumblr: http://nbcsnl.tumblr.com/SNL Pinterest: http://www.pinterest.com/nbcsnl/","NBC News","UPx_X3DjXy8"
"698",0,"SNL Commercial Parodies: Bathroom","Watch these SNL commercial parodies for brands like Koohl Toilet and Undercover Office Potty for all your bathroom needs.Subscribe to SNL: https://goo.gl/tUsXwMStream Current Full Episodes: http://www.nbc.com/saturday-night-live WATCH PAST SNL SEASONSGoogle Play - http://bit.ly/SNLGooglePlayiTunes - http://bit.ly/SNLiTunes SNL ON SOCIALSNL Instagram: http://instagram.com/nbcsnlSNL Facebook: https://www.facebook.com/snlSNL Twitter: https://twitter.com/nbcsnlSNL Tumblr: http://nbcsnl.tumblr.com/SNL Pinterest: http://www.pinterest.com/nbcsnl/ GET MORE NBCLike NBC: http://Facebook.com/NBCFollow NBC: http://Twitter.com/NBCNBC Tumblr: http://NBCtv.tumblr.com/YouTube: http://www.youtube.com/nbcNBC Instagram: http://instagram.com/nbctv #SNL","NBC News","co-Yva1VGaM"
"699",0,"Ouija - SNL","A group of girls (Cecily Strong, Aidy Bryant, Kate McKinnon, Ego Nwodim, Heidi Gardner) summon a demon (Melissa Villaseñor) using a Ouija board.#SNL #PaulRudd #DJKhaled #SNL44Subscribe to SNL: https://goo.gl/tUsXwMStream Current Full Episodes: http://www.nbc.com/saturday-night-liveWatch Past SNL Seasons: Google Play - http://bit.ly/SNLGooglePlay iTunes - http://bit.ly/SNLiTunesFollow SNL Social -SNL Instagram: http://instagram.com/nbcsnl SNL Facebook: https://www.facebook.com/snlSNL Twitter: https://twitter.com/nbcsnlSNL Tumblr: http://nbcsnl.tumblr.com/SNL Pinterest: http://www.pinterest.com/nbcsnl/","NBC News","bEbIZRUlICE"
"700",0,"SNL Commercial Parodies: Infomercials","Watch these SNL infomercial parodies for brands like Closet Organizer, Disney Channel Acting School and Jar Glove.Subscribe to SNL: https://goo.gl/tUsXwMStream Current Full Episodes: http://www.nbc.com/saturday-night-live WATCH PAST SNL SEASONSGoogle Play - http://bit.ly/SNLGooglePlayiTunes - http://bit.ly/SNLiTunes SNL ON SOCIALSNL Instagram: http://instagram.com/nbcsnlSNL Facebook: https://www.facebook.com/snlSNL Twitter: https://twitter.com/nbcsnlSNL Tumblr: http://nbcsnl.tumblr.com/SNL Pinterest: http://www.pinterest.com/nbcsnl/ GET MORE NBCLike NBC: http://Facebook.com/NBCFollow NBC: http://Twitter.com/NBCNBC Tumblr: http://NBCtv.tumblr.com/YouTube: http://www.youtube.com/nbcNBC Instagram: http://instagram.com/nbctv #SNL","NBC News","j8NgtIQ45HY"
"701",0,"Mr. H - SNL","A teacher (James McAvoy) approaches his underachieving student (Chris Redd) on the streets.#SNL #JamesMcAvoy #MeekMill #SNL44Subscribe to SNL: https://goo.gl/tUsXwMStream Current Full Episodes: http://www.nbc.com/saturday-night-liveWatch Past SNL Seasons: Google Play - http://bit.ly/SNLGooglePlay iTunes - http://bit.ly/SNLiTunesFollow SNL Social -SNL Instagram: http://instagram.com/nbcsnl SNL Facebook: https://www.facebook.com/snlSNL Twitter: https://twitter.com/nbcsnlSNL Tumblr: http://nbcsnl.tumblr.com/SNL Pinterest: http://www.pinterest.com/nbcsnl/","NBC News","FzEPcdVvHAE"
"702",0,"SNL Commercial Parodies: Household","Watch these SNL commercial parodies for household products like Starbucks Verismo and Roach-Ex.Subscribe to SNL: https://goo.gl/tUsXwMStream Current Full Episodes: http://www.nbc.com/saturday-night-live WATCH PAST SNL SEASONSGoogle Play - http://bit.ly/SNLGooglePlayiTunes - http://bit.ly/SNLiTunes SNL ON SOCIALSNL Instagram: http://instagram.com/nbcsnlSNL Facebook: https://www.facebook.com/snlSNL Twitter: https://twitter.com/nbcsnlSNL Tumblr: http://nbcsnl.tumblr.com/SNL Pinterest: http://www.pinterest.com/nbcsnl/ GET MORE NBCLike NBC: http://Facebook.com/NBCFollow NBC: http://Twitter.com/NBCNBC Tumblr: http://NBCtv.tumblr.com/YouTube: http://www.youtube.com/nbcNBC Instagram: http://instagram.com/nbctv #SNL","NBC News","HjgSBJdtrcc"
"703",0,"SNL Commercial Parodies: Babies and Kids","Watch these SNL commercial parodies for babies’ and kids’ brands like Baby Spanx, CNN Pregnancy Test, and Nelson’s Baby Toupees.Subscribe to SNL: https://goo.gl/tUsXwMStream Current Full Episodes: http://www.nbc.com/saturday-night-live WATCH PAST SNL SEASONSGoogle Play - http://bit.ly/SNLGooglePlayiTunes - http://bit.ly/SNLiTunes SNL ON SOCIALSNL Instagram: http://instagram.com/nbcsnlSNL Facebook: https://www.facebook.com/snlSNL Twitter: https://twitter.com/nbcsnlSNL Tumblr: http://nbcsnl.tumblr.com/SNL Pinterest: http://www.pinterest.com/nbcsnl/ GET MORE NBCLike NBC: http://Facebook.com/NBCFollow NBC: http://Twitter.com/NBCNBC Tumblr: http://NBCtv.tumblr.com/YouTube: http://www.youtube.com/nbcNBC Instagram: http://instagram.com/nbctv #SNL","NBC News","Fm2waIyqnMg"
"704",0,"SNL Commercial Parodies: Tech","Watch these SNL tech commercial parodies for brands like Amazon Echo Silver and E-Meth to keep up to date on all the latest gadgets.#SNLSubscribe to SNL: https://goo.gl/tUsXwMStream Current Full Episodes: http://www.nbc.com/saturday-night-liveWatch Past SNL Seasons: Google Play - http://bit.ly/SNLGooglePlay iTunes - http://bit.ly/SNLiTunesFollow SNL Social -SNL Instagram: http://instagram.com/nbcsnl SNL Facebook: https://www.facebook.com/snlSNL Twitter: https://twitter.com/nbcsnlSNL Tumblr: http://nbcsnl.tumblr.com/SNL Pinterest: http://www.pinterest.com/nbcsnl/","NBC News","Uc7slln9qNU"
"705",0,"SNL Celebrates Mother’s Day","Celebrate mom this Mother’s Day with classic SNL sketches, like The Perfect Mother and The Lawrence Welk Show: Mother’s Day.Subscribe to SNL: https://goo.gl/tUsXwMStream Current Full Episodes: http://www.nbc.com/saturday-night-live WATCH PAST SNL SEASONSGoogle Play - http://bit.ly/SNLGooglePlayiTunes - http://bit.ly/SNLiTunes SNL ON SOCIALSNL Instagram: http://instagram.com/nbcsnlSNL Facebook: https://www.facebook.com/snlSNL Twitter: https://twitter.com/nbcsnlSNL Tumblr: http://nbcsnl.tumblr.com/SNL Pinterest: http://www.pinterest.com/nbcsnl/ GET MORE NBCLike NBC: http://Facebook.com/NBCFollow NBC: http://Twitter.com/NBCNBC Tumblr: http://NBCtv.tumblr.com/YouTube: http://www.youtube.com/nbcNBC Instagram: http://instagram.com/nbctv #SNL","NBC News","kCWdKh7eThU"
"706",0,"SNL Presents Rom-Com Trailers","Get in the mood for love with the trailers for the best SNL romantic comedies, like New Year’s Eve Sequel (The Apocalypse) and Black Widow.Subscribe to SNL: https://goo.gl/tUsXwMStream Current Full Episodes: http://www.nbc.com/saturday-night-live WATCH PAST SNL SEASONSGoogle Play - http://bit.ly/SNLGooglePlayiTunes - http://bit.ly/SNLiTunes SNL ON SOCIALSNL Instagram: http://instagram.com/nbcsnlSNL Facebook: https://www.facebook.com/snlSNL Twitter: https://twitter.com/nbcsnlSNL Tumblr: http://nbcsnl.tumblr.com/SNL Pinterest: http://www.pinterest.com/nbcsnl/ GET MORE NBCLike NBC: http://Facebook.com/NBCFollow NBC: http://Twitter.com/NBCNBC Tumblr: http://NBCtv.tumblr.com/YouTube: http://www.youtube.com/nbcNBC Instagram: http://instagram.com/nbctv #SNL","NBC News","9nOwIMtGmg8"
