"","binary","title","description","channel","id"
"438",1,"'The Five' praise Trump for vowing to crack down on Seattle's 'cop-free zone'","In a roundtable discussion, Trump promises to intervene on Seattle; 'The Five' weighs in. #FoxNewsSubscribe to Fox News! https://bit.ly/2vBUvASWatch more Fox News Video: http://video.foxnews.comWatch Fox News Channel Live: http://www.foxnewsgo.com/FOX News Channel (FNC) is a 24-hour all-encompassing news service delivering breaking news as well as political and business news. The number one network in cable, FNC has been the most-watched television news channel for 18 consecutive years. According to a 2020 Brand Keys Consumer Loyalty Engagement Index report, FOX News is the top brand in the country for morning and evening news coverage. A 2019 Suffolk University poll named FOX News as the most trusted source for television news or commentary, while a 2019 Brand Keys Emotion Engagement Analysis survey found that FOX News was the most trusted cable news brand. A 2017 Gallup/Knight Foundation survey also found that among Americans who could name an objective news source, FOX News was the top-cited outlet. Owned by FOX Corporation, FNC is available in nearly 90 million homes and dominates the cable news landscape, routinely notching the top ten programs in the genre. Watch full episodes of your favorite showsThe Five: http://video.foxnews.com/playlist/lon...Special Report with Bret Baier: http://video.foxnews.com/playlist/lon...The Story with Martha Maccallum: http://video.foxnews.com/playlist/lon...Tucker Carlson Tonight: http://video.foxnews.com/playlist/lon...Hannity:  http://video.foxnews.com/playlist/lon...The Ingraham Angle: http://video.foxnews.com/playlist/lon...Fox News @ Night: http://video.foxnews.com/playlist/lon... Follow Fox News on Facebook: https://www.facebook.com/FoxNews/Follow Fox News on Twitter: https://twitter.com/FoxNews/Follow Fox News on Instagram: https://www.instagram.com/foxnews/om","Fox News","dRkJT5Jo9y8"
"439",1,"Judge Jeanine: If you questioned the deep state's existence, you just saw it","Jeanine Pirro breaks down former Special Counsel Robert Mueller's Capitol Hill testimony.FOX News operates the FOX News Channel (FNC), FOX Business Network (FBN), FOX News Radio, FOX News Headlines 24/7, FOXNews.com and the direct-to-consumer streaming service, FOX Nation. FOX News also produces FOX News Sunday on FOX Broadcasting Company and FOX News Edge. A top five-cable network, FNC has been the most watched news channel in the country for 17 consecutive years. According to a 2018 Research Intelligencer study by Brand Keys, FOX News ranks as the second most trusted television brand in the country. Additionally, a Suffolk University/USA Today survey states Fox News is the most trusted source for television news or commentary in the country, while a 2017 Gallup/Knight Foundation survey found that among Americans who could name an objective news source, FOX News is the top-cited outlet. FNC is available in nearly 90 million homes and dominates the cable news landscape while routinely notching the top ten programs in the genre. Subscribe to Fox News!  https://bit.ly/2vBUvASWatch more Fox News Video: http://video.foxnews.comWatch Fox News Channel Live: http://www.foxnewsgo.com/Watch full episodes of your favorite showsThe Five: http://video.foxnews.com/playlist/lon...Special Report with Bret Baier: http://video.foxnews.com/playlist/lon...The Story with Martha Maccallum: http://video.foxnews.com/playlist/lon...Tucker Carlson Tonight: http://video.foxnews.com/playlist/lon...Hannity:  http://video.foxnews.com/playlist/lon...The Ingraham Angle: http://video.foxnews.com/playlist/lon...Fox News @ Night: http://video.foxnews.com/playlist/lon... Follow Fox News on Facebook: https://www.facebook.com/FoxNews/Follow Fox News on Twitter: https://twitter.com/FoxNews/Follow Fox News on Instagram: https://www.instagram.com/foxnews/","Fox News","ZipuFm3fddw"
"440",1,"Watters' World: School children election opinion edition","Jesse Watters quizzes students on campaign 2016 on 'The O'Reilly Factor'","Fox News","EjqFk87j52E"
"441",1,"Watters' World: Presidential debate edition","Jesse Watters asks the folks who won and why on 'The O'Reilly Factor'","Fox News","NJ9H1m2R89Y"
"442",1,"Watters' World: Retro edition","Jesse Watters quizzes folks about iconic American figures on 'The O'Reilly Factor'","Fox News","GO8xHn8twzw"
"443",1,"Watters' World: Trump Tower edition","Jesse Watters takes a tour of Trump Tower and has a chat with the presumptive GOP nominee on 'The O'Reilly Factor'","Fox News","S2DbJtFDi9Y"
"444",1,"Watters' World: 300th edition","'The O'Reilly Factor' looks back at the 'best of' Jesse Watters' travels","Fox News","vTzYtAgz6Uc"
"445",1,"Watters' World: ObamaCare edition","Jesse Watters asks the folks what they know about the healthcare law on 'The O'Reilly Factor'","Fox News","CK89wtTwypI"
"446",1,"Watters' World: Hillary's emails edition","Jesse Watters asks the folks what they think about the FBI investigation on 'The O'Reilly Factor'","Fox News","S4_FB1EzKOE"
"447",1,"Tucker: An Iran war would destroy Trump's presidency","Tucker: We are moving toward confrontation with Iran. That should worry everybody, but it should especially concern the president’s supporters. If President Trump decides to go to war with Iran, it will destroy his presidency, just as the Iraq War destroyed the presidency of his Republican predecessor, George W. Bush. #TuckerFOX News Channel (FNC) is a 24-hour all-encompassing news service dedicated to delivering breaking news as well as political and business news. The number one network in cable, FNC has been the most watched television news channel for more than 15 years and according to a Suffolk University/USA Today poll, is the most trusted television news source in the country. Owned by 21st Century Fox, FNC is available in more than 90 million homes and dominates the cable news landscape, routinely notching the top ten programs in the genre.Subscribe to Fox News!  https://www.youtube.com/user/FoxNewsC...Watch more Fox News Video: http://video.foxnews.comWatch Fox News Channel Live: http://www.foxnewsgo.com/ Watch full episodes of your favorite showsThe Five :http://video.foxnews.com/playlist/lon...Special Report with Bret Baier: http://video.foxnews.com/playlist/lon...The Story with Martha Maccallum: http://video.foxnews.com/playlist/lon...Tucker Carlson Tonight http://video.foxnews.com/playlist/lon...Hannity http://video.foxnews.com/playlist/lon...The Ingraham Angle: http://video.foxnews.com/playlist/lon...Fox News @ Night: http://video.foxnews.com/playlist/lon...Follow Fox News on Facebook: https://www.facebook.com/FoxNews/Follow Fox News on Twitter: https://twitter.com/FoxNews/Follow Fox News on Instagram: https://www.instagram.com/foxnews/","Fox News","s65154ZJP0c"
"448",1,"Tucker: Trump criticized for not being war-hungry","President Trump met with criticism after calling of retaliatory attack on Iran for downed drone. #Tucker #FoxNewsFOX News operates the FOX News Channel (FNC), FOX Business Network (FBN), FOX News Radio, FOX News Headlines 24/7, FOXNews.com and the direct-to-consumer streaming service, FOX Nation. FOX News also produces FOX News Sunday on FOX Broadcasting Company and FOX News Edge. A top five-cable network, FNC has been the most watched news channel in the country for 17 consecutive years. According to a 2018 Research Intelligencer study by Brand Keys, FOX News ranks as the second most trusted television brand in the country. Additionally, a Suffolk University/USA Today survey states Fox News is the most trusted source for television news or commentary in the country, while a 2017 Gallup/Knight Foundation survey found that among Americans who could name an objective news source, FOX News is the top-cited outlet. FNC is available in nearly 90 million homes and dominates the cable news landscape while routinely notching the top ten programs in the genre. Subscribe to Fox News!  https://bit.ly/2vBUvASWatch more Fox News Video: http://video.foxnews.comWatch Fox News Channel Live: http://www.foxnewsgo.com/Watch full episodes of your favorite showsThe Five: http://video.foxnews.com/playlist/lon...Special Report with Bret Baier: http://video.foxnews.com/playlist/lon...The Story with Martha Maccallum: http://video.foxnews.com/playlist/lon...Tucker Carlson Tonight: http://video.foxnews.com/playlist/lon...Hannity:  http://video.foxnews.com/playlist/lon...The Ingraham Angle: http://video.foxnews.com/playlist/lon...Fox News @ Night: http://video.foxnews.com/playlist/lon... Follow Fox News on Facebook: https://www.facebook.com/FoxNews/Follow Fox News on Twitter: https://twitter.com/FoxNews/Follow Fox News on Instagram: https://www.instagram.com/foxnews/","Fox News","FhWDaGQcoag"
"449",1,"Exclusive Interview: Trump sits down with Tucker Carlson in Japan","President Donald Trump discusses trade negotiations with China, tensions in the Middle East on 'Tucker Carlson Tonight.'FOX News operates the FOX News Channel (FNC), FOX Business Network (FBN), FOX News Radio, FOX News Headlines 24/7, FOXNews.com and the direct-to-consumer streaming service, FOX Nation. FOX News also produces FOX News Sunday on FOX Broadcasting Company and FOX News Edge. A top five-cable network, FNC has been the most watched news channel in the country for 17 consecutive years. According to a 2018 Research Intelligencer study by Brand Keys, FOX News ranks as the second most trusted television brand in the country. Additionally, a Suffolk University/USA Today survey states Fox News is the most trusted source for television news or commentary in the country, while a 2017 Gallup/Knight Foundation survey found that among Americans who could name an objective news source, FOX News is the top-cited outlet. FNC is available in nearly 90 million homes and dominates the cable news landscape while routinely notching the top ten programs in the genre. Subscribe to Fox News!  https://bit.ly/2vBUvASWatch more Fox News Video: http://video.foxnews.comWatch Fox News Channel Live: http://www.foxnewsgo.com/Watch full episodes of your favorite showsThe Five: http://video.foxnews.com/playlist/lon...Special Report with Bret Baier: http://video.foxnews.com/playlist/lon...The Story with Martha Maccallum: http://video.foxnews.com/playlist/lon...Tucker Carlson Tonight: http://video.foxnews.com/playlist/lon...Hannity:  http://video.foxnews.com/playlist/lon...The Ingraham Angle: http://video.foxnews.com/playlist/lon...Fox News @ Night: http://video.foxnews.com/playlist/lon... Follow Fox News on Facebook: https://www.facebook.com/FoxNews/Follow Fox News on Twitter: https://twitter.com/FoxNews/Follow Fox News on Instagram: https://www.instagram.com/foxnews/om/","Fox News","mRQW675j6dM"
"450",1,"Gutfeld: The side that's having the most fun tends to win","The 2020 Democrats are in a deep, dark funk. #Gutfeld #FoxNewsFOX News operates the FOX News Channel (FNC), FOX Business Network (FBN), FOX News Radio, FOX News Headlines 24/7, FOXNews.com and the direct-to-consumer streaming service, FOX Nation. FOX News also produces FOX News Sunday on FOX Broadcasting Company and FOX News Edge. A top five-cable network, FNC has been the most watched news channel in the country for 17 consecutive years. According to a 2018 Research Intelligencer study by Brand Keys, FOX News ranks as the second most trusted television brand in the country. Additionally, a Suffolk University/USA Today survey states Fox News is the most trusted source for television news or commentary in the country, while a 2017 Gallup/Knight Foundation survey found that among Americans who could name an objective news source, FOX News is the top-cited outlet. FNC is available in nearly 90 million homes and dominates the cable news landscape while routinely notching the top ten programs in the genre. Subscribe to Fox News!  https://bit.ly/2vBUvASWatch more Fox News Video: http://video.foxnews.comWatch Fox News Channel Live: http://www.foxnewsgo.com/Watch full episodes of your favorite showsThe Five: http://video.foxnews.com/playlist/lon...Special Report with Bret Baier: http://video.foxnews.com/playlist/lon...The Story with Martha Maccallum: http://video.foxnews.com/playlist/lon...Tucker Carlson Tonight: http://video.foxnews.com/playlist/lon...Hannity:  http://video.foxnews.com/playlist/lon...The Ingraham Angle: http://video.foxnews.com/playlist/lon...Fox News @ Night: http://video.foxnews.com/playlist/lon... Follow Fox News on Facebook: https://www.facebook.com/FoxNews/Follow Fox News on Twitter: https://twitter.com/FoxNews/Follow Fox News on Instagram: https://www.instagram.com/foxnews/","Fox News","Gfcu73LNFzI"
"451",1,"Tucker defends Steven Crowder in spat with YouTube","Youtube says Crowder engaged in 'egregious actions that harmed the broader community' with his far-right videos; The Intercept co-founding editor Glenn Greenwald reacts on 'Tucker Carlson Tonight.' #Tucker #FoxNewsFOX News operates the FOX News Channel (FNC), FOX Business Network (FBN), FOX News Radio, FOX News Headlines 24/7, FOXNews.com and the direct-to-consumer streaming service, FOX Nation. FOX News also produces FOX News Sunday on FOX Broadcasting Company and FOX News Edge. A top five-cable network, FNC has been the most watched news channel in the country for 17 consecutive years. According to a 2018 Research Intelligencer study by Brand Keys, FOX News ranks as the second most trusted television brand in the country. Additionally, a Suffolk University/USA Today survey states Fox News is the most trusted source for television news or commentary in the country, while a 2017 Gallup/Knight Foundation survey found that among Americans who could name an objective news source, FOX News is the top-cited outlet. FNC is available in nearly 90 million homes and dominates the cable news landscape while routinely notching the top ten programs in the genre. Subscribe to Fox News!  https://bit.ly/2vBUvASWatch more Fox News Video: http://video.foxnews.comWatch Fox News Channel Live: http://www.foxnewsgo.com/Watch full episodes of your favorite showsThe Five: http://video.foxnews.com/playlist/lon...Special Report with Bret Baier: http://video.foxnews.com/playlist/lon...The Story with Martha Maccallum: http://video.foxnews.com/playlist/lon...Tucker Carlson Tonight: http://video.foxnews.com/playlist/lon...Hannity:  http://video.foxnews.com/playlist/lon...The Ingraham Angle: http://video.foxnews.com/playlist/lon...Fox News @ Night: http://video.foxnews.com/playlist/lon... Follow Fox News on Facebook: https://www.facebook.com/FoxNews/Follow Fox News on Twitter: https://twitter.com/FoxNews/Follow Fox News on Instagram: https://www.instagram.com/foxnews/","Fox News","p86qD8CINGM"
"452",1,"Woman Calls 911 on Black Family Falsely Claiming They're a Gang","A confrontation between a woman and a neighbor in Michigan led to a false police report of alleged gang activity.","Fox News","DaBAbxZGokY"
"453",1,"Woman awaits apology for hotel experience","UPDATES: http://www.fox13news.com/consumer/wom...A Tampa woman and her sister are sharing video with FOX 13 of an encounter they say is unfair treatment at a Hampton Inn in Lake Park, Georgia, and wonder if it has anything to do with their race.At the very least, Mary Williams says the clerk referring to them as ""you people"" is a major failure in customer service.","Fox News","F1ADXdRMOQs"
"454",1,"Student ejected for telling professor there are only 2 genders","Religious studies major barred from Christianity class at Indiana University of Pennsylvania for saying there are only two genders. #TuckerFOX News Channel (FNC) is a 24-hour all-encompassing news service dedicated to delivering breaking news as well as political and business news. The number one network in cable, FNC has been the most watched television news channel for more than 15 years and according to a Suffolk University/USA Today poll, is the most trusted television news source in the country. Owned by 21st Century Fox, FNC is available in more than 90 million homes and dominates the cable news landscape, routinely notching the top ten programs in the genre. Subscribe to Fox News!  https://www.youtube.com/user/FoxNewsC...Watch more Fox News Video: http://video.foxnews.comWatch Fox News Channel Live: http://www.foxnewsgo.com/ Watch full episodes of your favorite showsThe Five: http://video.foxnews.com/playlist/lon...Special Report with Bret Baier: http://video.foxnews.com/playlist/lon...The Story with Martha Maccallum: http://video.foxnews.com/playlist/lon...Tucker Carlson Tonight http://video.foxnews.com/playlist/lon...Hannity http://video.foxnews.com/playlist/lon...The Ingraham Angle: http://video.foxnews.com/playlist/lon...Fox News @ Night: http://video.foxnews.com/playlist/lon... Follow Fox News on Facebook: https://www.facebook.com/FoxNews/Follow Fox News on Twitter: https://twitter.com/FoxNews/Follow Fox News on Instagram: https://www.instagram.com/foxnews/","Fox News","XgsqLLYy3JA"
"455",1,"Shapiro reacts as actor apologizes for pro-Shapiro tweet","Actor Mark Duplass faces backlash for posting a tweet in support of Ben Shapiro; Shapiro responds on 'The Story with Martha MacCallum.'FOX News Channel (FNC) is a 24-hour all-encompassing news service dedicated to delivering breaking news as well as political and business news. The number one network in cable, FNC has been the most watched television news channel for more than 15 years and according to a Suffolk University/USA Today poll, is the most trusted television news source in the country. Owned by 21st Century Fox, FNC is available in more than 90 million homes and dominates the cable news landscape, routinely notching the top ten programs in the genre.Subscribe to Fox News!  https://www.youtube.com/user/FoxNewsC...Watch more Fox News Video: http://video.foxnews.comWatch Fox News Channel Live: http://www.foxnewsgo.com/ Watch full episodes of your favorite showsThe Five :http://video.foxnews.com/playlist/lon...Special Report with Bret Baier: http://video.foxnews.com/playlist/lon...The Story with Martha Maccallum: http://video.foxnews.com/playlist/lon...Tucker Carlson Tonight http://video.foxnews.com/playlist/lon...Hannity http://video.foxnews.com/playlist/lon...The Ingraham Angle: http://video.foxnews.com/playlist/lon...Fox News @ Night: http://video.foxnews.com/playlist/lon...Follow Fox News on Facebook: https://www.facebook.com/FoxNews/Follow Fox News on Twitter: https://twitter.com/FoxNews/Follow Fox News on Instagram: https://www.instagram.com/foxnews/","Fox News","WNh5anL1Qmw"
"456",1,"Ben Shapiro talks brutal Twitter feud with Rosie O'Donnell","Conservative commentator says he's testing Twitter to see if its policies on harassment are fair and balanced.","Fox News","FkevH42sEl4"
"457",1,"Candace Owens: The left has become desperate","Turning Point USA's Candace Owens speaks out on 'Watters' World' after her exchange with Rep. Ted Lieu that broke an online viewing record.FOX News operates the FOX News Channel (FNC), FOX Business Network (FBN), FOX News Radio, FOX News Headlines 24/7, FOXNews.com and the direct-to-consumer streaming service, FOX Nation. FOX News also produces FOX News Sunday on FOX Broadcasting Company and FOX News Edge. A top five-cable network, FNC has been the most watched news channel in the country for 17 consecutive years. According to a 2018 Research Intelligencer study by Brand Keys, FOX News ranks as the second most trusted television brand in the country. Additionally, a Suffolk University/USA Today survey states Fox News is the most trusted source for television news or commentary in the country, while a 2017 Gallup/Knight Foundation survey found that among Americans who could name an objective news source, FOX News is the top-cited outlet. FNC is available in nearly 90 million homes and dominates the cable news landscape while routinely notching the top ten programs in the genre. Subscribe to Fox News!  https://bit.ly/2vBUvASWatch more Fox News Video: http://video.foxnews.comWatch Fox News Channel Live: http://www.foxnewsgo.com/Watch full episodes of your favorite showsThe Five: http://video.foxnews.com/playlist/lon...Special Report with Bret Baier: http://video.foxnews.com/playlist/lon...The Story with Martha Maccallum: http://video.foxnews.com/playlist/lon...Tucker Carlson Tonight: http://video.foxnews.com/playlist/lon...Hannity:  http://video.foxnews.com/playlist/lon...The Ingraham Angle: http://video.foxnews.com/playlist/lon...Fox News @ Night: http://video.foxnews.com/playlist/lon... Follow Fox News on Facebook: https://www.facebook.com/FoxNews/Follow Fox News on Twitter: https://twitter.com/FoxNews/Follow Fox News on Instagram: https://www.instagram.com/foxnews/","Fox News","J77YacAk_bE"
"458",1,"Shapiro sounds off on Ocasio-Cortez Twitter exchange","Ben Shapiro reacts on 'Your World' after Alexandria Ocasio-Cortez compares his debate challenge to a 'catcall.'FOX News Channel (FNC) is a 24-hour all-encompassing news service dedicated to delivering breaking news as well as political and business news. The number one network in cable, FNC has been the most watched television news channel for more than 15 years and according to a Suffolk University/USA Today poll, is the most trusted television news source in the country. Owned by 21st Century Fox, FNC is available in more than 90 million homes and dominates the cable news landscape, routinely notching the top ten programs in the genre.Subscribe to Fox News!  https://www.youtube.com/user/FoxNewsC...Watch more Fox News Video: http://video.foxnews.comWatch Fox News Channel Live: http://www.foxnewsgo.com/ Watch full episodes of your favorite showsThe Five :http://video.foxnews.com/playlist/lon...Special Report with Bret Baier: http://video.foxnews.com/playlist/lon...The Story with Martha Maccallum: http://video.foxnews.com/playlist/lon...Tucker Carlson Tonight http://video.foxnews.com/playlist/lon...Hannity http://video.foxnews.com/playlist/lon...The Ingraham Angle: http://video.foxnews.com/playlist/lon...Fox News @ Night: http://video.foxnews.com/playlist/lon...Follow Fox News on Facebook: https://www.facebook.com/FoxNews/Follow Fox News on Twitter: https://twitter.com/FoxNews/Follow Fox News on Instagram: https://www.instagram.com/foxnews/","Fox News","vEDLb_TWJSo"
"459",1,"Rep. Omar called out by son of 9/11 victim during memorial ceremony","'Squad' member Rep. Ilhan Omar is called out for her 'some people did something' comment. #FoxNews FOX News operates the FOX News Channel (FNC), FOX Business Network (FBN), FOX News Radio, FOX News Headlines 24/7, FOXNews.com and the direct-to-consumer streaming service, FOX Nation. FOX News also produces FOX News Sunday on FOX Broadcasting Company and FOX News Edge. A top five-cable network, FNC has been the most watched news channel in the country for 17 consecutive years. According to a 2018 Research Intelligencer study by Brand Keys, FOX News ranks as the second most trusted television brand in the country. Additionally, a Suffolk University/USA Today survey states Fox News is the most trusted source for television news or commentary in the country, while a 2017 Gallup/Knight Foundation survey found that among Americans who could name an objective news source, FOX News is the top-cited outlet. FNC is available in nearly 90 million homes and dominates the cable news landscape while routinely notching the top ten programs in the genre.Subscribe to Fox News!  https://bit.ly/2vBUvASWatch more Fox News Video: http://video.foxnews.comWatch Fox News Channel Live: http://www.foxnewsgo.com/Watch full episodes of your favorite showsThe Five: http://video.foxnews.com/playlist/lon...Special Report with Bret Baier: http://video.foxnews.com/playlist/lon...The Story with Martha MacCallum: http://video.foxnews.com/playlist/lon...Tucker Carlson Tonight: http://video.foxnews.com/playlist/lon...Hannity:  http://video.foxnews.com/playlist/lon...The Ingraham Angle: http://video.foxnews.com/playlist/lon...Fox News @ Night: http://video.foxnews.com/playlist/lon...Follow Fox News on Facebook: https://www.facebook.com/FoxNews/Follow Fox News on Twitter: https://twitter.com/FoxNews/Follow Fox News on Instagram: https://www.instagram.com/foxnews/","Fox News","Y3GT7WTYRFg"
"460",1,"Shapiro on Ocasio-Cortez claiming to have Jewish heritage","Democratic Congresswoman-elect Alexandria Ocasio-Cortez surprises a crowd at a Hanukkah event by saying she has Jewish heritage; reaction from Ben Shapiro, editor-in-chief of The Daily Wire. FOX News Channel (FNC) is a 24-hour all-encompassing news service dedicated to delivering breaking news as well as political and business news. The number one network in cable, FNC has been the most watched television news channel for more than 16 years and according to a Suffolk University/USA Today poll, is the most trusted television news source in the country. Owned by 21st Century Fox, FNC is available in more than 90 million homes and dominates the cable news landscape, routinely notching the top ten programs in the genre.Subscribe to Fox News!  https://bit.ly/2vBUvASWatch more Fox News Video: http://video.foxnews.comWatch Fox News Channel Live: http://www.foxnewsgo.com/Watch full episodes of your favorite showsThe Five: http://video.foxnews.com/playlist/lon...Special Report with Bret Baier: http://video.foxnews.com/playlist/lon...The Story with Martha Maccallum: http://video.foxnews.com/playlist/lon...Tucker Carlson Tonight: http://video.foxnews.com/playlist/lon...Hannity:  http://video.foxnews.com/playlist/lon...The Ingraham Angle: http://video.foxnews.com/playlist/lon...Fox News @ Night: http://video.foxnews.com/playlist/lon...Follow Fox News on Facebook: https://www.facebook.com/FoxNews/Follow Fox News on Twitter: https://twitter.com/FoxNews/Follow Fox News on Instagram: https://www.instagram.com/foxnews/","Fox News","ONuHCHks1yQ"
