"","binary","title","description","channel","id"
"1",1,"Washington protests: Demonstrations escalate on Trump's doorstep | Nine News Australia","Police have used force to push protesters back from the White House in Washington D.C. as people continue to demonstrate following the death in custody of George Floyd in Minneapolis. 9 News Australia US correspondent Amelia Adams speaks to those on the frontlines. Subscribe: https://bit.ly/2noaGhv Get more breaking news at: https://bit.ly/2nobVgFJoin Nine News for the latest in news and events that affect you in your local city, as well as news from across Australia and the world.Follow Nine News on Facebook: https://www.facebook.com/9News/Follow Nine News on Twitter: https://twitter.com/9NewsAUSFollow Nine News on Instagram: https://www.instagram.com/9news/#9News #BreakingNews #NineNewsAustralia #9NewsAUS","9 News","JG0N6b9EPJw"
"2",0,"A mind-expanding tour of the cosmos with Neil deGrasse Tyson and Robert Krulwich","Your support helps us keep our content free for all. Donate now: https://www.92y.org/donateEver wonder about the our vast, mysterious universe — but don’t have time to earn that PhD? Superstar scientist Neil deGrasse Tyson has come to the rescue with Astrophysics for People in a Hurry, the brilliantly witty guide you’ve been waiting for. Recorded May 3, 2017 at 92nd Street Y. Subscribe for more videos like this: http://bit.ly/1GpwawVYour support helps us keep our content free for all. Donate now: http://www.92y.org/donatenow?utm_sour...Facebook: http://facebook.com/92ndStreetYInstagram: http://Instagram.com/92ndStreetYTwitter: https://twitter.com/92YTumblr: http://92y.tumblr.com/On Demand: http://www.92yondemand.org","92nd Street Y","AyAK3QBnMGQ"
"3",0,"Neil DeGrasse Tyson: Blackholes and Other Cosmic Quandries","Your support helps us keep our content free for all. Donate now: https://www.92y.org/donateRecorded February 1, 2007 at 92nd Street Y.Subscribe for more videos like this: http://bit.ly/1GpwawVFacebook: http://facebook.com/92ndStreetYTwitter: https://twitter.com/92YTumblr: http://92y.tumblr.com/Instagram: http://Instagram.com/92ndStreetYOn Demand: http://www.92yondemand.org","92nd Street Y","rYzBxo3hbYQ"
"4",0,"Science and Communication: Alan Alda in Conversation with Neil deGrasse Tyson","What does it mean to be a true communicator? Two of the best, Academy Award-nominated actor Alan Alda and astrophysicist and science communicator Neil deGrasse Tyson discuss Alda’s new book, If I Understood You, Would I Have This Look on My Face? It’s a guide to improving the way we relate to each other using improv games, storytelling, acting, empathy, science and our own innate abilities.Subscribe for more videos like this: http://bit.ly/1GpwawVYour support helps us keep our content free for all. Donate now: http://www.92y.org/donatenow?utm_sour...Facebook: http://facebook.com/92ndStreetYInstagram: http://Instagram.com/92ndStreetYTwitter: https://twitter.com/92YTumblr: http://92y.tumblr.com/On Demand: http://www.92yondemand.org","92nd Street Y","syIb73RQqVU"
"5",0,"Bob Woodward’s ""FEAR: Trump in The White House""","Watergate journalist Bob Woodward’s new book, FEAR: Trump in the White House, announced as the most acute and penetrating portrait of a sitting president ever published during the first years of an administration, is unprecedented.Talking with Jacob Weisberg, Bob Woodward gives a front-row-seat view of life inside Donald Trump’s White House, as revealed in his new book, FEAR: Trump in the White House. The Pulitzer Prize-winning journalist, an associate editor at The Washington Post, shows how the president makes decisions on major foreign and domestic policies. Drawing from hundreds of hours of interviews with firsthand sources, contemporaneous meeting notes, files, documents, and personal diaries, FEAR brings to light the most explosive debates that drive decision-making in the Oval Office, the Situation Room, Air Force One, and the White House residence. It’s the inside story on President Trump as only Bob Woodward can tell it. Don’t miss this opportunity to hear first-hand as the legendary journalist sits down with the chairman and editor-in-chief of Slate.Recorded on September 12, 2018 at 92nd Street Y.Subscribe for more videos like this: http://bit.ly/1GpwawVYour support helps us keep our content free for all. Donate now: http://www.92y.org/donatenow?utm_sour...Facebook: http://facebook.com/92ndStreetYInstagram: http://Instagram.com/92ndStreetYTwitter: https://twitter.com/92YTumblr: http://92y.tumblr.com/On Demand: http://www.92yondemand.org","92nd Street Y","UkrBSUp55Xk"
"6",0,"Dr. Neil deGrasse Tyson: Pluto's Place in the Universe","http://92Y.org/Talks","92nd Street Y","e98L6mftkNU"
"7",0,"Christopher Hitchens and Tariq Ramadan Debate: Is Islam a Religion of Peace?","Your support helps us keep our content free for all. Donate now: https://www.92y.org/donateChristopher Hitchens and Tariq Ramadan Debate: Is Islam a Religion of Peace? Moderated by Laurie Goodsteing, October 5, 2010 at 92Y. Subscribe for more videos like this: http://bit.ly/1GpwawVFacebook: http://facebook.com/92ndStreetYTwitter: https://twitter.com/92YTumblr: http://92y.tumblr.com/Instagram: http://Instagram.com/92ndStreetYOn Demand: http://www.92yondemand.org","92nd Street Y","mMraxhd9Z9Q"
"8",0,"Pence meets with black pastors, refuses to acknowledge Black Lives Matter | ABC News","The mayor of Tulsa prepared for a “civil emergency,"" while the Oklahoma governor called in hundreds of National Guard troops.SUBSCRIBE to ABC NEWS: https://bit.ly/2vZb6yPWatch More on http://abcnews.go.com/LIKE ABC News on FACEBOOKhttps://www.facebook.com/abcnewsFOLLOW ABC News on TWITTER:https://twitter.com/abcGOOD MORNING AMERICA'S HOMEPAGE:https://www.goodmorningamerica.com/","ABC News","ZGeAGDCCd1k"
"9",0,"Trump rally comes against backdrop of racial protests | ABC News","Movement for Black Lives organizer Thenjiwe McHarris discdiscusses Trump's rally amid nationwide protests and ""Black Wall Street"" author Hannibal Johnson gives insight on the 1921 Tulsa race massacre.SUBSCRIBE to ABC NEWS: https://bit.ly/2vZb6yPWatch More on http://abcnews.go.com/LIKE ABC News on FACEBOOKhttps://www.facebook.com/abcnewsFOLLOW ABC News on TWITTER:https://twitter.com/abcGOOD MORNING AMERICA'S HOMEPAGE:https://www.goodmorningamerica.com/","ABC News","vv96rzYp9rc"
"10",0,"Oklahoma state legislator reacts to Trump rally | ABC News","Oklahoma state Rep. Ajay Pittman discusses Trump holding a rally in Tulsa given the city's history of being the site of the Tulsa race massacre and Dr. Simone Wilds discusses health concerns.SUBSCRIBE to ABC NEWS: https://bit.ly/2vZb6yPWatch More on http://abcnews.go.com/LIKE ABC News on FACEBOOKhttps://www.facebook.com/abcnewsFOLLOW ABC News on TWITTER:https://twitter.com/abcGOOD MORNING AMERICA'S HOMEPAGE:https://www.goodmorningamerica.com/","ABC News","79BUU8vhVvM"
"11",0,"Watch the Latest News Headlines and Live Events l ABC News Live","#georgefloyd #georgefloydprotests #minneapolis #abcnewsliveLATEST NEWS: https://abcnews.go.com/SUBSCRIBE to ABC News on YouTube: https://bit.ly/2vZb6yPFollow us on Instagram: https://www.instagram.com/abcnews/Follow us on Twitter: https://twitter.com/abcLike us on Facebook: https://www.facebook.com/ABCNews","ABC News","w_Ma8oQLmSM"
"12",0,"Police monitor George Floyd protests in San Francisco Bay Area after curfew","Despite the new curfew order, crowds are still lingering throughout Oakland city streets https://abc7ne.ws/2XTWUkX#georgefloyd #blacklivesmatter #protest #california","ABC News","l-C8ynIcABo"
"13",0,"Peaceful rally at Oakland tech moves to city streets","SKY7 was above a peaceful demonstration that started at a high school in California and moved to city streets. Latest here: https://abc7ne.ws/2Ml4CiN#georgefloyd #blacklivesmatter #protest #california","ABC News","1jGkF0-qcCg"
"14",0,"John Bolton believes Putin thinks he can play President Trump ‘like a fiddle’ | WNT","The former national security adviser speaks to ABC News chief global affairs correspondent Martha Raddatz about Trump’s relationship with Russian President Vladimir Putin.WATCH THE FULL EPISODE OF 'WORLD NEWS TONIGHT':https://bit.ly/2N6JKMPWATCH OTHER FULL EPISODES OF WORLD NEWS TONIGHT:http://abc.go.com/shows/world-news-to...WATCH WORLD NEWS TONIGHT ON HULU:https://hulu.tv/33iKepm#WorldNewsTonight #JohnBolton #Trump","ABC News","OE7YAtHremg"
"15",0,"Trevor Noah's Mom Doesn't Care He's a Celebrity","Trevor talks about his love of computers, getting his first one as a kid, pirating CDs, visiting Microsoft, and reveals that his mom doesn't care that he's a celebrity.Jimmy Kimmel Talks to Kids About Love https://youtu.be/ERvVAWKW_hM  SUBSCRIBE to get the latest #KIMMEL: http://bit.ly/JKLSubscribe Watch Mean Tweets: http://bit.ly/KimmelMT10 Connect with Jimmy Kimmel Live Online: Visit the Jimmy Kimmel Live WEBSITE: http://bit.ly/JKLWebsiteLike Jimmy Kimmel on FACEBOOK: http://bit.ly/KimmelFBLike Jimmy Kimmel Live on FACEBOOK: http://bit.ly/JKLFacebookFollow @JimmyKimmel on TWITTER: http://bit.ly/KimmelTWFollow Jimmy Kimmel Live on TWITTER: http://bit.ly/JKLTwitterFollow Jimmy Kimmel Live on INSTAGRAM: http://bit.ly/JKLInstagram About Jimmy Kimmel Live: Jimmy Kimmel serves as host and executive producer of Emmy-winning ""Jimmy Kimmel Live,"" ABC's late-night talk show.""Jimmy Kimmel Live"" is well known for its huge viral video successes with 5.6 billion views on YouTube alone.Some of Kimmel's most popular comedy bits include - Mean Tweets, Lie Witness News, Jimmy's Twerk Fail Prank, Unnecessary Censorship, YouTube Challenge, The Baby Bachelor, Movie: The Movie, Handsome Men's Club, Jimmy Kimmel Lie Detective and music videos like ""I (Wanna) Channing All Over Your Tatum"" and a Blurred Lines parody with Robin Thicke, Pharrell, Jimmy and his security guard Guillermo.Now in its seventeenth season, Kimmel's guests have included: Johnny Depp, Meryl Streep, Tom Cruise, Halle Berry, Harrison Ford, Jennifer Aniston, Will Ferrell, Katy Perry, Tom Hanks, Scarlett Johansson, Channing Tatum, George Clooney, Larry David, Charlize Theron, Mark Wahlberg, Kobe Bryant, Steve Carell, Hugh Jackman, Kristen Wiig, Jeff Bridges, Jennifer Garner, Ryan Gosling, Bryan Cranston, Jamie Foxx, Amy Poehler, Ben Affleck, Robert Downey Jr., Jake Gyllenhaal, Oprah, and unfortunately Matt Damon.Trevor Noah's Mom Doesn't Care He's a Celebrityhttps://youtu.be/TCVPnaaRR0Y","ABC News","TCVPnaaRR0Y"
"16",0,"Can You Name This Country?","In the interest of doing something fun and educational, we went out on the street with a map of the United States that we blacked out so you couldn't see the shapes of the states, and we asked people walking by to name this country.Jimmy Kimmel & Brad Paisley Welcome Immigrants to America https://youtu.be/nG6IcqMCVKQ  SUBSCRIBE to get the latest #KIMMEL: http://bit.ly/JKLSubscribe Watch Mean Tweets: http://bit.ly/KimmelMT10 Connect with Jimmy Kimmel Live Online: Visit the Jimmy Kimmel Live WEBSITE: http://bit.ly/JKLWebsiteLike Jimmy Kimmel on FACEBOOK: http://bit.ly/KimmelFBLike Jimmy Kimmel Live on FACEBOOK: http://bit.ly/JKLFacebookFollow @JimmyKimmel on TWITTER: http://bit.ly/KimmelTWFollow Jimmy Kimmel Live on TWITTER: http://bit.ly/JKLTwitterFollow Jimmy Kimmel Live on INSTAGRAM: http://bit.ly/JKLInstagram About Jimmy Kimmel Live: Jimmy Kimmel serves as host and executive producer of Emmy-winning ""Jimmy Kimmel Live,"" ABC's late-night talk show.""Jimmy Kimmel Live"" is well known for its huge viral video successes with 5.6 billion views on YouTube alone.Some of Kimmel's most popular comedy bits include - Mean Tweets, Lie Witness News, Jimmy's Twerk Fail Prank, Unnecessary Censorship, YouTube Challenge, The Baby Bachelor, Movie: The Movie, Handsome Men's Club, Jimmy Kimmel Lie Detective and music videos like ""I (Wanna) Channing All Over Your Tatum"" and a Blurred Lines parody with Robin Thicke, Pharrell, Jimmy and his security guard Guillermo.Now in its seventeenth season, Kimmel's guests have included: Johnny Depp, Meryl Streep, Tom Cruise, Halle Berry, Harrison Ford, Jennifer Aniston, Will Ferrell, Katy Perry, Tom Hanks, Scarlett Johansson, Channing Tatum, George Clooney, Larry David, Charlize Theron, Mark Wahlberg, Kobe Bryant, Steve Carell, Hugh Jackman, Kristen Wiig, Jeff Bridges, Jennifer Garner, Ryan Gosling, Bryan Cranston, Jamie Foxx, Amy Poehler, Ben Affleck, Robert Downey Jr., Jake Gyllenhaal, Oprah, and unfortunately Matt Damon.Can You Name This Country?https://youtu.be/QFOpN957p3s","ABC News","QFOpN957p3s"
"17",0,"People Apologize to Their Teachers","Teachers have difficult jobs and so in honor of Teacher Appreciation Week, we went out to Hollywood Boulevard to give people a chance to say sorry for the terrible things they did while in school.Jimmy Kimmel on the Met Gala https://youtu.be/vlujbzP1G_g SUBSCRIBE to get the latest #KIMMEL: http://bit.ly/JKLSubscribe Watch Mean Tweets: http://bit.ly/KimmelMT10 Connect with Jimmy Kimmel Live Online: Visit the Jimmy Kimmel Live WEBSITE: http://bit.ly/JKLWebsiteLike Jimmy Kimmel on FACEBOOK: http://bit.ly/KimmelFBLike Jimmy Kimmel Live on FACEBOOK: http://bit.ly/JKLFacebookFollow @JimmyKimmel on TWITTER: http://bit.ly/KimmelTWFollow Jimmy Kimmel Live on TWITTER: http://bit.ly/JKLTwitterFollow Jimmy Kimmel Live on INSTAGRAM: http://bit.ly/JKLInstagram About Jimmy Kimmel Live: Jimmy Kimmel serves as host and executive producer of Emmy-winning ""Jimmy Kimmel Live,"" ABC's late-night talk show.""Jimmy Kimmel Live"" is well known for its huge viral video successes with 5.6 billion views on YouTube alone.Some of Kimmel's most popular comedy bits include - Mean Tweets, Lie Witness News, Jimmy's Twerk Fail Prank, Unnecessary Censorship, YouTube Challenge, The Baby Bachelor, Movie: The Movie, Handsome Men's Club, Jimmy Kimmel Lie Detective and music videos like ""I (Wanna) Channing All Over Your Tatum"" and a Blurred Lines parody with Robin Thicke, Pharrell, Jimmy and his security guard Guillermo.Now in its sixteenth season, Kimmel's guests have included: Johnny Depp, Meryl Streep, Tom Cruise, Halle Berry, Harrison Ford, Jennifer Aniston, Will Ferrell, Katy Perry, Tom Hanks, Scarlett Johansson, Channing Tatum, George Clooney, Larry David, Charlize Theron, Mark Wahlberg, Kobe Bryant, Steve Carell, Hugh Jackman, Kristen Wiig, Jeff Bridges, Jennifer Garner, Ryan Gosling, Bryan Cranston, Jamie Foxx, Amy Poehler, Ben Affleck, Robert Downey Jr., Jake Gyllenhaal, Oprah, and unfortunately Matt Damon.People Apologize to Their Teachershttps://youtu.be/I2lQ_gFO3I0","ABC News","I2lQ_gFO3I0"
"18",0,"Can You Name a Country?","Donald Trump is overseas visiting Belgium, England, Scotland and then his pal Putin in Russia. It is imperative that America has strong relationships with and knowledge about other nations, and that responsibility extends to all of us. So we came up with a test and went out on the street to ask people passing by, to name any country on a map. It didn't go well.Pedestrian Question World Cup Edition – Are You Drunk? https://youtu.be/y0fU1gSvvYQ SUBSCRIBE to get the latest #KIMMEL: http://bit.ly/JKLSubscribe Watch Mean Tweets: http://bit.ly/KimmelMT10 Connect with Jimmy Kimmel Live Online: Visit the Jimmy Kimmel Live WEBSITE: http://bit.ly/JKLWebsiteLike Jimmy Kimmel on FACEBOOK: http://bit.ly/KimmelFBLike Jimmy Kimmel Live on FACEBOOK: http://bit.ly/JKLFacebookFollow @JimmyKimmel on TWITTER: http://bit.ly/KimmelTWFollow Jimmy Kimmel Live on TWITTER: http://bit.ly/JKLTwitterFollow Jimmy Kimmel Live on INSTAGRAM: http://bit.ly/JKLInstagram About Jimmy Kimmel Live: Jimmy Kimmel serves as host and executive producer of Emmy-winning ""Jimmy Kimmel Live,"" ABC's late-night talk show.""Jimmy Kimmel Live"" is well known for its huge viral video successes with 5.6 billion views on YouTube alone.Some of Kimmel's most popular comedy bits include - Mean Tweets, Lie Witness News, Jimmy's Twerk Fail Prank, Unnecessary Censorship, YouTube Challenge, The Baby Bachelor, Movie: The Movie, Handsome Men's Club, Jimmy Kimmel Lie Detective and music videos like ""I (Wanna) Channing All Over Your Tatum"" and a Blurred Lines parody with Robin Thicke, Pharrell, Jimmy and his security guard Guillermo.Now in its sixteenth season, Kimmel's guests have included: Johnny Depp, Meryl Streep, Tom Cruise, Halle Berry, Harrison Ford, Jennifer Aniston, Will Ferrell, Katy Perry, Tom Hanks, Scarlett Johansson, Channing Tatum, George Clooney, Larry David, Charlize Theron, Mark Wahlberg, Kobe Bryant, Steve Carell, Hugh Jackman, Kristen Wiig, Jeff Bridges, Jennifer Garner, Ryan Gosling, Bryan Cranston, Jamie Foxx, Amy Poehler, Ben Affleck, Robert Downey Jr., Jake Gyllenhaal, Oprah, and unfortunately Matt Damon.Can You Name a Country?https://youtu.be/kRh1zXFKC_o","ABC News","kRh1zXFKC_o"
"19",0,"PROOF: The World is Laughing at Donald Trump","World leaders laughed behind Donald Trump's back at the NATO Summit, it was a long day for the House Judiciary portion of the impeachment proceedings, Rep Devin Nunes tried to defend his multiple phone calls with one of Giuliani's Ukrainian henchmen, and Andrew Yang decided to squirt whipped cream into people's mouths.How Tom Holland Drunkenly Saved Spider-Man https://youtu.be/1-NPFORuPCwSUBSCRIBE to get the latest #KIMMEL: http://bit.ly/JKLSubscribe Watch Mean Tweets: http://bit.ly/KimmelMT10 Connect with Jimmy Kimmel Live Online: Visit the Jimmy Kimmel Live WEBSITE: http://bit.ly/JKLWebsiteLike Jimmy Kimmel on FACEBOOK: http://bit.ly/KimmelFBLike Jimmy Kimmel Live on FACEBOOK: http://bit.ly/JKLFacebookFollow @JimmyKimmel on TWITTER: http://bit.ly/KimmelTWFollow Jimmy Kimmel Live on TWITTER: http://bit.ly/JKLTwitterFollow Jimmy Kimmel Live on INSTAGRAM: http://bit.ly/JKLInstagram About Jimmy Kimmel Live: Jimmy Kimmel serves as host and executive producer of Emmy-winning ""Jimmy Kimmel Live,"" ABC's late-night talk show.""Jimmy Kimmel Live"" is well known for its huge viral video successes with 5.6 billion views on YouTube alone.Some of Kimmel's most popular comedy bits include - Mean Tweets, Lie Witness News, Jimmy's Twerk Fail Prank, Unnecessary Censorship, YouTube Challenge, The Baby Bachelor, Movie: The Movie, Handsome Men's Club, Jimmy Kimmel Lie Detective and music videos like ""I (Wanna) Channing All Over Your Tatum"" and a Blurred Lines parody with Robin Thicke, Pharrell, Jimmy and his security guard Guillermo.Now in its seventeenth season, Kimmel's guests have included: Johnny Depp, Meryl Streep, Tom Cruise, Halle Berry, Harrison Ford, Jennifer Aniston, Will Ferrell, Katy Perry, Tom Hanks, Scarlett Johansson, Channing Tatum, George Clooney, Larry David, Charlize Theron, Mark Wahlberg, Kobe Bryant, Steve Carell, Hugh Jackman, Kristen Wiig, Jeff Bridges, Jennifer Garner, Ryan Gosling, Bryan Cranston, Jamie Foxx, Amy Poehler, Ben Affleck, Robert Downey Jr., Jake Gyllenhaal, Oprah, and unfortunately Matt Damon.PROOF: The World is Laughing at Donald Trumphttps://youtu.be/B_zdHfLeaZo","ABC News","B_zdHfLeaZo"
"20",0,"Woman on quest to find sperm donor father finds shocking truth about her conception","Eve Wiley is searching for answers - she knows her mom received a sperm donation to conceive her, but her DNA doesn't match that donor's - it matches her family's trusted fertility doctor. https://abcn.ws/2Ecdjbs#Fertility #DNA #Birth #DNATest #ABCNews #2020 #Nightline","ABC News","v5h1jhMv-2I"
"21",0,"Seed of Doubt l 20/20 l PART 1","#2020 #Fertility #SpermDonor #Documentary #ABCNewsTexas woman discovers she was conceived from anonymous sperm donor: Part 1Her mother admits that after struggling to get pregnant, she and her husband chose artificial insemination to help her to conceive.","ABC News","mT6-JjluNTA"
"22",0,"Seed of Doubt l 20/20 l PART 2","#2020 #Fertility #SpermDonor #Documentary #ABCNewsDonor-conceived woman launches search for sperm donor dad: Part 2Twenty years after donating, California man shocked to get a phone call from sperm bank about his adult child.","ABC News","d8Wr7Oyjb-w"
"23",0,"Seed of Doubt l 20/20 l PART 3","#2020 #Fertility #SpermDonor #Documentary #ABCNewsDNA test shocks donor-conceived woman searching for biological relatives: Part 3A startling secret is exposed after a commercial DNA test reveals unexpected connections.","ABC News","LonVmFkZH0A"
"24",0,"20/20 - Your Biggest Fan - Part 1","WATCH THE FULL EPISODE: https://bit.ly/2IwLmykRebecca Schaeffer gets her first big break on 'One Life to Live':The beautiful young actress from Oregon traveled to New York and appeared first on a popular soap, then on primetime television in ""My Sister Sam.""","ABC News","rDzGCN5Qh-M"
"25",0,"The Woman in the Suitcase: Part 1","WATCH THE FULL EPISODE OF 20/20: https://bit.ly/2YT5ZdIA mystery woman is beaten and left for dead on the side of a Miami roadPolice learn that the woman's name is Inna Budnytska and that she was staying at a hotel before her apparent attack but cameras don't show how she left the hotel.","ABC News","7yZhWcQF6e8"
"26",0,"20/20 Mar 29 Pt 1: Janet Christiansen and Raven Abaroa's ill-fated marriage","WATCH THE FULL EPISODE OF 20/20: https://bit.ly/2uzke9pThe two beautiful young Mormon athletes seemed to have a perfect marriage, but Janet's sisters say that changed dramatically when Abaroa revealed he cheated.READ MORE: https://abcn.ws/2HHxQIzHow contact lenses blew a 2005 murder case wide open and led to a husband serving prison timeOne evening in April 2005, Raven Abaroa said he was out playing soccer when he returned to his family’s North Carolina home to discover a horrifying scene.He told police he found his wife, 25-year-old Janet Abaroa, stabbed to death in an upstairs office. Nothing else in the house was disturbed, according to authorities, and the couple’s 6-month-old son, Kaiden, was left unharmed in another room.""She's been shot or something. There's blood everywhere,"" Raven Abaroa told a 911 dispatcher at the time.Who killed Janet Abaroa was a mystery that captivated the Durham, North Carolina, suburbs, and the case remained unsolved for years.SUBSCRIBE to ABC NEWS: https://www.youtube.com/ABCNews/Watch More on http://abcnews.go.com/LIKE ABC News on FACEBOOKhttps://www.facebook.com/abcnewsFOLLOW ABC News on TWITTER:https://twitter.com/abcGOOD MORNING AMERICA'S HOMEPAGE:https://www.goodmorningamerica.com/","ABC News","kRpJQCp55-0"
"27",0,"My Father BTK - 20/20 PT 1","WATCH THE FULL EPISODE OF 20/20: https://bit.ly/2G7o4ylWoman recalls moment she found out her father was the BTK serial killerKerri Rawson told ""20/20"" that, on Feb. 25, 2005, the FBI arrived at her home to tell her that her father Dennis Rader had been arrested and identified as the BTK serial killer.","ABC News","6ggPe5jT9_4"
"28",0,"Undercover Girlfriend l 20/20 l PART 1","International scholar Yingying Zhang vanishes from Illinois college campus: Part 1On June 9, 2017, Zhang, 26, went to sign a lease for an apartment near the University of Illinois where she intended to start a Ph.D. program. Security cameras captured her last moments seen alive.WATCH THE FULL EPISODE OF 20/20:  https://bit.ly/2QoY2ew#ABCNews #ABC2020 #Documentary #TrueCrime #UndercoverGirlfriend","ABC News","nYuKk1xR99w"
"29",0,"Adults abandoned at birth turn to genetic genealogy to find biological family: Part 1","Andrea Klug-Napier and Ben Tveidt learned they were ""foundlings,"" or abandoned at birth by their respective mothers.","ABC News","y8LYR6KK5K0"
"30",0,"20/20 - Your Biggest Fan - Part 2","WATCH THE FULL EPISODE: https://bit.ly/2IwLmykPam Dawber remembers 'My Sister Sam' co-star Rebecca Schaeffer""She became my little sister,"" Dawber told ABC News. The two actresses lived together for a while, as Dawber watched Schaeffer grow up on the Hollywood scene.","ABC News","s3zbU4aNQNQ"
"31",0,"20/20 - Your Biggest Fan - Part 4","WATCH THE FULL EPISODE: https://bit.ly/2IwLmykRebecca Schaeffer's stalker snaps after her new role in movieRobert Bardo took a page from the playbook of actress Theresa Saldana's stalker, who hired a private eye to track her down.","ABC News","G0ETUYQxveU"
"32",0,"The Woman in the Suitcase: Part 2","WATCH THE FULL EPISODE OF 20/20: https://bit.ly/2YT5ZdIWeeks turn into months as police try to figure out who attacked rape victimInvestigators learn Inna Budnytska was raped as they consider a cruise ship worker as well as the hotel's night manager as possible suspects.","ABC News","Rh0AGJeHPcs"
"33",0,"Two of abused Turpin children read statements during parents' sentencing","A son and a daughter of David and Louise Turpin spoke out in court Friday after the parents pleaded guilty to 14 felony counts of abuse of their children over several decades.#Turpin #TurpinChildren #TurpinFamily #HouseofHorrors #ABCNews","ABC News","FG9DxtjeNwg"
"34",0,"Head-spinning 2005 case of woman left for dead connected to three other assault cases","In 2005, Inna Budnytska was found brutally beaten and raped, in a vacant lot with no memory of the attack. Her case led investigators on a years-long journey to bring a serial rapist to justice.","ABC News","9ojTHYFyUgc"
"35",0,"Warren Jeffs' World of Polygamy","A look at FLDS, the largest polygamist group in the U.S., and the men trying to help young women leave.","ABC News","iZamlDZs5BQ"
"36",0,"How Woman Was Finally Able to Escape FLDS Community","Part 2: Joe Broadbent, who left the church when he was 17, helped his sister Sabrina Broadbent get to freedom.","ABC News","Trzquxja4YY"
"37",0,"FLDS Leader Warren Jeffs Issues Harsh Edicts From Prison","Amy Robach has the latest on the infamous polygamous sect.","ABC News","aT-cHV_eTXM"
"38",0,"'My Five Wives': A Different Look at Modern Polygamy","Brady Williams, a former fundamentalist Mormon, and his wives star in a new reality series.","ABC News","i-Pm5092a0c"
