"","binary","title","description","channel","id"
"249",0,"Bill Taylor's Testimony Closely Ties Trump To Ukraine Quid Pro Quo","On the first day of live public impeachment inquiry hearings, dramatic testimony from acting Ambassador to Ukraine Bill Taylor made it clear that the President was involved in pressuring Ukraine to investigate the Bidens. #Monologue #Impeachment #ColbertSubscribe To ""The Late Show"" Channel HERE: http://bit.ly/ColbertYouTubeFor more content from ""The Late Show with Stephen Colbert"", click HERE: http://bit.ly/1AKISnRWatch full episodes of ""The Late Show"" HERE: http://bit.ly/1Puei40Like ""The Late Show"" on Facebook HERE: http://on.fb.me/1df139YFollow ""The Late Show"" on Twitter HERE: http://bit.ly/1dMzZzGFollow ""The Late Show"" on Google+ HERE: http://bit.ly/1JlGgzwFollow ""The Late Show"" on Instagram HERE: http://bit.ly/29wfREjFollow ""The Late Show"" on Tumblr HERE: http://bit.ly/29DVvtRWatch The Late Show with Stephen Colbert weeknights at 11:35 PM ET/10:35 PM CT. Only on CBS.Get the CBS app for iPhone & iPad! Click HERE: http://bit.ly/12rLxgeGet new episodes of shows you love across devices the next day, stream live TV, and watch full seasons of CBS fan favorites anytime, anywhere with CBS All Access. Try it free! http://bit.ly/1OQA29B---The Late Show with Stephen Colbert is the premier late night talk show on CBS, airing at 11:35pm EST, streaming online via CBS All Access, and delivered to the International Space Station on a USB drive taped to a weather balloon. Every night, viewers can expect: Comedy, humor, funny moments, witty interviews, celebrities, famous people, movie stars, bits, humorous celebrities doing bits, funny celebs, big group photos of every star from Hollywood, even the reclusive ones, plus also jokes.","CBS News","QaR5PQZ3veQ"
"250",0,"Trump's Next Move After Iran's 'Big Mistake'","Iran shot down an unmanned U.S. drone. But don't worry, the next move will be determined Donald Trump, Mike Pompeo, and John Bolton. #LSSC #Colbert #MonologueSubscribe To ""The Late Show"" Channel HERE: http://bit.ly/ColbertYouTubeFor more content from ""The Late Show with Stephen Colbert"", click HERE: http://bit.ly/1AKISnRWatch full episodes of ""The Late Show"" HERE: http://bit.ly/1Puei40Like ""The Late Show"" on Facebook HERE: http://on.fb.me/1df139YFollow ""The Late Show"" on Twitter HERE: http://bit.ly/1dMzZzGFollow ""The Late Show"" on Google+ HERE: http://bit.ly/1JlGgzwFollow ""The Late Show"" on Instagram HERE: http://bit.ly/29wfREjFollow ""The Late Show"" on Tumblr HERE: http://bit.ly/29DVvtRWatch The Late Show with Stephen Colbert weeknights at 11:35 PM ET/10:35 PM CT. Only on CBS.Get the CBS app for iPhone & iPad! Click HERE: http://bit.ly/12rLxgeGet new episodes of shows you love across devices the next day, stream live TV, and watch full seasons of CBS fan favorites anytime, anywhere with CBS All Access. Try it free! http://bit.ly/1OQA29B---The Late Show with Stephen Colbert is the premier late night talk show on CBS, airing at 11:35pm EST, streaming online via CBS All Access, and delivered to the International Space Station on a USB drive taped to a weather balloon. Every night, viewers can expect: Comedy, humor, funny moments, witty interviews, celebrities, famous people, movie stars, bits, humorous celebrities doing bits, funny celebs, big group photos of every star from Hollywood, even the reclusive ones, plus also jokes.","CBS News","9IzaTTi6Osw"
"251",0,"Meanwhile... Costco's Free Samples Will Return This Month","Quarantinewhile... In a sure sign that the country is turning the corner on the pandemic, wholesaler Costco has announced that their beloved free samples will be available once again later this month after months of lockdown. #StephenAtHome #Meanwhile #QuarantinewhileSubscribe To ""The Late Show"" Channel HERE: http://bit.ly/ColbertYouTubeFor more content from ""The Late Show with Stephen Colbert"", click HERE: http://bit.ly/1AKISnRWatch full episodes of ""The Late Show"" HERE: http://bit.ly/1Puei40Like ""The Late Show"" on Facebook HERE: http://on.fb.me/1df139YFollow ""The Late Show"" on Twitter HERE: http://bit.ly/1dMzZzGFollow ""The Late Show"" on Google+ HERE: http://bit.ly/1JlGgzwFollow ""The Late Show"" on Instagram HERE: http://bit.ly/29wfREjFollow ""The Late Show"" on Tumblr HERE: http://bit.ly/29DVvtRWatch The Late Show with Stephen Colbert weeknights at 11:35 PM ET/10:35 PM CT. Only on CBS.Get the CBS app for iPhone & iPad! Click HERE: http://bit.ly/12rLxgeGet new episodes of shows you love across devices the next day, stream live TV, and watch full seasons of CBS fan favorites anytime, anywhere with CBS All Access. Try it free! http://bit.ly/1OQA29B---The Late Show with Stephen Colbert is the premier late night talk show on CBS, airing at 11:35pm EST, streaming online via CBS All Access, and delivered to the International Space Station on a USB drive taped to a weather balloon. Every night, viewers can expect: Comedy, humor, funny moments, witty interviews, celebrities, famous people, movie stars, bits, humorous celebrities doing bits, funny celebs, big group photos of every star from Hollywood, even the reclusive ones, plus also jokes.","CBS News","wAv5F7GK7Ww"
"252",0,"Trevor Noah: Trump's Response To Coronavirus Is Exposing His Lack Of Leadership","Prior to the pandemic, every test President Trump faced has been a fiasco of his own making, says Trevor Noah, host of ""The Daily Social Distancing Show"" on Comedy Central. #StephenAtHome #TrevorNoah #TheDailyShowSubscribe To ""The Late Show"" Channel HERE: http://bit.ly/ColbertYouTubeFor more content from ""The Late Show with Stephen Colbert"", click HERE: http://bit.ly/1AKISnRWatch full episodes of ""The Late Show"" HERE: http://bit.ly/1Puei40Like ""The Late Show"" on Facebook HERE: http://on.fb.me/1df139YFollow ""The Late Show"" on Twitter HERE: http://bit.ly/1dMzZzGFollow ""The Late Show"" on Google+ HERE: http://bit.ly/1JlGgzwFollow ""The Late Show"" on Instagram HERE: http://bit.ly/29wfREjFollow ""The Late Show"" on Tumblr HERE: http://bit.ly/29DVvtRWatch The Late Show with Stephen Colbert weeknights at 11:35 PM ET/10:35 PM CT. Only on CBS.Get the CBS app for iPhone & iPad! Click HERE: http://bit.ly/12rLxgeGet new episodes of shows you love across devices the next day, stream live TV, and watch full seasons of CBS fan favorites anytime, anywhere with CBS All Access. Try it free! http://bit.ly/1OQA29B---The Late Show with Stephen Colbert is the premier late night talk show on CBS, airing at 11:35pm EST, streaming online via CBS All Access, and delivered to the International Space Station on a USB drive taped to a weather balloon. Every night, viewers can expect: Comedy, humor, funny moments, witty interviews, celebrities, famous people, movie stars, bits, humorous celebrities doing bits, funny celebs, big group photos of every star from Hollywood, even the reclusive ones, plus also jokes.","CBS News","r2xPTP5hr6o"
"253",0,"Anna Kendrick Geeks Out And Sings With Stephen","Star of Pitch Perfects I and II, Anna Kendrick joins Stephen to talk Lord Of The Rings and sing a showtune... so basically his favorite things.""Subscribe To """"The Late Show"""" Channel HERE: http://bit.ly/ColbertYouTubeFor more content from """"The Late Show with Stephen Colbert"""", click HERE: http://bit.ly/1AKISnRWatch full episodes of """"The Late Show"""" HERE: http://bit.ly/1Puei40Download the Colbert App HERE: http://apple.co/1Qqgwk4Like """"The Late Show"""" on Facebook HERE: http://on.fb.me/1df139YFollow """"The Late Show"""" on Twitter HERE: http://bit.ly/1dMzZzGFollow """"The Late Show"""" on Google+ HERE: http://bit.ly/1JlGgzwWatch The Late Show with Stephen Colbert weeknights at 11:35 PM ET/10:35 PM CT. Only on CBS.Get the CBS app for iPhone & iPad! Click HERE: http://bit.ly/12rLxgeGet new episodes of shows you love across devices the next day, stream live TV, and watch full seasons of CBS fan favorites anytime, anywhere with CBS All Access. Try it free! http://bit.ly/1OQA29B---Stephen Colbert took over as host of The Late Show on Tuesday, Sept. 8, 2015. Colbert is best known for his work as a television host, writer, actor, and producer, and best known for his charity work teaching English as a second language on Tunisian date farms. Prior to joining the CBS family -- and being officially adopted by network president Les Moonves -- Colbert helmed “The Colbert Report,” which aired nearly 1,500 episodes and required Stephen to wear nearly 1,500 different neckties. The program received two Peabody Awards, two Grammy Awards, and several unwelcome shoulder massages. It won two Emmys for Outstanding Variety Series in 2013 and 2014, both of which appear to have been lost in the move. Colbert is pronounced koʊlˈbɛər, according to Wikipedia. His understudy is William Cavanaugh, who will be hosting The Late Show approximately one third of the time. Good luck, Bill!""","CBS News","YI5l5ltMl8g"
"254",0,"Robert De Niro Turns The Tables On Stephen Colbert","The star of ""The Irishman"" on Netflix celebrates his third visit to The Late Show by hopping behind our host's desk and making Stephen Colbert answer the questions. #Colbert #RobertDeNiro #TheIrishmanSubscribe To ""The Late Show"" Channel HERE: http://bit.ly/ColbertYouTubeFor more content from ""The Late Show with Stephen Colbert"", click HERE: http://bit.ly/1AKISnRWatch full episodes of ""The Late Show"" HERE: http://bit.ly/1Puei40Like ""The Late Show"" on Facebook HERE: http://on.fb.me/1df139YFollow ""The Late Show"" on Twitter HERE: http://bit.ly/1dMzZzGFollow ""The Late Show"" on Google+ HERE: http://bit.ly/1JlGgzwFollow ""The Late Show"" on Instagram HERE: http://bit.ly/29wfREjFollow ""The Late Show"" on Tumblr HERE: http://bit.ly/29DVvtRWatch The Late Show with Stephen Colbert weeknights at 11:35 PM ET/10:35 PM CT. Only on CBS.Get the CBS app for iPhone & iPad! Click HERE: http://bit.ly/12rLxgeGet new episodes of shows you love across devices the next day, stream live TV, and watch full seasons of CBS fan favorites anytime, anywhere with CBS All Access. Try it free! http://bit.ly/1OQA29B---The Late Show with Stephen Colbert is the premier late night talk show on CBS, airing at 11:35pm EST, streaming online via CBS All Access, and delivered to the International Space Station on a USB drive taped to a weather balloon. Every night, viewers can expect: Comedy, humor, funny moments, witty interviews, celebrities, famous people, movie stars, bits, humorous celebrities doing bits, funny celebs, big group photos of every star from Hollywood, even the reclusive ones, plus also jokes.","CBS News","7YrYB5LxBK4"
"255",0,"Max Greenfield Wasn't Qualified, But He Got The Job","In a situation that sounds oddly familiar to the current state of national affairs, the actor explains how he landed a plum new gig with absolutely no experience.Subscribe To ""The Late Show"" Channel HERE: http://bit.ly/ColbertYouTubeFor more content from ""The Late Show with Stephen Colbert"", click HERE: http://bit.ly/1AKISnRWatch full episodes of ""The Late Show"" HERE: http://bit.ly/1Puei40Like ""The Late Show"" on Facebook HERE: http://on.fb.me/1df139YFollow ""The Late Show"" on Twitter HERE: http://bit.ly/1dMzZzGFollow ""The Late Show"" on Google+ HERE: http://bit.ly/1JlGgzwFollow ""The Late Show"" on Instagram HERE: http://bit.ly/29wfREjFollow ""The Late Show"" on Tumblr HERE: http://bit.ly/29DVvtRWatch The Late Show with Stephen Colbert weeknights at 11:35 PM ET/10:35 PM CT. Only on CBS.Get the CBS app for iPhone & iPad! Click HERE: http://bit.ly/12rLxgeGet new episodes of shows you love across devices the next day, stream live TV, and watch full seasons of CBS fan favorites anytime, anywhere with CBS All Access. Try it free! http://bit.ly/1OQA29B---The Late Show with Stephen Colbert is the premier late night talk show on CBS, airing at 11:35pm EST, streaming online via CBS All Access, and delivered to the International Space Station on a USB drive taped to a weather balloon. Every night, viewers can expect: Comedy, humor, funny moments, witty interviews, celebrities, famous people, movie stars, bits, humorous celebrities doing bits, funny celebs, big group photos of every star from Hollywood, even the reclusive ones, plus also jokes.","CBS News","AVNmUgOGTPY"
"256",0,"Hasan Minhaj: To Enjoy America's Successes, We Have To Own Its Failures","Hasan Minhaj is using his platform to remind Americans, particularly those in the Asian-American community, that being a citizen means standing up for fellow citizens when injustices occur. New episodes of his show ""Patriot Act with Hasan Minhaj"" are on Netflix every Sunday. #StephenAtHome #PatriotAct #HasanMinhajSubscribe To ""The Late Show"" Channel HERE: http://bit.ly/ColbertYouTubeFor more content from ""The Late Show with Stephen Colbert"", click HERE: http://bit.ly/1AKISnRWatch full episodes of ""The Late Show"" HERE: http://bit.ly/1Puei40Like ""The Late Show"" on Facebook HERE: http://on.fb.me/1df139YFollow ""The Late Show"" on Twitter HERE: http://bit.ly/1dMzZzGFollow ""The Late Show"" on Google+ HERE: http://bit.ly/1JlGgzwFollow ""The Late Show"" on Instagram HERE: http://bit.ly/29wfREjFollow ""The Late Show"" on Tumblr HERE: http://bit.ly/29DVvtRWatch The Late Show with Stephen Colbert weeknights at 11:35 PM ET/10:35 PM CT. Only on CBS.Get the CBS app for iPhone & iPad! Click HERE: http://bit.ly/12rLxgeGet new episodes of shows you love across devices the next day, stream live TV, and watch full seasons of CBS fan favorites anytime, anywhere with CBS All Access. Try it free! http://bit.ly/1OQA29B---The Late Show with Stephen Colbert is the premier late night talk show on CBS, airing at 11:35pm EST, streaming online via CBS All Access, and delivered to the International Space Station on a USB drive taped to a weather balloon. Every night, viewers can expect: Comedy, humor, funny moments, witty interviews, celebrities, famous people, movie stars, bits, humorous celebrities doing bits, funny celebs, big group photos of every star from Hollywood, even the reclusive ones, plus also jokes.","CBS News","NRl_tpv_UJI"
"257",0,"Rowan Atkinson Dusts Off An Old Comedy Bit","'Johnny English Strikes Again' star Rowan Atkinson gives Stephen a taste of the old bit he used to do that got seven minutes of laughter without using a single word.Subscribe To ""The Late Show"" Channel HERE: http://bit.ly/ColbertYouTubeFor more content from ""The Late Show with Stephen Colbert"", click HERE: http://bit.ly/1AKISnRWatch full episodes of ""The Late Show"" HERE: http://bit.ly/1Puei40Like ""The Late Show"" on Facebook HERE: http://on.fb.me/1df139YFollow ""The Late Show"" on Twitter HERE: http://bit.ly/1dMzZzGFollow ""The Late Show"" on Google+ HERE: http://bit.ly/1JlGgzwFollow ""The Late Show"" on Instagram HERE: http://bit.ly/29wfREjFollow ""The Late Show"" on Tumblr HERE: http://bit.ly/29DVvtRWatch The Late Show with Stephen Colbert weeknights at 11:35 PM ET/10:35 PM CT. Only on CBS.Get the CBS app for iPhone & iPad! Click HERE: http://bit.ly/12rLxgeGet new episodes of shows you love across devices the next day, stream live TV, and watch full seasons of CBS fan favorites anytime, anywhere with CBS All Access. Try it free! http://bit.ly/1OQA29B---The Late Show with Stephen Colbert is the premier late night talk show on CBS, airing at 11:35pm EST, streaming online via CBS All Access, and delivered to the International Space Station on a USB drive taped to a weather balloon. Every night, viewers can expect: Comedy, humor, funny moments, witty interviews, celebrities, famous people, movie stars, bits, humorous celebrities doing bits, funny celebs, big group photos of every star from Hollywood, even the reclusive ones, plus also jokes.","CBS News","xl9XI_LvkHg"
"258",0,"Judge denies injunction to block Bolton's book","A federal judge is allowing former national security adviser John Bolton to release his book about his time in the Trump administration. In it, Bolton makes explosive claims about President Trump, depicting him as unfit for office. CBS News correspondent Nikole Killion has the latest from the White House.","CBS News","hF7X3j10KHc"
"259",0,"UN report warns climate change is reducing planet's ability to support humanity","A new report by the United Nations warns that the world's food supply is at risk, and the window to save the planet is closing. CBS News contributing meteorologist Jeff Berardelli explains what we can do to reduce our carbon footprint.","CBS News","i2ILhwMysRQ"
"260",0,"Trevor Noah Was 'Born a Crime' in South Africa","Born to mixed-race parents in apartheid-era Soweto, Noah's very existence was illegal, hence the title for his forthcoming book.Subscribe To ""The Late Show"" Channel HERE: http://bit.ly/ColbertYouTubeFor more content from ""The Late Show with Stephen Colbert"", click HERE: http://bit.ly/1AKISnRWatch full episodes of ""The Late Show"" HERE: http://bit.ly/1Puei40Like ""The Late Show"" on Facebook HERE: http://on.fb.me/1df139YFollow ""The Late Show"" on Twitter HERE: http://bit.ly/1dMzZzGFollow ""The Late Show"" on Google+ HERE: http://bit.ly/1JlGgzwFollow ""The Late Show"" on Instagram HERE: http://bit.ly/29wfREjFollow ""The Late Show"" on Tumblr HERE: http://bit.ly/29DVvtRWatch The Late Show with Stephen Colbert weeknights at 11:35 PM ET/10:35 PM CT. Only on CBS.Get the CBS app for iPhone & iPad! Click HERE: http://bit.ly/12rLxgeGet new episodes of shows you love across devices the next day, stream live TV, and watch full seasons of CBS fan favorites anytime, anywhere with CBS All Access. Try it free! http://bit.ly/1OQA29B---Stephen Colbert took over as host of The Late Show on Tuesday, Sept. 8, 2015. Colbert is best known for his work as a television host, writer, actor, and producer, and best known for his charity work teaching English as a second language on Tunisian date farms. Prior to joining the CBS family -- and being officially adopted by network president Les Moonves -- Colbert helmed “The Colbert Report,” which aired nearly 1,500 episodes and required Stephen to wear nearly 1,500 different neckties. The program received two Peabody Awards, two Grammy Awards, and several unwelcome shoulder massages. It won two Emmys for Outstanding Variety Series in 2013 and 2014, both of which appear to have been lost in the move. Colbert is pronounced koʊlˈbɛər, according to Wikipedia. His understudy is William Cavanaugh, who will be hosting The Late Show approximately one third of the time. Good luck, Bill!""","CBS News","WHKOJgUDRDM"
"261",0,"David Oyelowo Knows Nigeria Isn't A 'Sh*thole' Country","'Gringo' star David Oyelowo discusses his Nigerian blood, Trump's 'sh*thole' comments, and the significance of 'Black Panther.'Subscribe To ""The Late Show"" Channel HERE: http://bit.ly/ColbertYouTubeFor more content from ""The Late Show with Stephen Colbert"", click HERE: http://bit.ly/1AKISnRWatch full episodes of ""The Late Show"" HERE: http://bit.ly/1Puei40Like ""The Late Show"" on Facebook HERE: http://on.fb.me/1df139YFollow ""The Late Show"" on Twitter HERE: http://bit.ly/1dMzZzGFollow ""The Late Show"" on Google+ HERE: http://bit.ly/1JlGgzwFollow ""The Late Show"" on Instagram HERE: http://bit.ly/29wfREjFollow ""The Late Show"" on Tumblr HERE: http://bit.ly/29DVvtRWatch The Late Show with Stephen Colbert weeknights at 11:35 PM ET/10:35 PM CT. Only on CBS.Get the CBS app for iPhone & iPad! Click HERE: http://bit.ly/12rLxgeGet new episodes of shows you love across devices the next day, stream live TV, and watch full seasons of CBS fan favorites anytime, anywhere with CBS All Access. Try it free! http://bit.ly/1OQA29B---The Late Show with Stephen Colbert is the premier late night talk show on CBS, airing at 11:35pm EST, streaming online via CBS All Access, and delivered to the International Space Station on a USB drive taped to a weather balloon. Every night, viewers can expect: Comedy, humor, funny moments, witty interviews, celebrities, famous people, movie stars, bits, humorous celebrities doing bits, funny celebs, big group photos of every star from Hollywood, even the reclusive ones, plus also jokes.","CBS News","n5nLPg6a2D0"
"262",0,"David Oyelowo Stayed In Character As MLK, Much To His Wife's Chagrin","David Oyelowo, star of 'A United Kingdom,' didn't break character while filming 'Selma,' which made for some interesting situations off set.Subscribe To ""The Late Show"" Channel HERE: http://bit.ly/ColbertYouTubeFor more content from ""The Late Show with Stephen Colbert"", click HERE: http://bit.ly/1AKISnRWatch full episodes of ""The Late Show"" HERE: http://bit.ly/1Puei40Like ""The Late Show"" on Facebook HERE: http://on.fb.me/1df139YFollow ""The Late Show"" on Twitter HERE: http://bit.ly/1dMzZzGFollow ""The Late Show"" on Google+ HERE: http://bit.ly/1JlGgzwFollow ""The Late Show"" on Instagram HERE: http://bit.ly/29wfREjFollow ""The Late Show"" on Tumblr HERE: http://bit.ly/29DVvtRWatch The Late Show with Stephen Colbert weeknights at 11:35 PM ET/10:35 PM CT. Only on CBS.Get the CBS app for iPhone & iPad! Click HERE: http://bit.ly/12rLxgeGet new episodes of shows you love across devices the next day, stream live TV, and watch full seasons of CBS fan favorites anytime, anywhere with CBS All Access. Try it free! http://bit.ly/1OQA29B---The Late Show with Stephen Colbert is the premier late night talk show on CBS, airing at 11:35pm EST, streaming online via CBS All Access, and delivered to the International Space Station on a USB drive taped to a weather balloon. Every night, viewers can expect: Comedy, humor, funny moments, witty interviews, celebrities, famous people, movie stars, bits, humorous celebrities doing bits, funny celebs, big group photos of every star from Hollywood, even the reclusive ones, plus also jokes.","CBS News","D18oDGK8klQ"
"263",0,"Trump Distances Himself From The Racist Chant He Inspired","Stephen breaks out the stopwatch after Donald Trump claims he ''quickly'' cut off his MAGA rally's''send her back!'' chant.Subscribe To ""The Late Show"" Channel HERE: http://bit.ly/ColbertYouTubeFor more content from ""The Late Show with Stephen Colbert"", click HERE: http://bit.ly/1AKISnRWatch full episodes of ""The Late Show"" HERE: http://bit.ly/1Puei40Like ""The Late Show"" on Facebook HERE: http://on.fb.me/1df139YFollow ""The Late Show"" on Twitter HERE: http://bit.ly/1dMzZzGFollow ""The Late Show"" on Google+ HERE: http://bit.ly/1JlGgzwFollow ""The Late Show"" on Instagram HERE: http://bit.ly/29wfREjFollow ""The Late Show"" on Tumblr HERE: http://bit.ly/29DVvtRWatch The Late Show with Stephen Colbert weeknights at 11:35 PM ET/10:35 PM CT. Only on CBS.Get the CBS app for iPhone & iPad! Click HERE: http://bit.ly/12rLxgeGet new episodes of shows you love across devices the next day, stream live TV, and watch full seasons of CBS fan favorites anytime, anywhere with CBS All Access. Try it free! http://bit.ly/1OQA29B---The Late Show with Stephen Colbert is the premier late night talk show on CBS, airing at 11:35pm EST, streaming online via CBS All Access, and delivered to the International Space Station on a USB drive taped to a weather balloon. Every night, viewers can expect: Comedy, humor, funny moments, witty interviews, celebrities, famous people, movie stars, bits, humorous celebrities doing bits, funny celebs, big group photos of every star from Hollywood, even the reclusive ones, plus also jokes.","CBS News","mai5kYiRhzU"
"264",0,"John Oliver Warns Meghan Markle What She's Getting Herself Into","'Last Week Tonight' host John Oliver gives Meghan Markle a fair warning ahead of the upcoming Royal Wedding.Subscribe To ""The Late Show"" Channel HERE: http://bit.ly/ColbertYouTubeFor more content from ""The Late Show with Stephen Colbert"", click HERE: http://bit.ly/1AKISnRWatch full episodes of ""The Late Show"" HERE: http://bit.ly/1Puei40Like ""The Late Show"" on Facebook HERE: http://on.fb.me/1df139YFollow ""The Late Show"" on Twitter HERE: http://bit.ly/1dMzZzGFollow ""The Late Show"" on Google+ HERE: http://bit.ly/1JlGgzwFollow ""The Late Show"" on Instagram HERE: http://bit.ly/29wfREjFollow ""The Late Show"" on Tumblr HERE: http://bit.ly/29DVvtRWatch The Late Show with Stephen Colbert weeknights at 11:35 PM ET/10:35 PM CT. Only on CBS.Get the CBS app for iPhone & iPad! Click HERE: http://bit.ly/12rLxgeGet new episodes of shows you love across devices the next day, stream live TV, and watch full seasons of CBS fan favorites anytime, anywhere with CBS All Access. Try it free! http://bit.ly/1OQA29B---The Late Show with Stephen Colbert is the premier late night talk show on CBS, airing at 11:35pm EST, streaming online via CBS All Access, and delivered to the International Space Station on a USB drive taped to a weather balloon. Every night, viewers can expect: Comedy, humor, funny moments, witty interviews, celebrities, famous people, movie stars, bits, humorous celebrities doing bits, funny celebs, big group photos of every star from Hollywood, even the reclusive ones, plus also jokes.","CBS News","Huab6p5HW0E"
"265",0,"Trump set to impose new Iran sanctions, warns of ""obliteration"" if war erupts","President Trump is set to impose new sanctions on Iran. This comes after the country downed a U.S. drone and allegedly attacked oil tankers in the Middle East. CBS News White House correspondent Ben Tracy reports from Washington, and Asha Castleberry, a national security analyst, U.S. Army veteran and foreign policy professor at George Washington University, joined CBSN to explain the latest developments.","CBS News","Q2hyj93VFuw"
