,Bias_num,text
0,0,Dawkins is famous as the author of  Selfish Gene the blind watchmaker and many other popular science books going back decades but hes a controversial figure out and about on Twitter these days railing against fundamentalist religious beliefs and non fundamentalist beliefs in ways that many have found objectionable he has his own foundations  reason and science one here one in the u.s. designed to try and remove the influence of religion from education and public life with religion community relations and tolerance much in the news at the moment we thought wed get his take in the wake of the Charlie Hebdo attacks we were in the midst of a big debate really are we about the relationship between religious fundamentalists and the rest of society it was interesting that the mer Archbishop of Canterbury on  last week said the debate isnt really won between Christians and Muslims its more between the secular society and Muslims which I thought was an interesting observation but what do you think the rules of the game should be between a modern liberal democracy between these different groups you have very very different yes I mean I think thats oh thats a very profoundly important question I think the rules of the game are that you should be allowed to believe anything you like and of course thats  thats right but that you shouldnt impose your beliefs on other people and so any creed that thinks it has the right to say not only do we believe this but youve got to believe it too or else I mean that is a very very serious violation of everything that democracy stands  so lets take some examples could burqa bans they have a burqa ban in France you wouldnt be in favor of that I know I Im not in favor of a burka ban it seems to me to be a violation of individual liberty so it mean when I see a woman in a fall in a full burqa with just justice lit by feel personally offended but its part of its an important part of what I believe that what I feel personally is irrelevant it doesnt matter what I feel nobody else should abide by what I feel and that applies of course on the other side as well what about religious schools so a community sets up a school maybe pays  it itself that doesnt subscribe to your views of Education that youve set out today and now is that a freedom of speech thing  them to be able to teach what they want or not thats very difficult because there there were trespassing on the the tussle between the freedom of speech of parents to impose their views on children and the freedom of children to be educated without having erroneous views and we now know that in some cases it definitely is erroneous this is not a matter of opinion imposed upon them but youre not against teaching history and things like that oh heavens no no attractive her very keen on teaching history teaching literature very keen on teaching religion as a matter of fact I mean teaching about religion not indoctrinating in any particular religion because that good right against the spirit or critical thinking its a tricky one though isnt it because you cant build a society on the basis that you know youre right and you know that other people are wrong can you because the liberal society is we dont have to make that decision no thats your I decide yes you think and you decide what you think but you are really saying that they have to teach children have to be taught in your Creed well no no at night that there is a difference I mean let me use the example youve just used of the the but the burka ban thats a matter of opinion and theyre the society it seems to me has no right to impose on other people evolution is not a matter of opinion its a matter of fact the evidence is as overwhelming as in the case of oh that the Earth orbits the Sun thats not up  dispute you are in the camber as really I probably associated as being one of the most and I think the disparaging phrases militant atheists in the property um what do you think of that phrase what do you think of that accusation and do you if you like revel in that place or do you hate it when people try and if you like put you in the same category as fanatics on other sides of the religious well fanatics religious fanatics are apt to take the law into their own hands on occasion out there and actually threaten people actually use physical violence but you choose to go onto Twitter its not a scientific a venue  scientific debate you choose to go on Twitter just to take one example a tweet in which you drew a very invidious comparison between the number of Nobel Prizes won by people from Trinity College Cambridge and the entire Muslim population of the world Trinity code College Cambridge comes out on top on that of that comparison now not disputing the factual basis of it why make such an invidious comparison why raise that why raise the issue what is it whats the point of of drawing attention it is a fact that in the Dark Ages and Middle Ages the Islamic world was a beacon of scientific progress and enlightenment and something has gone wrong I had dinner with the then Chief Rabbi Jonathan Sacks a few months ago and learned there the astonishing fact that between 20 and 2 percent of all scientific Nobel Prizes have been won by Jews and I thought that was a stunning fact it really is I mean when you think of the total population of Jews in the world is is tiny compared to really any other of the major major religions so I I wanted to make this point that Islam has stagnated in the scientific field since them since the Middle Ages and the best comparison to make would have been with Jews and then I thought oh no I cant do that because that may really have upset people because of Palestine and Im very sympathetic to the plight of the Palestinian people in Israel so at the last minute I crossed out Jews and stuck in Trinity College Cambridge but I can think of much more gentlemanly ways of making the intellectual point that Islam has not being a great story country its just a fact whether or not it upsets people is less important to me than the dramatic nature of the fad which ought to be looked at somebody ought to be saying why but you would agree that you pick an argument with people of religion or religions dont make an argument suggest your way to say thing with the Sun pointed about that religion or those groups of people its a good point that the best way to convert people is not necessarily to tell them their ideas and I have occasionally seemed guilty of that  example I once wrote in  New York Times that anyone who doesnt believe in evolution is either ignorant stupid or insane now that sounds like an extreme point of view its actually a factual point of view because the word ignorant is not a disparaging word I make the rent of all sorts of things and so are you Im sure and we would be quite happy to own up to being ignorant of many things ignorant of  or ignorant of art or what even were to baseball whatever it might be I think a lot of moderate religious people are very turned off by your by your disco well some may be and thats thats a political that may be my political error there are technical error in terms because your job you see your role is trying to convert the world to your point of view I think I mean no I see I see my role as crying to try to persuade people to think  themselves and look at evidence thats I mean if they come round to my point of view as a result of looking at evidence then so much the better have you ever been wrong about anything important oh yeah give me  that what well Id have to go into sort of rather recondite scientific matters but Ive Ive been wrong on scientific questions and have said so scientists actually rather like being wrong its its its unlike politicians they get a sort of kudos from from admitting that theyre wrong because thats how science proceeds Richard Dawkins thank you thank you very much
1,0,"Of the last five pandemics the world has facednin about a century, four had multiple wavesnof infection outbreaks. In some cases the second or third wavesnturned out to be far more severe than the first. As governments around the world weigh the trade-offsnbetween reopening their economies and continuing lockdown restrictions,nwhat can we learn from history?  worst pandemic in modern history,nthe Spanish flu, which is estimated to have infectedna third of the world’s population, had three waves of infection.  first wave was in the spring of 1918,nwhile the second wave happened in autumn that year.  third wave occurred a few months later,nwhich lasted till the spring of 1919. You can see the pandemic peakednin the highly fatal second wave, which was responsiblen most of the deaths. Many health experts have saidnthat history may repeat itself.  World Health Organization has warned thatnthe worst of the Covid-19 pandemic is yet to come. But with widespread unemploymentnand many companies battling to stay afloat, there are calls to end the social restrictionsnand reopen the economy. Tesla CEO Elon Musk has also lashed out atngovernment stay at home orders as “fascist”. And thats a feeling sharednby an increasing number of Americans. You heard Elon Musk’s comments.nI think that reflects a growing sentiment in this country where peoplenwant this to be over. So that is going to tug againstnwhat the governors have to do. y have tough decisions to face. However, many analysts have warnednagainst reopening the economy too soon, which may derail current eftsnto stem the crisis.  island of Hokkaidonin the northern part of Japan was ced back into a lockdown after a second wavenhit the region more severely than the first. Singapore, which was lauded nits early efts to stem the pandemic, also recorded a second wavenof infections in March, mainly from imported cases andnmigrant workers living in packed dormitories. A survey of more than 0nprominent economists in the U.S. found that 80% agreed easing severe lockdownnwhen infection risk remains high would lead to greaterneconomic damage. As the debate over when tonreopen the economy drags on, the Spanish flu offers some clues. In 1918, the U.S. had no coordinatednpandemic plans at a federal level. It was theree leftnto local authorities to decide how and when to intervenento prevent the spread of the disease.  social distancing measures over a century agonare similar to the modern-day restrictions such as the closure of schools, officesnand the banning of mass gatherings. Because tackling the infection spreadnwas orchestrated at a local level, the interventions varied widely.nThis led to the mortality rates and the pace of economic recovery differingnfrom city to city at the end of the pandemic. In 1917, a year bee the Spanish flu outbreak,nPhiladelphia and St. Louis had very similar mortality rates from influenza and pneumonia.nHowever, when the pandemic broke a year later, the two cities had very different approachesnto tackling the outbreak. Philadelphia was very latento implement social restrictions and even allowed a large street paradeninvolving some 200,000 people to go ahead in thenmiddle of the outbreak. Three days after the parade, every bed was fillednin Philadelphia’s 31 hospitals. In contrast, St. Louis officials intervened quickly,nresulting in a much lower death rate.  evidence also shows that cities whichnintervened sooner and more decisively saw their economies grow fasternafter the pandemic was over. For instance, this graph shows how citiesnwith stricter social distancing measures recovered fasternone year after the 1918 pandemic. However, cities in red, with more lenient measuresngenerally permed worse. In cities that implemented social distancing measuresnquickly and  longer, manufacturing activity and banking assets also sawnincreased growth a year after the pandemic was over.  evidence suggests thatnaggressive social distancing measures not only reduced mortality ratesnbut were also economically beneficial. While there are important economic lessonsnto be learnt from the Spanish flu of 1918, it’s difficult to compare that pandemic,nwhich occurred more than a hundred years ago, with the coronavirus pandemic of today.nAdvances in technology, global supply chains, the larger role of services and better communicationntools may ease the economic fallout significantly, which limits direct comparisonsnbetween the two pandemics. However, the evidence does implynthat decisive social restrictions to reduce the severity of a pandemic playsna key role in the economic recovery process. So how can both livelihoodsnand lives be saved? While there are no easy answers,nrevisiting the past offers a glimpse into the future. After all, a healthy economy doesn’t happennwithout a healthy population. Hi guys.nThanks  watching our video. If there are any topics youd like us to cover in the future,ncomment below the video to let us know. And remember,ndont get to subscribe."
