"","Bias_num","title","description","channel","id"
"209",1,"Candace Owens: The left has become desperate","Turning Point USA's Candace Owens speaks out on 'Watters' World' after her exchange with Rep. Ted Lieu that broke an online viewing record.FOX News operates the FOX News Channel (FNC), FOX Business Network (FBN), FOX News Radio, FOX News Headlines 24/7, FOXNews.com and the direct-to-consumer streaming service, FOX Nation. FOX News also produces FOX News Sunday on FOX Broadcasting Company and FOX News Edge. A top five-cable network, FNC has been the most watched news channel in the country for 17 consecutive years. According to a 2018 Research Intelligencer study by Brand Keys, FOX News ranks as the second most trusted television brand in the country. Additionally, a Suffolk University/USA Today survey states Fox News is the most trusted source for television news or commentary in the country, while a 2017 Gallup/Knight Foundation survey found that among Americans who could name an objective news source, FOX News is the top-cited outlet. FNC is available in nearly 90 million homes and dominates the cable news landscape while routinely notching the top ten programs in the genre. Subscribe to Fox News!  https://bit.ly/2vBUvASWatch more Fox News Video: http://video.foxnews.comWatch Fox News Channel Live: http://www.foxnewsgo.com/Watch full episodes of your favorite showsThe Five: http://video.foxnews.com/playlist/lon...Special Report with Bret Baier: http://video.foxnews.com/playlist/lon...The Story with Martha Maccallum: http://video.foxnews.com/playlist/lon...Tucker Carlson Tonight: http://video.foxnews.com/playlist/lon...Hannity:  http://video.foxnews.com/playlist/lon...The Ingraham Angle: http://video.foxnews.com/playlist/lon...Fox News @ Night: http://video.foxnews.com/playlist/lon... Follow Fox News on Facebook: https://www.facebook.com/FoxNews/Follow Fox News on Twitter: https://twitter.com/FoxNews/Follow Fox News on Instagram: https://www.instagram.com/foxnews/","Fox News","J77YacAk_bE"
"210",1,"Live: NY Gov Cuomo holds coronavirus press conferece","New York Governor Andrew Cuomo holds a press briefing on coronavirus numbers.This event is subject to delays in start time.FOX News operates the FOX News Channel (FNC), FOX Business Network (FBN), FOX News Radio, FOX News Headlines 24/7, FOXNews.com and the direct-to-consumer streaming service, FOX Nation. FOX News also produces FOX News Sunday on FOX Broadcasting Company and FOX News Edge. A top five-cable network, FNC has been the most watched news channel in the country for 17 consecutive years. According to a 2018 Research Intelligencer study by Brand Keys, FOX News ranks as the second most trusted television brand in the country. Additionally, a Suffolk University/USA Today survey states Fox News is the most trusted source for television news or commentary in the country, while a 2017 Gallup/Knight Foundation survey found that among Americans who could name an objective news source, FOX News is the top-cited outlet. FNC is available in nearly 90 million homes and dominates the cable news landscape while routinely notching the top ten programs in the genre. Subscribe to Fox News!  https://bit.ly/2vBUvASWatch more Fox News Video: http://video.foxnews.comWatch Fox News Channel Live: http://www.foxnewsgo.com/Watch full episodes of your favorite showsThe Five: http://video.foxnews.com/playlist/lon...Special Report with Bret Baier: http://video.foxnews.com/playlist/lon...The Story with Martha Maccallum: http://video.foxnews.com/playlist/lon...Tucker Carlson Tonight: http://video.foxnews.com/playlist/lon...Hannity:  http://video.foxnews.com/playlist/lon...The Ingraham Angle: http://video.foxnews.com/playlist/lon...Fox News @ Night: http://video.foxnews.com/playlist/lon... Follow Fox News on Facebook: https://www.facebook.com/FoxNews/Follow Fox News on Twitter: https://twitter.com/FoxNews/Follow Fox News on Instagram: https://www.instagram.com/foxnews/om/","Fox News","8RNNCmY-SXw"
"211",1,"Are Trump's economic policies helping African Americans?","Harvard philosophy professor Dr. Cornel West debates Blexit Movement founder Candace Owens on 'The Ingraham Angle.' FOX News operates the FOX News Channel (FNC), FOX Business Network (FBN), FOX News Radio, FOX News Headlines 24/7, FOXNews.com and the direct-to-consumer streaming service, FOX Nation. FOX News also produces FOX News Sunday on FOX Broadcasting Company and FOX News Edge. A top five-cable network, FNC has been the most watched news channel in the country for 17 consecutive years. According to a 2018 Research Intelligencer study by Brand Keys, FOX News ranks as the second most trusted television brand in the country. Additionally, a Suffolk University/USA Today survey states Fox News is the most trusted source for television news or commentary in the country, while a 2017 Gallup/Knight Foundation survey found that among Americans who could name an objective news source, FOX News is the top-cited outlet. FNC is available in nearly 90 million homes and dominates the cable news landscape while routinely notching the top ten programs in the genre.Subscribe to Fox News!  https://bit.ly/2vBUvASWatch more Fox News Video: http://video.foxnews.comWatch Fox News Channel Live: http://www.foxnewsgo.com/Watch full episodes of your favorite showsThe Five: http://video.foxnews.com/playlist/lon...Special Report with Bret Baier: http://video.foxnews.com/playlist/lon...The Story with Martha Maccallum: http://video.foxnews.com/playlist/lon...Tucker Carlson Tonight: http://video.foxnews.com/playlist/lon...Hannity:  http://video.foxnews.com/playlist/lon...The Ingraham Angle: http://video.foxnews.com/playlist/lon...Fox News @ Night: http://video.foxnews.com/playlist/lon...Follow Fox News on Facebook: https://www.facebook.com/FoxNews/Follow Fox News on Twitter: https://twitter.com/FoxNews/Follow Fox News on Instagram: https://www.instagram.com/foxnews/","Fox News","CnTPBK4BrNQ"
"212",1,"Barber belittled by CNN anchor speaks out on ‘Tucker Carlson Tonight’","California barbershop owner, Juan Desamarais, explains how his business has changed since tense interview with CNN's Brooke Baldwin. #FoxNews #TuckerFOX News operates the FOX News Channel (FNC), FOX Business Network (FBN), FOX News Radio, FOX News Headlines 24/7, FOXNews.com and the direct-to-consumer streaming service, FOX Nation. FOX News also produces FOX News Sunday on FOX Broadcasting Company and FOX News Edge. A top five-cable network, FNC has been the most-watched news channel in the country for 17 consecutive years. According to a 2018 Research Intelligencer study by Brand Keys, FOX News ranks as the second most trusted television brand in the country. Additionally, a Suffolk University/USA Today survey states Fox News is the most trusted source for television news or commentary in the country, while a 2017 Gallup/Knight Foundation survey found that among Americans who could name an objective news source, FOX News is the top-cited outlet. FNC is available in nearly 90 million homes and dominates the cable news landscape while routinely notching the top ten programs in the genre. Subscribe to Fox News!  https://bit.ly/2vBUvASWatch more Fox News Video: http://video.foxnews.comWatch Fox News Channel Live: http://www.foxnewsgo.com/Watch full episodes of your favorite showsThe Five: http://video.foxnews.com/playlist/lon...Special Report with Bret Baier: http://video.foxnews.com/playlist/lon...The Story with Martha MacCallum: http://video.foxnews.com/playlist/lon...Tucker Carlson Tonight: http://video.foxnews.com/playlist/lon...Hannity:  http://video.foxnews.com/playlist/lon...The Ingraham Angle: http://video.foxnews.com/playlist/lon...Fox News @ Night: http://video.foxnews.com/playlist/lon... Follow Fox News on Facebook: https://www.facebook.com/FoxNews/Follow Fox News on Twitter: https://twitter.com/FoxNews/Follow Fox News on Instagram: https://www.instagram.com/foxnews/","Fox News","u44IN1FniKM"
"213",1,"Online critic claims Mike Rowe promoting white nationalism","CEO of mikeroweWORKS Foundation & Host of the new Facebook show 'Returning the Favor' responds to criticism","Fox News","kLgcl-3nqXc"
"214",1,"Mike Rowe: Men feel emasculated by unemployment","'Men in America': Former 'Dirty Jobs' host gives his perspective on the effect of unemployment on men in the U.S. and why he believes work is not seen as a virtue in today's society. #TuckerFOX News Channel (FNC) is a 24-hour all-encompassing news service dedicated to delivering breaking news as well as political and business news. The number one network in cable, FNC has been the most watched television news channel for more than 15 years and according to a Suffolk University/USA Today poll, is the most trusted television news source in the country. Owned by 21st Century Fox, FNC is available in more than 90 million homes and dominates the cable news landscape, routinely notching the top ten programs in the genre. Subscribe to Fox News!  https://www.youtube.com/user/FoxNewsC...Watch more Fox News Video: http://video.foxnews.comWatch Fox News Channel Live: http://www.foxnewsgo.com/ Watch full episodes of your favorite showsThe Five: http://video.foxnews.com/playlist/lon...Special Report with Bret Baier: http://video.foxnews.com/playlist/lon...The Story with Martha Maccallum: http://video.foxnews.com/playlist/lon...Tucker Carlson Tonight http://video.foxnews.com/playlist/lon...Hannity http://video.foxnews.com/playlist/lon...The Ingraham Angle: http://video.foxnews.com/playlist/lon...Fox News @ Night: http://video.foxnews.com/playlist/lon... Follow Fox News on Facebook: https://www.facebook.com/FoxNews/Follow Fox News on Twitter: https://twitter.com/FoxNews/Follow Fox News on Instagram: https://www.instagram.com/foxnews/","Fox News","o7am8ArNi_Q"
"215",1,"Rep. Doug Collins: The 'S' on James Comey's chest is simply 'shame'","Both the House and Senate are scheduled to return to session, as coronavirus stay-at-home orders remain for the District of Columbia, Virginia and Maryland; Georgia Congressman Doug Collins weighs in.Subscribe to Fox News! https://bit.ly/2vBUvASWatch more Fox News Video: http://video.foxnews.comWatch Fox News Channel Live: http://www.foxnewsgo.com/FOX News Channel (FNC) is a 24-hour all-encompassing news service delivering breaking news as well as political and business news. The number one network in cable, FNC has been the most-watched television news channel for 18 consecutive years. According to a 2020 Brand Keys Consumer Loyalty Engagement Index report, FOX News is the top brand in the country for morning and evening news coverage. A 2019 Suffolk University poll named FOX News as the most trusted source for television news or commentary, while a 2019 Brand Keys Emotion Engagement Analysis survey found that FOX News was the most trusted cable news brand. A 2017 Gallup/Knight Foundation survey also found that among Americans who could name an objective news source, FOX News was the top-cited outlet. Owned by FOX Corporation, FNC is available in nearly 90 million homes and dominates the cable news landscape, routinely notching the top ten programs in the genre.Watch full episodes of your favorite showsThe Five: http://video.foxnews.com/playlist/lon...Special Report with Bret Baier: http://video.foxnews.com/playlist/lon...The Story with Martha Maccallum: http://video.foxnews.com/playlist/lon...Tucker Carlson Tonight: http://video.foxnews.com/playlist/lon...Hannity:  http://video.foxnews.com/playlist/lon...The Ingraham Angle: http://video.foxnews.com/playlist/lon...Fox News @ Night: http://video.foxnews.com/playlist/lon...Follow Fox News on Facebook: https://www.facebook.com/FoxNews/Follow Fox News on Twitter: https://twitter.com/FoxNews/Follow Fox News on Instagram: https://www.instagram.com/foxnews/","Fox News","VqgZ5AAN0LQ"
"216",1,"Professor objects to no white people on campus demand","Bret Weinstein, professor of Evergreen State College, pushed back on a student demand that all white people get off campus for a day because of racism and received a lot of abuse for it. He tells his story to Tucker #Tucker","Fox News","_j9nFced_eo"
"217",1,"Mike Rowe on disconnect between higher education, real life","TV host and mikeroweWORKS Foundation founder offers insight on the job market on 'Fox & Friends.'FOX News Channel (FNC) is a 24-hour all-encompassing news service dedicated to delivering breaking news as well as political and business news. The number one network in cable, FNC has been the most watched television news channel for more than 16 years and according to a Suffolk University/USA Today poll, is the most trusted television news source in the country. Owned by 21st Century Fox, FNC is available in more than 90 million homes and dominates the cable news landscape, routinely notching the top ten programs in the genre. Subscribe to Fox News!  https://bit.ly/2vBUvASWatch more Fox News Video: http://video.foxnews.comWatch Fox News Channel Live: http://www.foxnewsgo.com/ Watch full episodes of your favorite showsThe Five: http://video.foxnews.com/playlist/lon...Special Report with Bret Baier: http://video.foxnews.com/playlist/lon...The Story with Martha Maccallum: http://video.foxnews.com/playlist/lon...Tucker Carlson Tonight http://video.foxnews.com/playlist/lon...Hannity http://video.foxnews.com/playlist/lon...The Ingraham Angle: http://video.foxnews.com/playlist/lon...Fox News @ Night: http://video.foxnews.com/playlist/lon... Follow Fox News on Facebook: https://www.facebook.com/FoxNews/Follow Fox News on Twitter: https://twitter.com/FoxNews/Follow Fox News on Instagram: https://www.instagram.com/foxnews/","Fox News","r0eBTi4wOgo"
"218",1,"Gowdy, Jordan react to FBI notes for Michael Flynn investigation","Fox news contributor Trey Gowdy and Rep. Jim Jordan join ‘Sunday Morning Futures.’Subscribe to Fox News! https://bit.ly/2vBUvASWatch more Fox News Video: http://video.foxnews.comWatch Fox News Channel Live: http://www.foxnewsgo.com/FOX News Channel (FNC) is a 24-hour all-encompassing news service delivering breaking news as well as political and business news. The number one network in cable, FNC has been the most-watched television news channel for 18 consecutive years. According to a 2020 Brand Keys Consumer Loyalty Engagement Index report, FOX News is the top brand in the country for morning and evening news coverage. A 2019 Suffolk University poll named FOX News as the most trusted source for television news or commentary, while a 2019 Brand Keys Emotion Engagement Analysis survey found that FOX News was the most trusted cable news brand. A 2017 Gallup/Knight Foundation survey also found that among Americans who could name an objective news source, FOX News was the top-cited outlet. Owned by FOX Corporation, FNC is available in nearly 90 million homes and dominates the cable news landscape, routinely notching the top ten programs in the genre.Watch full episodes of your favorite showsThe Five: http://video.foxnews.com/playlist/lon...Special Report with Bret Baier: http://video.foxnews.com/playlist/lon...The Story with Martha Maccallum: http://video.foxnews.com/playlist/lon...Tucker Carlson Tonight: http://video.foxnews.com/playlist/lon...Hannity:  http://video.foxnews.com/playlist/lon...The Ingraham Angle: http://video.foxnews.com/playlist/lon...Fox News @ Night: http://video.foxnews.com/playlist/lon...Follow Fox News on Facebook: https://www.facebook.com/FoxNews/Follow Fox News on Twitter: https://twitter.com/FoxNews/Follow Fox News on Instagram: https://www.instagram.com/foxnews/","Fox News","LWcRp35uK8s"
"219",1,"America Together: Returning to Work Town Hall with President Trump | Part 1","President Trump participates in a Fox News Town Hall to answer viewer's questions amid coronavirus pandemic. #FoxNews #TrumpTownHallSubscribe to Fox News! https://bit.ly/2vBUvASWatch more Fox News Video: http://video.foxnews.comWatch Fox News Channel Live: http://www.foxnewsgo.com/FOX News Channel (FNC) is a 24-hour all-encompassing news service delivering breaking news as well as political and business news. The number one network in cable, FNC has been the most-watched television news channel for 18 consecutive years. According to a 2020 Brand Keys Consumer Loyalty Engagement Index report, FOX News is the top brand in the country for morning and evening news coverage. A 2019 Suffolk University poll named FOX News as the most trusted source for television news or commentary, while a 2019 Brand Keys Emotion Engagement Analysis survey found that FOX News was the most trusted cable news brand. A 2017 Gallup/Knight Foundation survey also found that among Americans who could name an objective news source, FOX News was the top-cited outlet. Owned by FOX Corporation, FNC is available in nearly 90 million homes and dominates the cable news landscape, routinely notching the top ten programs in the genre.Watch full episodes of your favorite showsThe Five: http://video.foxnews.com/playlist/lon...Special Report with Bret Baier: http://video.foxnews.com/playlist/lon...The Story with Martha Maccallum: http://video.foxnews.com/playlist/lon...Tucker Carlson Tonight: http://video.foxnews.com/playlist/lon...Hannity: http://video.foxnews.com/playlist/lon...The Ingraham Angle: http://video.foxnews.com/playlist/lon...Fox News @ Night: http://video.foxnews.com/playlist/lon...Follow Fox News on Facebook: https://www.facebook.com/FoxNews/Follow Fox News on Twitter: https://twitter.com/FoxNews/Follow Fox News on Instagram: https://www.instagram.com/foxnews/","Fox News","Lg3hFWlOIuU"
"220",1,"Candace Owens: Democrats want black people to fail","Candace Owens takes on House Judiciary Democrats; Turning Point U.S.A. communications director Candace Owens and civil rights attorney Leo Terrell debate. #Ingraham #FoxNews  FOX News operates the FOX News Channel (FNC), FOX Business Network (FBN), FOX News Radio, FOX News Headlines 24/7, FOXNews.com and the direct-to-consumer streaming service, FOX Nation. FOX News also produces FOX News Sunday on FOX Broadcasting Company and FOX News Edge. A top five-cable network, FNC has been the most watched news channel in the country for 17 consecutive years. According to a 2018 Research Intelligencer study by Brand Keys, FOX News ranks as the second most trusted television brand in the country. Additionally, a Suffolk University/USA Today survey states Fox News is the most trusted source for television news or commentary in the country, while a 2017 Gallup/Knight Foundation survey found that among Americans who could name an objective news source, FOX News is the top-cited outlet. FNC is available in nearly 90 million homes and dominates the cable news landscape while routinely notching the top ten programs in the genre.Subscribe to Fox News!  https://bit.ly/2vBUvASWatch more Fox News Video: http://video.foxnews.comWatch Fox News Channel Live: http://www.foxnewsgo.com/Watch full episodes of your favorite showsThe Five: http://video.foxnews.com/playlist/lon...Special Report with Bret Baier: http://video.foxnews.com/playlist/lon...The Story with Martha Maccallum: http://video.foxnews.com/playlist/lon...Tucker Carlson Tonight: http://video.foxnews.com/playlist/lon...Hannity:  http://video.foxnews.com/playlist/lon...The Ingraham Angle: http://video.foxnews.com/playlist/lon...Fox News @ Night: http://video.foxnews.com/playlist/lon...Follow Fox News on Facebook: https://www.facebook.com/FoxNews/Follow Fox News on Twitter: https://twitter.com/FoxNews/Follow Fox News on Instagram: https://www.instagram.com/foxnews/","Fox News","DGVdD_QxuEc"
"221",1,"Tucker vs lawmaker who called feds 'Nazis'","14-year-old Md. girl is gang-raped by two older teens, one of whom is an illegal immigrant, while Baltimore reels from 10 recent homicides. Tucker takes on a Baltimore councilman who wants to make law enforcement kinder and gentler during troubled times","Fox News","bWH6fS3jZFk"
"222",1,"'The Five' reacts to Biden's first interview addressing allegations","Biden breaks silence on allegations; reaction and analysis on 'The Five.' #FoxNews #TheFiveFOX News operates the FOX News Channel (FNC), FOX Business Network (FBN), FOX News Radio, FOX News Headlines 24/7, FOXNews.com and the direct-to-consumer streaming service, FOX Nation. FOX News also produces FOX News Sunday on FOX Broadcasting Company and FOX News Edge. A top five-cable network, FNC has been the most-watched news channel in the country for 17 consecutive years. According to a 2018 Research Intelligencer study by Brand Keys, FOX News ranks as the second most trusted television brand in the country. Additionally, a Suffolk University/USA Today survey states Fox News is the most trusted source for television news or commentary in the country, while a 2017 Gallup/Knight Foundation survey found that among Americans who could name an objective news source, FOX News is the top-cited outlet. FNC is available in nearly 90 million homes and dominates the cable news landscape while routinely notching the top ten programs in the genre. Subscribe to Fox News!  https://bit.ly/2vBUvASWatch more Fox News Video: http://video.foxnews.comWatch Fox News Channel Live: http://www.foxnewsgo.com/Watch full episodes of your favorite showsThe Five: http://video.foxnews.com/playlist/lon...Special Report with Bret Baier: http://video.foxnews.com/playlist/lon...The Story with Martha MacCallum: http://video.foxnews.com/playlist/lon...Tucker Carlson Tonight: http://video.foxnews.com/playlist/lon...Hannity:  http://video.foxnews.com/playlist/lon...The Ingraham Angle: http://video.foxnews.com/playlist/lon...Fox News @ Night: http://video.foxnews.com/playlist/lon... Follow Fox News on Facebook: https://www.facebook.com/FoxNews/Follow Fox News on Twitter: https://twitter.com/FoxNews/Follow Fox News on Instagram: https://www.instagram.com/foxnews/","Fox News","4TzRlOriN8k"
"223",1,"Jim Acosta asks Trump to call on a 'female reporter'","CNN White House correspondent Jim Acosta gets into a tense exchange with President Trump over the allegations against Judge Brett Kavanaugh.FOX News Channel (FNC) is a 24-hour all-encompassing news service dedicated to delivering breaking news as well as political and business news. The number one network in cable, FNC has been the most watched television news channel for more than 16 years and according to a Suffolk University/USA Today poll, is the most trusted television news source in the country. Owned by 21st Century Fox, FNC is available in more than 90 million homes and dominates the cable news landscape, routinely notching the top ten programs in the genre. Subscribe to Fox News!  https://bit.ly/2vBUvASWatch more Fox News Video: http://video.foxnews.comWatch Fox News Channel Live: http://www.foxnewsgo.com/ Watch full episodes of your favorite showsThe Five: http://video.foxnews.com/playlist/lon...Special Report with Bret Baier: http://video.foxnews.com/playlist/lon...The Story with Martha Maccallum: http://video.foxnews.com/playlist/lon...Tucker Carlson Tonight http://video.foxnews.com/playlist/lon...Hannity http://video.foxnews.com/playlist/lon...The Ingraham Angle: http://video.foxnews.com/playlist/lon...Fox News @ Night: http://video.foxnews.com/playlist/lon... Follow Fox News on Facebook: https://www.facebook.com/FoxNews/Follow Fox News on Twitter: https://twitter.com/FoxNews/Follow Fox News on Instagram: https://www.instagram.com/foxnews/","Fox News","r2aY9G1awVw"
"224",1,"Tucker: Totalitarianism doesn't shock us any more","Never in American history have politicians been more powerful than they are now. #FoxNews #TuckerFOX News operates the FOX News Channel (FNC), FOX Business Network (FBN), FOX News Radio, FOX News Headlines 24/7, FOXNews.com and the direct-to-consumer streaming service, FOX Nation. FOX News also produces FOX News Sunday on FOX Broadcasting Company and FOX News Edge. A top five-cable network, FNC has been the most-watched news channel in the country for 17 consecutive years. According to a 2018 Research Intelligencer study by Brand Keys, FOX News ranks as the second most trusted television brand in the country. Additionally, a Suffolk University/USA Today survey states Fox News is the most trusted source for television news or commentary in the country, while a 2017 Gallup/Knight Foundation survey found that among Americans who could name an objective news source, FOX News is the top-cited outlet. FNC is available in nearly 90 million homes and dominates the cable news landscape while routinely notching the top ten programs in the genre. Subscribe to Fox News!  https://bit.ly/2vBUvASWatch more Fox News Video: http://video.foxnews.comWatch Fox News Channel Live: http://www.foxnewsgo.com/Watch full episodes of your favorite showsThe Five: http://video.foxnews.com/playlist/lon...Special Report with Bret Baier: http://video.foxnews.com/playlist/lon...The Story with Martha MacCallum: http://video.foxnews.com/playlist/lon...Tucker Carlson Tonight: http://video.foxnews.com/playlist/lon...Hannity:  http://video.foxnews.com/playlist/lon...The Ingraham Angle: http://video.foxnews.com/playlist/lon...Fox News @ Night: http://video.foxnews.com/playlist/lon... Follow Fox News on Facebook: https://www.facebook.com/FoxNews/Follow Fox News on Twitter: https://twitter.com/FoxNews/Follow Fox News on Instagram: https://www.instagram.com/foxnews/","Fox News","_KACUbQjvrk"
