"","Bias_num","title","description","channel","id"
"430",0,"Trump Erupts At Campaign Manager Over Poll Numbers: Report | Morning Joe | MSNBC","New 2020 battleground polls with Joe Biden in the lead are showing the impact Trump's handling of the coronavirus pandemic is having on his re-election effort. The president was also reportedly angry with campaign officials over his numbers. Aired on 4/30/2020.» Subscribe to MSNBC: http://on.msnbc.com/SubscribeTomsnbcMSNBC delivers breaking news, in-depth analysis of politics headlines, as well as commentary and informed perspectives. Find video clips and segments from The Rachel Maddow Show, Morning Joe, Meet the Press Daily, The Beat with Ari Melber, Deadline: White House with Nicolle Wallace, Hardball, All In, Last Word, 11th Hour, and more.Connect with MSNBC OnlineVisit msnbc.com: http://on.msnbc.com/ReadmsnbcSubscribe to MSNBC Newsletter: http://MSNBC.com/NewslettersYouTubeFind MSNBC on Facebook: http://on.msnbc.com/LikemsnbcFollow MSNBC on Twitter: http://on.msnbc.com/FollowmsnbcFollow MSNBC on Instagram: http://on.msnbc.com/InstamsnbcTrump Erupts At Campaign Manager Over Poll Numbers: Report | Morning Joe | MSNBC","MSNBC","WCC1R4qSiIw"
"431",0,"Biden: 'False Choice' Of Getting Virus Under Control, Getting Back To Work | Morning Joe | MSNBC","Former VP Joe Biden discusses balancing the coronavirus and restarting portions of the economy, and calls it a 'false choice' to balance getting the virus under control and getting the country back to work. Aired on 5/1/2020.» Subscribe to MSNBC: http://on.msnbc.com/SubscribeTomsnbcMSNBC delivers breaking news, in-depth analysis of politics headlines, as well as commentary and informed perspectives. Find video clips and segments from The Rachel Maddow Show, Morning Joe, Meet the Press Daily, The Beat with Ari Melber, Deadline: White House with Nicolle Wallace, Hardball, All In, Last Word, 11th Hour, and more.Connect with MSNBC OnlineVisit msnbc.com: http://on.msnbc.com/ReadmsnbcSubscribe to MSNBC Newsletter: http://MSNBC.com/NewslettersYouTubeFind MSNBC on Facebook: http://on.msnbc.com/LikemsnbcFollow MSNBC on Twitter: http://on.msnbc.com/FollowmsnbcFollow MSNBC on Instagram: http://on.msnbc.com/InstamsnbcBiden: 'False Choice' Of Getting Virus Under Control, Getting Back To Work | Morning Joe | MSNBC","MSNBC","bBuq6jpD1y8"
"432",0,"Psychiatrist On Trump’s ‘Dangerous’ Response To Coronavirus Crisis | The Last Word | MSNBC","Dr. Lance Dodes, a contributor to bestselling “The Dangerous Case of Donald Trump,” tells Lawrence O’Donnell that President Trump is a “con man” who is making the current public health crisis “all about himself”- which could have grave results for Americans. Aired on 02/27/20.» Subscribe to MSNBC: http://on.msnbc.com/SubscribeTomsnbcMSNBC delivers breaking news, in-depth analysis of politics headlines, as well as commentary and informed perspectives. Find video clips and segments from The Rachel Maddow Show, Morning Joe, Meet the Press Daily, The Beat with Ari Melber, Deadline: White House with Nicolle Wallace, Hardball, All In, Last Word, 11th Hour, and more.Connect with MSNBC OnlineVisit msnbc.com: http://on.msnbc.com/ReadmsnbcSubscribe to MSNBC Newsletter: http://MSNBC.com/NewslettersYouTubeFind MSNBC on Facebook: http://on.msnbc.com/LikemsnbcFollow MSNBC on Twitter: http://on.msnbc.com/FollowmsnbcFollow MSNBC on Instagram: http://on.msnbc.com/InstamsnbcPsychiatrist On Trump’s ‘Dangerous’ Response To Coronavirus Crisis | The Last Word | MSNBC","MSNBC","AKgq0rnIR7g"
"433",0,"WaPo Reports On Trump's 'Desperate' Attempts To Reopen The U.S. | Morning Joe | MSNBC","In new reporting, the Washington Post details the president's 'desperate' attempts to reopen the country as the coronavirus pandemic raged. The panel discusses. Aired on 5/4/2020.» Subscribe to MSNBC: http://on.msnbc.com/SubscribeTomsnbcMSNBC delivers breaking news, in-depth analysis of politics headlines, as well as commentary and informed perspectives. Find video clips and segments from The Rachel Maddow Show, Morning Joe, Meet the Press Daily, The Beat with Ari Melber, Deadline: White House with Nicolle Wallace, Hardball, All In, Last Word, 11th Hour, and more.Connect with MSNBC OnlineVisit msnbc.com: http://on.msnbc.com/ReadmsnbcSubscribe to MSNBC Newsletter: http://MSNBC.com/NewslettersYouTubeFind MSNBC on Facebook: http://on.msnbc.com/LikemsnbcFollow MSNBC on Twitter: http://on.msnbc.com/FollowmsnbcFollow MSNBC on Instagram: http://on.msnbc.com/InstamsnbcWaPo Reports On Trump's 'Desperate' Attempts To Reopen The U.S. | Morning Joe | MSNBC","MSNBC","SwA6xH5TF_E"
"434",0,"Fmr. Dept. of Labor Chief Economist: 'We're Just Pushing The Hurt Down The Road' | MSNBC","Fmr. U.S. Labor Dept. chief economist Bill Rodgers discusses the “cascading effect” of coronavirus on Americans’ finances with Teaneck, New Jersey mayor Mohammed Hameeduddin.» Subscribe to MSNBC: http://on.msnbc.com/SubscribeTomsnbcMSNBC delivers breaking news, in-depth analysis of politics headlines, as well as commentary and informed perspectives. Find video clips and segments from The Rachel Maddow Show, Morning Joe, Meet the Press Daily, The Beat with Ari Melber, Deadline: White House with Nicolle Wallace, Hardball, All In, Last Word, 11th Hour, and more.Connect with MSNBC OnlineVisit msnbc.com: http://on.msnbc.com/ReadmsnbcSubscribe to MSNBC Newsletter: http://http://MSNBC.com/NewslettersYo...Find MSNBC on Facebook: http://on.msnbc.com/LikemsnbcFollow MSNBC on Twitter: http://on.msnbc.com/FollowmsnbcFollow MSNBC on Instagram: http://on.msnbc.com/InstamsnbcFmr. Dept. of Labor Chief Economist: 'We're Just Pushing The Hurt Down The Road' | MSNBC","MSNBC","MxrQI5GYlCA"
"435",0,"President Donald Trump's Day Of Strange And Confusing Statements | The Last Word | MSNBC","Lawrence examines what Donald Trump did and said today, and why it raises urgent and important questions about the President of the United States. Psychiatrist Prudence Gourguechon, Ron Klain and Adam Jentleson join Lawrence to discuss.» Subscribe to MSNBC: http://on.msnbc.com/SubscribeTomsnbcMSNBC delivers breaking news and in-depth analysis of the headlines, as well as informed perspectives. Find video clips and segments from The Rachel Maddow Show, Morning Joe, Hardball, All In, Last Word, 11th Hour, and more.Connect with MSNBC OnlineVisit msnbc.com: http://on.msnbc.com/ReadmsnbcSubscribe to MSNBC Newsletter: MSNBC.com/NewslettersYouTubeFind MSNBC on Facebook: http://on.msnbc.com/LikemsnbcFollow MSNBC on Twitter: http://on.msnbc.com/FollowmsnbcFollow MSNBC on Instagram: http://on.msnbc.com/InstamsnbcPresident Donald Trump's Day Of Strange And Confusing Statements | The Last Word | MSNBC","MSNBC","lx9b313N7E8"
"436",0,"Weekend Developments In The Allegation Against Biden | Morning Joe | MSNBC","The panel discusses the weekend developments made in the allegations of assault against Joe Biden, first made against him by former Senate aide Tara Reade in 1993. Joe Biden spoke exclusively to Morning Joe on Friday, May 1, 2020. » Subscribe to MSNBC: http://on.msnbc.com/SubscribeTomsnbcMSNBC delivers breaking news, in-depth analysis of politics headlines, as well as commentary and informed perspectives. Find video clips and segments from The Rachel Maddow Show, Morning Joe, Meet the Press Daily, The Beat with Ari Melber, Deadline: White House with Nicolle Wallace, Hardball, All In, Last Word, 11th Hour, and more.Connect with MSNBC OnlineVisit msnbc.com: http://on.msnbc.com/ReadmsnbcSubscribe to MSNBC Newsletter: http://MSNBC.com/NewslettersYouTubeFind MSNBC on Facebook: http://on.msnbc.com/LikemsnbcFollow MSNBC on Twitter: http://on.msnbc.com/FollowmsnbcFollow MSNBC on Instagram: http://on.msnbc.com/InstamsnbcWeekend Developments In The Allegation Against Biden | Morning Joe | MSNBC","MSNBC","W-_MJ_sZSDs"
"437",0,"Full Interview: Edward Snowden On Trump, Privacy, And Threats To Democracy | The 11th Hour | MSNBC","On the eve of his memoir 'Permanent Record' being published, NSA whistleblower Edward Snowden talked at length from Moscow with MSNBC's Brian Williams in an exclusive interview. This is their discussion in its entirety, edited down slightly for clarity. Aired on 9/17/2019.» Subscribe to MSNBC: http://on.msnbc.com/SubscribeTomsnbcMSNBC delivers breaking news, in-depth analysis of politics headlines, as well as commentary and informed perspectives. Find video clips and segments from The Rachel Maddow Show, Morning Joe, Meet the Press Daily, The Beat with Ari Melber, Deadline: White House with Nicolle Wallace, Hardball, All In, Last Word, 11th Hour, and more.Connect with MSNBC OnlineVisit msnbc.com: http://on.msnbc.com/ReadmsnbcSubscribe to MSNBC Newsletter: http://MSNBC.com/NewslettersYouTubeFind MSNBC on Facebook: http://on.msnbc.com/LikemsnbcFollow MSNBC on Twitter: http://on.msnbc.com/FollowmsnbcFollow MSNBC on Instagram: http://on.msnbc.com/InstamsnbcFull Interview: Edward Snowden On Trump, Privacy, And Threats To Democracy | The 11th Hour | MSNBC","MSNBC","e9yK1QndJSM"
"438",0,"Linguist Expert: President Donald Trump Sounds Like Your Beer-Swilling Uncle | The 11th Hour | MSNBC","John McWhorter, a professor at Columbia University and a contributor at the Atlantic, breaks down the language of the president which is unlike any other who came before him.» Subscribe to MSNBC: http://on.msnbc.com/SubscribeTomsnbcAbout: MSNBC is the premier destination for in-depth analysis of daily headlines, insightful political commentary and informed perspectives. Reaching more than 95 million households worldwide, MSNBC offers a full schedule of live news coverage, political opinions and award-winning documentary programming -- 24 hours a day, 7 days a week.Connect with MSNBC OnlineVisit msnbc.com: http://on.msnbc.com/ReadmsnbcSubscribe to MSNBC Newsletter: MSNBC.com/NewslettersYouTubeFind MSNBC on Facebook: http://on.msnbc.com/LikemsnbcFollow MSNBC on Twitter: http://on.msnbc.com/FollowmsnbcFollow MSNBC on Instagram: http://on.msnbc.com/InstamsnbcLinguist Expert: President Donald Trump Sounds Like Your Beer-Swilling Uncle | The 11th Hour | MSNBC","MSNBC","Qwnpa3KhT4Y"
"439",0,"Trump An Incoherent Spectacle At G7; W.H. Struggles To Clean Up | Rachel Maddow | MSNBC","Rachel Maddow reviews a string of a string of instances from the G7 summit in which Donald Trump said something false, or self-contradictory, or simply absurd, making himself a global laughing stock, compromising the credibility of the United States on the world stage, and leaving the White House scrambling to offer corrections and clarifications.» Subscribe to MSNBC: http://on.msnbc.com/SubscribeTomsnbcMSNBC delivers breaking news, in-depth analysis of politics headlines, as well as commentary and informed perspectives. Find video clips and segments from The Rachel Maddow Show, Morning Joe, Meet the Press Daily, The Beat with Ari Melber, Deadline: White House with Nicolle Wallace, Hardball, All In, Last Word, 11th Hour, and more.Connect with MSNBC OnlineVisit msnbc.com: http://on.msnbc.com/ReadmsnbcSubscribe to MSNBC Newsletter: http://MSNBC.com/NewslettersYouTubeFind MSNBC on Facebook: http://on.msnbc.com/LikemsnbcFollow MSNBC on Twitter: http://on.msnbc.com/FollowmsnbcFollow MSNBC on Instagram: http://on.msnbc.com/InstamsnbcTrump An Incoherent Spectacle At G7; W.H. Struggles To Clean Up | Rachel Maddow | MSNBC","MSNBC","FEpwkaJQh1k"
"440",0,"The Trick To Tracking Trump’s Lies And Corruption | MSNBC","Washington Post Reporter David Fahrenthold used an old-school notebook and social media – and there’s still plenty of work to be done.» Subscribe to MSNBC: http://on.msnbc.com/SubscribeTomsnbcMSNBC delivers breaking news and in-depth analysis of the headlines, as well as informed perspectives. Find video clips and segments from The Rachel Maddow Show, Morning Joe, Hardball, All In, Last Word, 11th Hour, and more.Connect with MSNBC OnlineVisit msnbc.com: http://on.msnbc.com/ReadmsnbcSubscribe to MSNBC Newsletter: MSNBC.com/NewslettersYouTubeFind MSNBC on Facebook: http://on.msnbc.com/LikemsnbcFollow MSNBC on Twitter: http://on.msnbc.com/FollowmsnbcFollow MSNBC on Instagram: http://on.msnbc.com/InstamsnbcThe Trick To Tracking Trump’s Lies And Corruption | MSNBC","MSNBC","Ad0z75BCyFk"
"441",0,"Psychiatrist: Trump's Projection On Chairman Schiff Is ‘Primitive’ | The Last Word | MSNBC","Psychiatrist Lance Dodes joins Lawrence O'Donnell to discuss Donald Trump’s behavior abroad as the impeachment investigation advances at home. Dr. Dodes says President Trump is """"running a really simple program"""" with """"limited capacity"""" and exemplifying """"early emotional development."""" Aired on 12/03/19.» Subscribe to MSNBC: http://on.msnbc.com/SubscribeTomsnbcMSNBC delivers breaking news, in-depth analysis of politics headlines, as well as commentary and informed perspectives. Find video clips and segments from The Rachel Maddow Show, Morning Joe, Meet the Press Daily, The Beat with Ari Melber, Deadline: White House with Nicolle Wallace, Hardball, All In, Last Word, 11th Hour, and more.Connect with MSNBC OnlineVisit msnbc.com: http://on.msnbc.com/ReadmsnbcSubscribe to MSNBC Newsletter: http://MSNBC.com/NewslettersYouTubeFind MSNBC on Facebook: http://on.msnbc.com/LikemsnbcFollow MSNBC on Twitter: http://on.msnbc.com/FollowmsnbcFollow MSNBC on Instagram: http://on.msnbc.com/Instamsnbc","MSNBC","ft6A3WZnd3s"
"442",0,"Trump’s New Obama Envy? Coronavirus Debacle Contrasted To Obama’s Science-Driven Pandemic Prep","As Pres. Trump faces fallout for his handling of the coronavirus pandemic, and blames past administrations in the WHO, the historical archive shows President Obama’s emphasis on early preparation for flu and pandemic threats and his approach to ensuring scientists take the lead in government response. MSNBC’s Ari Melber reports on the history, including Obama’s emphasis on science, his work on pandemics in the Senate, and his dealings with Dr. Fauci. (This interview is from MSNBC’s “The Beat with Ari Melber, a news show covering politics, law and culture airing nightly at 6pm ET on MSNBC. http://www.thebeatwithari.com). Aired on 04/30/2020.» Subscribe to MSNBC: http://on.msnbc.com/SubscribeTomsnbcMSNBC delivers breaking news, in-depth analysis of politics headlines, as well as commentary and informed perspectives. Find video clips and segments from The Rachel Maddow Show, Morning Joe, Meet the Press Daily, The Beat with Ari Melber, Deadline: White House with Nicolle Wallace, Hardball, All In, Last Word, 11th Hour, and more.Connect with MSNBC OnlineVisit msnbc.com: http://on.msnbc.com/ReadmsnbcSubscribe to MSNBC Newsletter: http://MSNBC.com/NewslettersYouTubeFind MSNBC on Facebook: http://on.msnbc.com/LikemsnbcFollow MSNBC on Twitter: http://on.msnbc.com/FollowmsnbcFollow MSNBC on Instagram: http://on.msnbc.com/InstamsnbcTrump’s New Obama Envy? Coronavirus Debacle Contrasted To Obama’s Science-Driven Pandemic Prep","MSNBC","k-5c0I4Yyr0"
"443",0,"GOP Candidates Up For Re-Election Opt For Distance From Virus Response | Morning Joe | MSNBC","Some Republicans up for re-election in the fall are distancing themselves from the president's response to the coronavirus. Kasie Hunt discusses. Aired on 5/4/2020.» Subscribe to MSNBC: http://on.msnbc.com/SubscribeTomsnbcMSNBC delivers breaking news, in-depth analysis of politics headlines, as well as commentary and informed perspectives. Find video clips and segments from The Rachel Maddow Show, Morning Joe, Meet the Press Daily, The Beat with Ari Melber, Deadline: White House with Nicolle Wallace, Hardball, All In, Last Word, 11th Hour, and more.Connect with MSNBC OnlineVisit msnbc.com: http://on.msnbc.com/ReadmsnbcSubscribe to MSNBC Newsletter: http://MSNBC.com/NewslettersYouTubeFind MSNBC on Facebook: http://on.msnbc.com/LikemsnbcFollow MSNBC on Twitter: http://on.msnbc.com/FollowmsnbcFollow MSNBC on Instagram: http://on.msnbc.com/InstamsnbcGOP Candidates Up For Re-Election Opt For Distance From Virus Response | Morning Joe | MSNBC","MSNBC","aeU_k3CEwPg"
"444",0,"Biden: Trump Should Take Responsibility, He's In Charge | Morning Joe | MSNBC","Former VP Joe Biden discusses how as president he would handle the coronavirus crisis, and he criticizes how Trump has handled the pandemic and what he should be doing as president. Aired on 5/1/2020.» Subscribe to MSNBC: http://on.msnbc.com/SubscribeTomsnbcMSNBC delivers breaking news, in-depth analysis of politics headlines, as well as commentary and informed perspectives. Find video clips and segments from The Rachel Maddow Show, Morning Joe, Meet the Press Daily, The Beat with Ari Melber, Deadline: White House with Nicolle Wallace, Hardball, All In, Last Word, 11th Hour, and more.Connect with MSNBC OnlineVisit msnbc.com: http://on.msnbc.com/ReadmsnbcSubscribe to MSNBC Newsletter: http://MSNBC.com/NewslettersYouTubeFind MSNBC on Facebook: http://on.msnbc.com/LikemsnbcFollow MSNBC on Twitter: http://on.msnbc.com/FollowmsnbcFollow MSNBC on Instagram: http://on.msnbc.com/InstamsnbcBiden: Trump Should Take Responsibility, He's In Charge | Morning Joe | MSNBC","MSNBC","jK4llsxSAK0"
"445",0,"Biden Accuser 'Not Sure' What Complaint She Claims Was Filed With Senate Says | Morning Joe | MSNBC","The panel discusses the weekend developments made in the allegations of assault against Joe Biden, first made against him by former Senate aide Tara Reade in 1993. Joe Biden spoke exclusively to Morning Joe on Friday, May 1, 2020.» Subscribe to MSNBC: http://on.msnbc.com/SubscribeTomsnbcMSNBC delivers breaking news, in-depth analysis of politics headlines, as well as commentary and informed perspectives. Find video clips and segments from The Rachel Maddow Show, Morning Joe, Meet the Press Daily, The Beat with Ari Melber, Deadline: White House with Nicolle Wallace, Hardball, All In, Last Word, 11th Hour, and more.Connect with MSNBC OnlineVisit msnbc.com: http://on.msnbc.com/ReadmsnbcSubscribe to MSNBC Newsletter: http://MSNBC.com/NewslettersYouTubeFind MSNBC on Facebook: http://on.msnbc.com/LikemsnbcFollow MSNBC on Twitter: http://on.msnbc.com/FollowmsnbcFollow MSNBC on Instagram: http://on.msnbc.com/InstamsnbcBiden Accuser 'Not Sure' What Complaint She Claims Was Filed With Senate Says | Morning Joe | MSNBC","MSNBC","WEZ66foC5OQ"
"446",0,"Donald Trump, A Very Stable Genius, Tries To Read The Constitution | All In | MSNBC","Thing 1/Thing 2: Do you think President Trump has ever actually read the Constitution? Turns out he has, but it did not go well. Aired on 01/20/20.» Subscribe to MSNBC: http://on.msnbc.com/SubscribeTomsnbcMSNBC delivers breaking news, in-depth analysis of politics headlines, as well as commentary and informed perspectives. Find video clips and segments from The Rachel Maddow Show, Morning Joe, Meet the Press Daily, The Beat with Ari Melber, Deadline: White House with Nicolle Wallace, Hardball, All In, Last Word, 11th Hour, and more.Connect with MSNBC OnlineVisit msnbc.com: http://on.msnbc.com/ReadmsnbcSubscribe to MSNBC Newsletter: http://MSNBC.com/NewslettersYouTubeFind MSNBC on Facebook: http://on.msnbc.com/LikemsnbcFollow MSNBC on Twitter: http://on.msnbc.com/FollowmsnbcFollow MSNBC on Instagram: http://on.msnbc.com/InstamsnbcDonald Trump, A Very Stable Genius, Tries To Read The Constitution | All In | MSNBC","MSNBC","sY2Et8lMj-A"
"447",0,"Rachel Maddow One-On-One With Lisa Page | Rachel Maddow | MSNBC","Lisa Page, a former FBI lawyer who has become a favorite target of Donald Trump as a proxy for the investigation into his campaign's ties to Russia, talks with Rachel Maddow. Aired on 12/18/19.» Subscribe to MSNBC: http://on.msnbc.com/SubscribeTomsnbcMSNBC delivers breaking news, in-depth analysis of politics headlines, as well as commentary and informed perspectives. Find video clips and segments from The Rachel Maddow Show, Morning Joe, Meet the Press Daily, The Beat with Ari Melber, Deadline: White House with Nicolle Wallace, Hardball, All In, Last Word, 11th Hour, and more.Connect with MSNBC OnlineVisit msnbc.com: http://on.msnbc.com/ReadmsnbcSubscribe to MSNBC Newsletter: http://MSNBC.com/NewslettersYouTubeFind MSNBC on Facebook: http://on.msnbc.com/LikemsnbcFollow MSNBC on Twitter: http://on.msnbc.com/FollowmsnbcFollow MSNBC on Instagram: http://on.msnbc.com/InstamsnbcRachel Maddow One-On-One With Lisa Page | Rachel Maddow | MSNBC","MSNBC","5Iaqge2xYoM"
"448",0,"Lawrence's Last Word: President Donald Trump's Lost Lie | The Last Word | MSNBC","Donald Trump stole the grief of 9/11 families by claiming he """"lost hundreds of friends"""" on 9/11 when he actually lost no friends on 9/11.» Subscribe to MSNBC: http://on.msnbc.com/SubscribeTomsnbcMSNBC delivers breaking news and in-depth analysis of the headlines, as well as informed perspectives. Find video clips and segments from The Rachel Maddow Show, Morning Joe, Hardball, All In, Last Word, 11th Hour, and more.Connect with MSNBC OnlineVisit msnbc.com: http://on.msnbc.com/ReadmsnbcSubscribe to MSNBC Newsletter: http://MSNBC.com/NewslettersYouTubeFind MSNBC on Facebook: http://on.msnbc.com/LikemsnbcFollow MSNBC on Twitter: http://on.msnbc.com/FollowmsnbcFollow MSNBC on Instagram: http://on.msnbc.com/InstamsnbcLawrence's Last Word: President Donald Trump's Lost Lie | The Last Word | MSNBC","MSNBC","qHbeDq84pdQ"
"449",0,"Tom Brokaw Reflects On Robert F. Kennedy In California | Morning Joe | MSNBC","NBC News’ Tom Brokaw reflects on the life and legacy of Robert F. Kennedy and on covering the 1968 California Democratic primary.» Subscribe to MSNBC: http://on.msnbc.com/SubscribeTomsnbcAbout: MSNBC is the premier destination for in-depth analysis of daily headlines, insightful political commentary and informed perspectives. Reaching more than 95 million households worldwide, MSNBC offers a full schedule of live news coverage, political opinions and award-winning documentary programming -- 24 hours a day, 7 days a week.Connect with MSNBC OnlineVisit msnbc.com: http://on.msnbc.com/ReadmsnbcSubscribe to MSNBC Newsletter: MSNBC.com/NewslettersYouTubeFind MSNBC on Facebook: http://on.msnbc.com/LikemsnbcFollow MSNBC on Twitter: http://on.msnbc.com/FollowmsnbcFollow MSNBC on Instagram: http://on.msnbc.com/InstamsnbcTom Brokaw Reflects On Robert F. Kennedy In California | Morning Joe | MSNBC","MSNBC","F-paNhNuDWo"
"450",0,"Chris Matthews On The Legacy Of Bobby Kennedy's 'Raging Spirit' | Morning Joe | MSNBC","'Hardball' host Chris Matthews joins Morning Joe to discuss the life and legacy of Bobby Kennedy and the themes that defined him. Matthews delves into the senator's life in his new book.» Subscribe to MSNBC: http://on.msnbc.com/SubscribeTomsnbcAbout: MSNBC is the premier destination for in-depth analysis of daily headlines, insightful political commentary and informed perspectives. Reaching more than 95 million households worldwide, MSNBC offers a full schedule of live news coverage, political opinions and award-winning documentary programming -- 24 hours a day, 7 days a week.Connect with MSNBC OnlineVisit msnbc.com: http://on.msnbc.com/ReadmsnbcFind MSNBC on Facebook: http://on.msnbc.com/LikemsnbcFollow MSNBC on Twitter: http://on.msnbc.com/FollowmsnbcFollow MSNBC on Google+: http://on.msnbc.com/PlusmsnbcFollow MSNBC on Instagram: http://on.msnbc.com/InstamsnbcFollow MSNBC on Tumblr: http://on.msnbc.com/LeanWithmsnbcChris Matthews On The Legacy Of Bobby Kennedy's 'Raging Spirit' | Morning Joe | MSNBC","MSNBC","Dsy-Re58pRc"
