"","Bias_num","title","description","channel","id"
"1",0,"Elon Musk says Australia’s energy emergency is easily fixable - Part one | 60 Minutes Australia","It’s been a miserable few weeks for Malcolm Turnbull’s government, stalled by myriad cock-ups and controversies. But the greatest challenge it faces continues to be Australia’s crisis over energy supply and cost. Who hasn’t been shocked by a recent electricity or gas bill? And who isn’t infuriated that power prices have risen so sharply? In a country as abundant with resources as ours it defies logic that there are now some Australians who can’t even pay for the electricity or gas to cook a simple meal. While federal – and state – politicians scramble to act, Elon Musk, the American billionaire with the brilliant mind, says he wants to help. In an exclusive interview with Liz Hayes, Musk says Australia’s energy emergency is easily fixable, and his construction of the world’s largest lithium ion battery at Jamestown in South Australia is proof.Reporter: Liz HayesProducer: Grace Tobin","60 Minutes Australia","w7BMaG3zyVo"
"2",0,"Real life Catch Me If You Can con artist reveals tricks | 60 Minutes Australia","Catch Me If You Can stars Leonardo DiCaprio as Frank Abagnale, the greatest con-artist of all time. What makes the film stand out is that Abagnale's life of lying is all true. Subscribe here: http://9Soci.al/chmP50wA97J Full Episodes here http://9Soci.al/vZSv50wA98xWATCH more of 60 Minutes Australia: https://www.60minutes.com.au LIKE 60 Minutes Australia on Facebook: https://www.facebook.com/60Minutes9 FOLLOW 60 Minutes Australia on Twitter: https://twitter.com/60Mins FOLLOW 60 Minutes Australia on Instagram: https://www.instagram.com/60minutes9For forty years, 60 Minutes have been telling Australians the world’s greatest stories. Tales that changed history, our nation and our lives. Reporters Liz Hayes, Allison Langdon, Tara Brown, Charles Wooley, Liam Bartlett and Sarah Abo look past the headlines because there is always a bigger picture. Sundays are for 60 Minutes.#60MinutesAustralia","60 Minutes Australia","3UmcxQto7UU"
"3",0,"Reporter granted rare access inside secretive North Korea | 60 Minutes Australia","After months of negotiations, Nine News correspondent Tom Steinfort was given rare permission to travel to North Korea. Subscribe here: http://9Soci.al/chmP50wA97J Full Episodes here http://9Soci.al/sImy50wNiXL There he worryingly discovered a country whose people are ready for conflict, and bizarrely, almost gleeful that a consequence of it could be the end of the world. 60 Minutes Australia (2017)WATCH more of 60 Minutes Australia: https://www.60minutes.com.au LIKE 60 Minutes Australia on Facebook: https://www.facebook.com/60Minutes9 FOLLOW 60 Minutes Australia on Twitter: https://twitter.com/60Mins FOLLOW 60 Minutes Australia on Instagram: https://www.instagram.com/60minutes9For forty years, 60 Minutes have been telling Australians the world’s greatest stories. Tales that changed history, our nation and our lives. Reporters Liz Hayes, Allison Langdon, Tara Brown, Charles Wooley, Liam Bartlett and Sarah Abo look past the headlines because there is always a bigger picture. Sundays are for 60 Minutes.#60MinutesAustralia","60 Minutes Australia","5iGClYMpcpE"
"4",0,"The Father's Day Massacre (2014) - Worst bikie violence in the world | 60 Minutes Australia","To this day, the notorious Milperra Massacre remains the worst single outbreak of bikie violence the world has ever seen. More than 30 years on, 60 Minutes takes you inside the massacre like never before.Reporter: Michael UsherProducer: Garry McNabFor forty years, 60 Minutes have been telling Australians the world’s greatest stories. Tales that changed history, our nation and our lives. Reporters Liz Hayes, Allison Langdon, Tara Brown, Charles Wooley, Liam Bartlett and Tom Steinfort look past the headlines because there is always a bigger picture. Sundays are for 60 Minutes.WATCH more of 60 Minutes Australia: https://www.60minutes.com.au LIKE 60 Minutes Australia on Facebook: https://www.facebook.com/60Minutes9 FOLLOW 60 Minutes Australia on Twitter: https://twitter.com/60Mins FOLLOW 60 Minutes Australia on Instagram: https://www.instagram.com/60minutes9","60 Minutes Australia","h6G38Lbrn9Q"
"5",0,"WORLD EXCLUSIVE: Harvey Weinstein and his army of spies | 60 Minutes Australia","In a major 60 MINUTES investigation, Liam Bartlett reveals an added level of Weinstein wickedness. To cover up his many crimes, the one-time Hollywood heavyweight had at his disposal a so-called “army of spies”. These “agents” collected sensitive and embarrassing information about his victims, which was then used to discredit or shut them up. Among Weinstein’s trusted allies was Australian Dylan Howard, who a few days ago went to court to try to stop his part in Bartlett’s story being broadcast. Unfortunately for Howard, he failed. Subscribe here: http://9Soci.al/chmP50wA97J Full Episodes here http://9Soci.al/sImy50wNiXL60 Minutes Australia (2018)WATCH more of 60 Minutes Australia: https://www.60minutes.com.au LIKE 60 Minutes Australia on Facebook: https://www.facebook.com/60Minutes9 FOLLOW 60 Minutes Australia on Twitter: https://twitter.com/60Mins FOLLOW 60 Minutes Australia on Instagram: https://www.instagram.com/60minutes9For forty years, 60 Minutes have been telling Australians the world’s greatest stories. Tales that changed history, our nation and our lives. Reporters Liz Hayes, Allison Langdon, Tara Brown, Charles Wooley, Liam Bartlett and Sarah Abo look past the headlines because there is always a bigger picture. Sundays are for 60 Minutes.#60MinutesAustralia","60 Minutes Australia","xSF-Q2zvZzI"
"6",0,"Exposing Jeffrey Epstein's international sex trafficking ring | 60 Minutes Australia","The Jeffrey Epstein scandal – Tara Brown reports how a New York billionaire masterminded an international sex trafficking ring of young women, and why wealthy and powerful men, including HRH Prince Andrew, are now implicated in the saga. Subscribe here: http://9Soci.al/chmP50wA97J Full Episodes here http://9Soci.al/sImy50wNiXLWATCH more of 60 Minutes Australia: https://www.60minutes.com.au LIKE 60 Minutes Australia on Facebook: https://www.facebook.com/60Minutes9 FOLLOW 60 Minutes Australia on Twitter: https://twitter.com/60Mins FOLLOW 60 Minutes Australia on Instagram: https://www.instagram.com/60minutes9For forty years, 60 Minutes have been telling Australians the world’s greatest stories. Tales that changed history, our nation and our lives. Reporters Liz Hayes, Allison Langdon, Tara Brown, Charles Wooley, Liam Bartlett and Sarah Abo look past the headlines because there is always a bigger picture. Sundays are for 60 Minutes.#60MinutesAustralia","60 Minutes Australia","VQOOxOl9l80"
"7",0,"Ricky Gervais' funniest ever interview | 60 Minutes Australia","In all his years interviewing so-called “funny” people, Charles Wooley has often been faced with the sad truth that many of them aren’t that humorous in real life. But not so Ricky Gervais. As Wooley discovered, along with the laughs this dangerously sharp comedian has the knack of being able to make people wince in agony or cringe with embarrassment at some of his observations. Ricky’s rule is there is no topic that can’t be joked about. It has landed him in plenty of trouble, but as he says, he couldn’t give a f***.WATCH more of 60 Minutes Australia: https://www.60minutes.com.au LIKE 60 Minutes Australia on Facebook: https://www.facebook.com/60Minutes9 FOLLOW 60 Minutes Australia on Twitter: https://twitter.com/60Mins FOLLOW 60 Minutes Australia on Instagram: https://www.instagram.com/60minutes9Link to related article: https://www.9news.com.au/national/60-...For forty years, 60 Minutes have been telling Australians the world’s greatest stories. Tales that changed history, our nation and our lives. Reporters Liz Hayes, Allison Langdon, Tara Brown, Charles Wooley, Liam Bartlett and Sarah Abo look past the headlines because there is always a bigger picture. Sundays are for 60 Minutes.#60MinutesAustralia #RickyGervais","60 Minutes Australia","Kfgw79mfgIg"
"8",0,"MH370: The Situation Room - What really happened to the missing Boeing 777 | 60 Minutes Australia","What happened to MH370? On a special edition of 60 MINUTES, Tara Brown investigates what is now the world’s most confounding aviation disaster. What happened to the Boeing 777 airliner carrying 239 passengers and crew that vanished on March 8, 2014?WATCH more of 60 Minutes Australia: https://www.60minutes.com.au LIKE 60 Minutes Australia on Facebook: https://www.facebook.com/60Minutes9 FOLLOW 60 Minutes Australia on Twitter: https://twitter.com/60Mins FOLLOW 60 Minutes Australia on Instagram: https://www.instagram.com/60minutes9For forty years, 60 Minutes have been telling Australians the world’s greatest stories. Tales that changed history, our nation and our lives. Reporters Liz Hayes, Allison Langdon, Tara Brown, Charles Wooley, Liam Bartlett and Tom Steinfort look past the headlines because there is always a bigger picture. Sundays are for 60 Minutes.","60 Minutes Australia","Cm1j1fpldkc"
"9",0,"WORLD EXCLUSIVE: Chinese spy spills secrets to expose Communist espionage | 60 Minutes Australia","A Chinese spy defects to Australia. His shocking revelations are guaranteed to infuriate Beijing.  How China conducts questionable activities around the world, including its attempts to infiltrate the Australian government. Subscribe here: http://9Soci.al/chmP50wA97J Full Episodes here http://9Soci.al/sImy50wNiXLWATCH more of 60 Minutes Australia: https://www.60minutes.com.au LIKE 60 Minutes Australia on Facebook: https://www.facebook.com/60Minutes9 FOLLOW 60 Minutes Australia on Twitter: https://twitter.com/60Mins FOLLOW 60 Minutes Australia on Instagram: https://www.instagram.com/60minutes9Link to related article: https://www.9news.com.au/national/60-...For forty years, 60 Minutes have been telling Australians the world’s greatest stories. Tales that changed history, our nation and our lives. Reporters Liz Hayes, Allison Langdon, Tara Brown, Charles Wooley, Liam Bartlett and Sarah Abo look past the headlines because there is always a bigger picture. Sundays are for 60 Minutes.#60MinutesAustralia","60 Minutes Australia","zdR-I35Ladk"
"10",0,"JFK (2013) - Who shot American President John F Kennedy? | 60 Minutes Australia","Presidential Bodyguard, Clint Hill still can't forgive himself for failing to save the life of American President John F Kennedy. On 60 Minutes, he'll retrace his steps, actions and feelings on the day the world lost its innocence Reporter: Charles WooleyProducer: Nick GreenawayFor forty years, 60 Minutes have been telling Australians the world’s greatest stories. Tales that changed history, our nation and our lives. Reporters Liz Hayes, Allison Langdon, Tara Brown, Charles Wooley, Liam Bartlett and Tom Steinfort look past the headlines because there is always a bigger picture. Sundays are for 60 Minutes.WATCH more of 60 Minutes Australia: https://www.60minutes.com.au LIKE 60 Minutes Australia on Facebook: https://www.facebook.com/60Minutes9 FOLLOW 60 Minutes Australia on Twitter: https://twitter.com/60Mins FOLLOW 60 Minutes Australia on Instagram: https://www.instagram.com/60minutes9","60 Minutes Australia","stJ0TvOdH4Y"
"11",0,"Backpacker kidnapped and shackled in abandoned pig shed by madman | 60 Minutes Australia","How a young female backpacker saved her own life after being taken and held hostage by a depraved South Australian farmer.  Her ingenuity is not only amazing, but inspiring.WATCH more of 60 Minutes Australia: https://www.60minutes.com.au LIKE 60 Minutes Australia on Facebook: https://www.facebook.com/60Minutes9 FOLLOW 60 Minutes Australia on Twitter: https://twitter.com/60Mins FOLLOW 60 Minutes Australia on Instagram: https://www.instagram.com/60minutes9For forty years, 60 Minutes have been telling Australians the world’s greatest stories. Tales that changed history, our nation and our lives. Reporters Liz Hayes, Allison Langdon, Tara Brown, Charles Wooley, Liam Bartlett and Sarah Abo look past the headlines because there is always a bigger picture. Sundays are for 60 Minutes.#60MinutesAustralia","60 Minutes Australia","ccK2GifNn4A"
"12",0,"Where is the missing wife of Scientology's ruthless leader? | 60 Minutes Australia","Shelly Miscavige is the wife of Scientology leader David Miscavige,  the high priestess of Scientology who vanished 13 years ago. 60 Minutes investigate into the missing Queen’s whereabouts and speak to the former Scientologist’s who want answers.WATCH more of 60 Minutes Australia: https://www.60minutes.com.au LIKE 60 Minutes Australia on Facebook: https://www.facebook.com/60Minutes9 FOLLOW 60 Minutes Australia on Twitter: https://twitter.com/60Mins FOLLOW 60 Minutes Australia on Instagram: https://www.instagram.com/60minutes9Link to related article: https://www.9news.com.au/world/60-min...For forty years, 60 Minutes have been telling Australians the world’s greatest stories. Tales that changed history, our nation and our lives. Reporters Liz Hayes, Allison Langdon, Tara Brown, Charles Wooley, Liam Bartlett and Tom Steinfort look past the headlines because there is always a bigger picture. Sundays are for 60 Minutes.#60MinutesAustralia","60 Minutes Australia","P7QWifeY2_A"
"13",0,"Man 'locked' in his own brain makes miracle coma recovery | 60 Minutes Australia","Martin Pistorius was a bright, fun-loving, happy young boy when a mystery illness stole his life away. Martin fell into a virtual coma and lost his intelligence, his memory and his ability to function. Four years later he slowly started coming back to life, but had no way of telling anyone. Subscribe here: http://9Soci.al/chmP50wA97J Full Episodes here http://9Soci.al/sImy50wNiXLWATCH more of 60 Minutes Australia: https://www.60minutes.com.au LIKE 60 Minutes Australia on Facebook: https://www.facebook.com/60Minutes9 FOLLOW 60 Minutes Australia on Twitter: https://twitter.com/60Mins FOLLOW 60 Minutes Australia on Instagram: https://www.instagram.com/60minutes9For forty years, 60 Minutes have been telling Australians the world’s greatest stories. Tales that changed history, our nation and our lives. Reporters Liz Hayes, Allison Langdon, Tara Brown, Charles Wooley, Liam Bartlett and Sarah Abo look past the headlines because there is always a bigger picture. Sundays are for 60 Minutes.#60MinutesAustralia","60 Minutes Australia","IZr5VS7HDO8"
"14",0,"Who killed Elvis Presley? A special investigation | 60 Minutes Australia","When Elvis Presley died in 1977, the official explanation was a heart attack but this 1979 special investigation reveals a massive coverup by police and medical authorities. WATCH more of 60 Minutes Australia: https://www.60minutes.com.au LIKE 60 Minutes Australia on Facebook: https://www.facebook.com/60Minutes9 FOLLOW 60 Minutes Australia on Twitter: https://twitter.com/60Mins FOLLOW 60 Minutes Australia on Instagram: https://www.instagram.com/60minutes9For forty years, 60 Minutes have been telling Australians the world’s greatest stories. Tales that changed history, our nation and our lives. Reporters Liz Hayes, Allison Langdon, Tara Brown, Charles Wooley, Liam Bartlett and Tom Steinfort look past the headlines because there is always a bigger picture. Sundays are for 60 Minutes.","60 Minutes Australia","8hOJFqawlPU"
"15",0,"Woman with 2,500 personalities says they saved her from shocking child abuse | 60 Minutes Australia","The inspiring story of the Aussie woman with over 2000 personalities.  How her brain conjured up the different characters to protect her from abuse, and even more incredibly, how they all worked together to bring an evil monster to justice.WATCH more of 60 Minutes Australia: https://www.60minutes.com.au LIKE 60 Minutes Australia on Facebook: https://www.facebook.com/60Minutes9 FOLLOW 60 Minutes Australia on Twitter: https://twitter.com/60Mins FOLLOW 60 Minutes Australia on Instagram: https://www.instagram.com/60minutes9For forty years, 60 Minutes have been telling Australians the world’s greatest stories. Tales that changed history, our nation and our lives. Reporters Liz Hayes, Allison Langdon, Tara Brown, Charles Wooley, Liam Bartlett and Sarah Abo look past the headlines because there is always a bigger picture. Sundays are for 60 Minutes.#60MinutesAustralia","60 Minutes Australia","lsXFcbPbvI4"
"16",0,"EXCLUSIVE: Crown Casino exposed. Sex trafficking, drugs, money laundering | 60 Minutes Australia","A six-month joint investigation by 60 MINUTES, The Age and The Sydney Morning Herald has exposed a corporate scandal unlike anything Australia has seen before.  WATCH more of 60 Minutes Australia: https://www.60minutes.com.au LIKE 60 Minutes Australia on Facebook: https://www.facebook.com/60Minutes9 FOLLOW 60 Minutes Australia on Twitter: https://twitter.com/60Mins FOLLOW 60 Minutes Australia on Instagram: https://www.instagram.com/60minutes9For forty years, 60 Minutes have been telling Australians the world’s greatest stories. Tales that changed history, our nation and our lives. Reporters Liz Hayes, Allison Langdon, Tara Brown, Charles Wooley, Liam Bartlett and Sarah Abo look past the headlines because there is always a bigger picture. Sundays are for 60 Minutes.#60MinutesAustralia","60 Minutes Australia","9PuHjyny9lE"
"17",0,"Investigation: Why is China on the move in the South Pacific? | 60 Minutes Australia","A special 60 Minutes investigation revealing China's soft invasion of Australia’s island neighbours. Subscribe here: http://9Soci.al/chmP50wA97J Full Episodes here http://9Soci.al/sImy50wNiXLWATCH more of 60 Minutes Australia: https://www.60minutes.com.au LIKE 60 Minutes Australia on Facebook: https://www.facebook.com/60Minutes9 FOLLOW 60 Minutes Australia on Twitter: https://twitter.com/60Mins FOLLOW 60 Minutes Australia on Instagram: https://www.instagram.com/60minutes9For forty years, 60 Minutes have been telling Australians the world’s greatest stories. Tales that changed history, our nation and our lives. Reporters Liz Hayes, Allison Langdon, Tara Brown, Charles Wooley, Liam Bartlett and Sarah Abo look past the headlines because there is always a bigger picture. Sundays are for 60 Minutes.#60MinutesAustralia","60 Minutes Australia","BzCqQKnF9Oo"
"18",0,"COVID-19 survivor feared for his life on virus 'super spreader' cruise | 60 Minutes Australia","Subscribe here: http://9Soci.al/chmP50wA97J Full Episodes here http://9Soci.al/sImy50wNiXL | Seasick (2020)“Coronavirus Super Spreader” is an unwanted label which is forever now attached to the cruise ship industry. In Australia, and all over the world, cruise liners have proven to be the perfect host for the disease. In confined spaces with lots of people partying, COVID-19 thrives. The companies which operate the ships say the wellbeing of their passengers is their priority, but on 60 MINUTES, Tom Steinfort reveals how profits are the real captains of this industry.WATCH more of 60 Minutes Australia: https://www.60minutes.com.au LIKE 60 Minutes Australia on Facebook: https://www.facebook.com/60Minutes9 FOLLOW 60 Minutes Australia on Twitter: https://twitter.com/60Mins FOLLOW 60 Minutes Australia on Instagram: https://www.instagram.com/60minutes9For forty years, 60 Minutes have been telling Australians the world’s greatest stories. Tales that changed history, our nation and our lives. Reporters Liz Hayes, Allison Langdon, Tara Brown, Charles Wooley, Liam Bartlett and Sarah Abo look past the headlines because there is always a bigger picture. Sundays are for 60 Minutes.#60MinutesAustralia","60 Minutes Australia","jZyQ4UILyZ0"
"19",0,"'Barack Obama trusted Joe Biden. I trust Joe Biden': DNC Chair Tom Perez | ABC News","DNC Chair Tom Perez is interviewed on """"This Week.""""#ABCNews #ThisWeek #DNC #TomPerez","ABC News","14jTEI1u8FM"
"20",0,"Female gymnasts accuse Michigan doctor of molesting them during treatment | ABC News","Several women came forward after Dr. Larry Nassar faced sexual misconduct and child porn charges unrelated to his work with athletes.--SUBSCRIBE to ABC NEWS: https://www.youtube.com/ABCNews/Watch More on http://abcnews.go.com/LIKE ABC News on FACEBOOKhttps://www.facebook.com/abcnewsFOLLOW ABC News on TWITTER:https://twitter.com/abcGOOD MORNING AMERICA'S HOMEPAGE:https://gma.yahoo.com/","ABC News","5G30wFiexCg"
"21",0,"What happened the morning pregnant mom, two daughters went missing (NIGHTLINE)","WATCH THE FULL EPISODE OF 20/20: https://bit.ly/2B1t2b8When Shanann Watts and her girls were reported missing, police found her purse, wallet and wedding ring and the beds unmade inside the family's Colorado home.","ABC News","Ze6ZG3uCE6I"
"22",0,"Obama White House Correspondents Dinner 2016 | President Obama's FULL SPEECH","The president poked fun at himself and presidential candidates at his last White House Correspondent’s Dinner as commander-in-chief. SUBSCRIBE to ABC NEWS: https://www.youtube.com/ABCNews/Watch More on http://abcnews.go.com/LIKE ABC News on FACEBOOKhttps://www.facebook.com/abcnewsFOLLOW ABC News on TWITTER:https://twitter.com/abcGOOD MORNING AMERICA'S HOMEPAGE:https://gma.yahoo.com/","ABC News","TO9d16c2XRM"
"23",0,"Obama Farewell Speech FULL Event | ABC News","President Obama Farewell Address: Obama's final speech to the public will continue a tradition set in 1796 when George Washington addressed the American people for the last time as president. It will be followed by a """"family reunion"""" for alumni of Obama's former campaigns, according to a save-the-date sent to alumni.Obama has described the event as """"a chance to say thank you for this amazing journey,"""" to celebrate the ways the country has changed and """"to offer some thoughts on where we all go from here.""""For many supporters, Obama's decision to give the speech in Chicago rather than Washington added to the significance of the event. It was in Chicago's Grant Park that in 2008 he delivered his victory speech after becoming the nation's first black president.For more: http://abcnews.go.com/Politics/obama-...http://abcnews.go.com/Politics/wireSt...SUBSCRIBE to ABC NEWS: https://www.youtube.com/ABCNews/Watch More on http://abcnews.go.com/LIKE ABC News on FACEBOOKhttps://www.facebook.com/abcnewsFOLLOW ABC News on TWITTER:https://twitter.com/abcGOOD MORNING AMERICA'S HOMEPAGE:https://gma.yahoo.com/","ABC News","R2Zo8vHOgaM"
"24",0,"New rules of social distancing during the pandemic","Author and co-president of the Emily Post Institute, Lizzie Post, shares advice on evolving etiquette during the coronavirus pandemic.#Pandemic #Etiquette #Coronavirus","ABC News","t01P0K5Nyfs"
"25",0,"Watch the Latest News Headlines and Live Events — ABC News Live","#coronavirus #covid19 #news #LiveNews #StreamingNews #ABCNewsLiveLATEST NEWS: https://abcnews.go.com/SUBSCRIBE to ABC News on YouTube: https://bit.ly/2vZb6yPFollow us on Instagram: https://www.instagram.com/abcnews/Follow us on Twitter: https://twitter.com/abcLike us on Facebook: https://www.facebook.com/ABCNews","ABC News","w_Ma8oQLmSM"
"26",0,"Obama's Tribute to Joe Biden (Full Speech) | ABC News","President Obama surprised Vice President Joe Biden with the nation’s highest civilian honor – the Presidential Medal of Freedom – at a tribute event at the White House this afternoon. The event itself, let alone the award, was kept secret from the the vice president.Biden was very emotional throughout the event, wiping away tears almost constantly as the president made a speech about why he believes Biden is “the finest vice president” in U.S. history. “This also gives the internet one last chance to talk about our bromance,” Obama joked as he began the event. FOR MORE: http://abcnews.go.com/Politics/presid...SUBSCRIBE to ABC NEWS: https://www.youtube.com/ABCNews/Watch More on http://abcnews.go.com/LIKE ABC News on FACEBOOKhttps://www.facebook.com/abcnewsFOLLOW ABC News on TWITTER:https://twitter.com/abcGOOD MORNING AMERICA'S HOMEPAGE:https://gma.yahoo.com/","ABC News","N77AXnJ8Bsw"
"27",0,"Obama Awards Presidential Medal of Freedom FULL EVENT","President Obama Awards the Presidential Medal of Freedom | President Obama is finishing out his second term by honoring some superstars from the worlds of film, TV, sports and music.Robert DeNiro, Tom Hanks, Ellen DeGeneres, Robert Redford and Bruce Springsteen are among the big names who'll receive the Presidential Medal of Freedom, the nation's highest civilian honor, on Nov. 22 at the White House. Cicely Tyson, Diana Ross, Kareem Abdul-Jabbar and Michael Jordan are also among the 21 medal recipients, as are Bill and Melinda Gates, sports broadcaster Vin Scully, and """"Saturday Night Live"""" creator and producer Lorne Michaels. The Presidential Medal of Freedom is awarded to people who have """"made especially meritorious contributions to the security or national interests of the United States, to world peace, or to cultural or other significant public or private endeavors.""""SUBSCRIBE to ABC NEWS: https://www.youtube.com/ABCNews/Watch More on http://abcnews.go.com/LIKE ABC News on FACEBOOKhttps://www.facebook.com/abcnewsFOLLOW ABC News on TWITTER:https://twitter.com/abcGOOD MORNING AMERICA'S HOMEPAGE:https://gma.yahoo.com/","ABC News","a9a8Yrp-H5M"
"28",0,"White House reveals plan to fast-track vaccine timeline | WNT","Called Operation Warp Speed, the government and military will team with leaders in industry to work toward a vaccine by January 2021.WATCH THE FULL EPISODE OF 'WORLD NEWS TONIGHT':https://bit.ly/3c4YYMQWATCH OTHER FULL EPISODES OF WORLD NEWS TONIGHT:http://abc.go.com/shows/world-news-to...WATCH WORLD NEWS TONIGHT ON HULU:https://hulu.tv/33iKepm#WorldNewsTonight #Trump #Covid19 #Vaccine #OperationWarpSpeed","ABC News","Gl_qo13gpps"
