"","Bias_num","title","description","channel","id"
"628",0,"Hillary Rodham Clinton & Chelsea Clinton - Conspiracy Theories & Impeachment | The Daily Show","Hillary Rodham Clinton and Chelsea Clinton discuss the wild conspiracy theories that float around the internet and Hillary's familiarity with impeachment proceedings. #TheDailyShow #HillaryClinton #ChelseaClintonSubscribe to The Daily Show:https://www.youtube.com/channel/UCwWh... Follow The Daily Show:Twitter: https://twitter.com/TheDailyShowFacebook: https://www.facebook.com/thedailyshowInstagram: https://www.instagram.com/thedailyshowWatch full episodes of The Daily Show for free: http://www.cc.com/shows/the-daily-sho...Follow Comedy Central:Twitter: https://twitter.com/ComedyCentralFacebook: https://www.facebook.com/ComedyCentralInstagram: https://www.instagram.com/comedycentralAbout The Daily Show:Trevor Noah and The World's Fakest News Team tackle the biggest stories in news, politics and pop culture.The Daily Show with Trevor Noah airs weeknights at 11/10c on Comedy Central.","The Daily Show with Trevor Noah","WCbRi_vHoRM"
"629",1,"Jack Barsky, Ex-KGB Agent  | The Eric Metaxas Radio Show","How do you quit the KGB without getting """"eliminated""""? Jack Barsky tells the real-life spy story of how he came to America as a Soviet sleeper agent for the KGB, but started enjoying his new life in America so much he dangerously chose to leave his old life behind.Follow the show: https://www.metaxastalk.com/Watch all interviews from The Eric Metaxas Show: https://metaxassuper.com/","The Eric Metaxas Radio Show","Ondq33w2lYQ"
"630",1,"Katie Hopkins | The Eric Metaxas Radio Show","The effervescent Katie Hopkins continues voicing her concerns about the future of England, including the removal of Fox News from its channel lineup and how London is losing its cultural heritage. She also details the increasingly politically correct culture in the United Kingdom, including arrests for voicing one’s perspective on sexuality.Follow the show: https://www.metaxastalk.com/Watch all interviews from The Eric Metaxas Show: https://metaxassuper.com/Please donate to Food for the Poor through the month of August 2019 so that we may reach our fundraising goal! https://www.foodforthepoor.org/metaxas","The Eric Metaxas Radio Show","M388xgbY5Jk"
"631",1,"John Zmirak | The Eric Metaxas Radio Show","John Zmirak descends into the vault to talk about Harvard vs. Homeschooling and other hot topics.Follow the show: https://www.metaxastalk.com/Subscribe to Metaxas Super to watch all interviews commercial-free AND additional exclusive content: https://metaxassuper.com/","The Eric Metaxas Radio Show","UJT3uAb1tWY"
"632",1,"Mollie Hemingway & Carrie Severino: Justice on Trial | The Eric Metaxas Radio Show","Authors of the current #1 bestseller “Justice on Trial” Mollie Hemingway and Carrie Severino delve into the controversy surrounding the Kavanaugh confirmation as Justice for the Supreme Court. Follow the show: https://www.metaxastalk.com/Watch all interviews from The Eric Metaxas Show commercial-free: https://metaxassuper.com/","The Eric Metaxas Radio Show","DAhxPNVvXxo"
"633",1,"Victor Davis Hanson - Is American-style independence in danger?","Victor Davis Hanson makes a bunker appearance, steering the conversation into the intersection of safety and freedom. Is American-style independence in danger?Follow the show: https://www.metaxastalk.com/Subscribe to Metaxas Super to watch all interviews commercial-free AND additional exclusive content: https://metaxassuper.com/","The Eric Metaxas Radio Show","v7kkxnpMWGo"
"634",1,"Mollie Hemingway On Joe Biden and the Thin Light of the Brett Kavanaugh Bias.","Mollie Hemingway shares her thoughts about Joe Biden and the accusations against him in light of the Brett Kavanaugh bias.Follow the show: https://www.metaxastalk.com/Subscribe to Metaxas Super to watch all interviews commercial-free AND additional exclusive content: https://metaxassuper.com/","The Eric Metaxas Radio Show","rALzWkFDxaY"
"635",1,"Pat Boone | The Eric Metaxas Radio Show","Actor and singer Pat Boone has a powerful and inspiring message for all Americans that he shares with Eric in his special bunker appearance.Follow the show: https://www.metaxastalk.com/Subscribe to Metaxas Super to watch all interviews commercial-free AND additional exclusive content: https://metaxassuper.com/","The Eric Metaxas Radio Show","letypVkSymk"
"636",1,"Ravi Zacharias | The Eric Metaxas Radio Show","International evangelist Ravi Zacharias discloses how personal tragedy as a teenager led to encountering Jesus and his subsequent promise to God to """"leave no stone unturned in pursuit of truth.""""Follow the show: https://www.metaxastalk.com/Watch all interviews from The Eric Metaxas Show: https://metaxassuper.com/Please donate to Food for the Poor through the month of August 2019 so that we may reach our fundraising goal! https://www.foodforthepoor.org/metaxas","The Eric Metaxas Radio Show","0LfmEVJ1d_k"
"637",1,"Candace Owens - On Coronavirus, Liberty, No Safe Spaces and Her New Book """"Blackout""""","Candace Owens makes her first bunker appearance and talks about her role in the film, """"No Safe Spaces,"""" as well as the current state of America under lock-down, its future after """"reopening for business,"""" and her new book, """"Blackout.""""Follow the show: https://www.metaxastalk.com/Subscribe to Metaxas Super to watch all interviews commercial-free AND additional exclusive content: https://metaxassuper.com/","The Eric Metaxas Radio Show","NS8C5Sy4-Gg"
"638",1,"Krystal Ball: Pelosi, Dems PATHETIC resistance theater helps Trump again","Krystal Ball slams Dem theatrics over the stimulus bill, despite still voting for the massive corporate slush fund that neglects the needs of workers and gives Trump total control of oversight.About Rising: Rising is a weekday morning show with bipartisan hosts that breaks the mold of morning TV by taking viewers inside the halls of Washington power like never before. The show leans into the day's political cycle with cutting edge analysis from DC insiders who can predict what is going to happen. It also sets the day's political agenda by breaking exclusive news with a team of scoop-driven reporters and demanding answers during interviews with the country's most important political newsmakers. Follow Rising on social media:Website: Hill.TVFacebook: facebook.com/HillTVLive/Instagram: @HillTVLiveTwitter: @HillTVLiveFollow Saagar Enjeti & Krystal Ball on social media:Twitter: @esaagar and @krystalballInstagram: @esaagar and @krystalmball","The Hill","0fm5VNsfD5k"
"639",1,"Krystal Ball: Alyssa Milano REVEALED as a #MeToo fraud","Krystal Ball tears into notorious Kavanaugh hearing attendant, actress Alyssa Milano, for her hypocrisy on the 'believe women' movement, after Milano dismissed Tara Reade’s story in public interviews.About Rising: Rising is a weekday morning show with bipartisan hosts that breaks the mold of morning TV by taking viewers inside the halls of Washington power like never before. The show leans into the day's political cycle with cutting edge analysis from DC insiders who can predict what is going to happen. It also sets the day's political agenda by breaking exclusive news with a team of scoop-driven reporters and demanding answers during interviews with the country's most important political newsmakers. Follow Rising on social media:Website: Hill.TVFacebook: facebook.com/HillTVLive/Instagram: @HillTVLiveTwitter: @HillTVLiveFollow Saagar Enjeti & Krystal Ball on social media:Twitter: @esaagar and @krystalballInstagram: @esaagar and @krystalmball","The Hill","M1CPYEcnSg4"
"640",1,"Nina Turner REACTS to New York primary cancellation, denounces Sanders aide super PAC","Former National Co-chair for the Bernie Sanders Presidential Campaign Nina Turner, reacts to New York's cancelled primary and calls Jeff Weaver's super PAC the """"antithesis"""" of the Sanders campaign goal to get big money out of politics.About Rising: Rising is a weekday morning show with bipartisan hosts that breaks the mold of morning TV by taking viewers inside the halls of Washington power like never before. The show leans into the day's political cycle with cutting edge analysis from DC insiders who can predict what is going to happen. It also sets the day's political agenda by breaking exclusive news with a team of scoop-driven reporters and demanding answers during interviews with the country's most important political newsmakers. Follow Rising on social media:Website: Hill.TVFacebook: facebook.com/HillTVLive/Instagram: @HillTVLiveTwitter: @HillTVLiveFollow Saagar Enjeti & Krystal Ball on social media:Twitter: @esaagar and @krystalballInstagram: @esaagar and @krystalmball","The Hill","uYDXUBxZG1o"
"641",1,"Krystal Ball: NYT CAUGHT covering up Joe Biden #MeToo allegation","Krystal Ball slams The New York Times' coverage of Tara Reade's sexual assault allegation against Joe Biden.About Rising: Rising is a weekday morning show with bipartisan hosts that breaks the mold of morning TV by taking viewers inside the halls of Washington power like never before. The show leans into the day's political cycle with cutting edge analysis from DC insiders who can predict what is going to happen. It also sets the day's political agenda by breaking exclusive news with a team of scoop-driven reporters and demanding answers during interviews with the country's most important political newsmakers. Follow Rising on social media:Website: Hill.TVFacebook: facebook.com/HillTVLive/Instagram: @HillTVLiveTwitter: @HillTVLiveFollow Saagar Enjeti & Krystal Ball on social media:Twitter: @esaagar and @krystalballInstagram: @esaagar and @krystalmball","The Hill","jTyYrJl5IiU"
"642",1,"Krystal and Saagar: Joe Rogan says he CAN'T vote for Biden, Establishment Dems MELTDOWN","Krystal and Saagar discuss Joe Rogan's decision to vote for Trump, and share #Risingstories from a viewer stuck with over $1000 in medical bills for basic temperature, pulse tests.About Rising: Rising is a weekday morning show with bipartisan hosts that breaks the mold of morning TV by taking viewers inside the halls of Washington power like never before. The show leans into the day's political cycle with cutting edge analysis from DC insiders who can predict what is going to happen. It also sets the day's political agenda by breaking exclusive news with a team of scoop-driven reporters and demanding answers during interviews with the country's most important political newsmakers. Follow Rising on social media:Website: Hill.TVFacebook: facebook.com/HillTVLive/Instagram: @HillTVLiveTwitter: @HillTVLiveFollow Saagar Enjeti & Krystal Ball on social media:Twitter: @esaagar and @krystalballInstagram: @esaagar and @krystalmball","The Hill","mAwjjX96Zt0"
"643",1,"Matt Taibbi: Why this bailout is worse than 2008","Author and reporter Matt Taibbi explains how corporate America will over-indulge on its piece of the $2 trillion dollar bailout package, thus creating another financial catastrophe.About Rising: Rising is a weekday morning show with bipartisan hosts that breaks the mold of morning TV by taking viewers inside the halls of Washington power like never before. The show leans into the day's political cycle with cutting edge analysis from DC insiders who can predict what is going to happen. It also sets the day's political agenda by breaking exclusive news with a team of scoop-driven reporters and demanding answers during interviews with the country's most important political newsmakers. Follow Rising on social media:Website: Hill.TVFacebook: facebook.com/HillTVLive/Instagram: @HillTVLiveTwitter: @HillTVLiveFollow Saagar Enjeti & Krystal Ball on social media:Twitter: @esaagar and @krystalballInstagram: @esaagar and @krystalmball","The Hill","KqcpipS2yvI"
"644",1,"Krystal and Saagar: MSNBC dismisses Biden allegations as 'right-wing smear'","Krystal and Saagar watch MSNBC's Nicole Wallace call Tara Reade allegations a 'smear campaign' by the right against Joe Biden, and discuss the blatant hypocrisy of the mainstream media to protect Biden.About Rising: Rising is a weekday morning show with bipartisan hosts that breaks the mold of morning TV by taking viewers inside the halls of Washington power like never before. The show leans into the day's political cycle with cutting edge analysis from DC insiders who can predict what is going to happen. It also sets the day's political agenda by breaking exclusive news with a team of scoop-driven reporters and demanding answers during interviews with the country's most important political newsmakers. Follow Rising on social media:Website: Hill.TVFacebook: facebook.com/HillTVLive/Instagram: @HillTVLiveTwitter: @HillTVLiveFollow Saagar Enjeti & Krystal Ball on social media:Twitter: @esaagar and @krystalballInstagram: @esaagar and @krystalmball","The Hill","x68Vby-vBWY"
"645",1,"Rising crisis update: Pandemic could take 2 years to contain, Pompeo backs virus lab origin claims","Krystal and Saagar give an update on coronavirus case numbers at 1,165,300 with an additional 89,000 cases in the US since Friday, and 68,000 deaths in the U.S., and discuss new reports that say the pandemic could last for two years.About Rising: Rising is a weekday morning show with bipartisan hosts that breaks the mold of morning TV by taking viewers inside the halls of Washington power like never before. The show leans into the day's political cycle with cutting edge analysis from DC insiders who can predict what is going to happen. It also sets the day's political agenda by breaking exclusive news with a team of scoop-driven reporters and demanding answers during interviews with the country's most important political newsmakers. Follow Rising on social media:Website: Hill.TVFacebook: facebook.com/HillTVLive/Instagram: @HillTVLiveTwitter: @HillTVLiveFollow Saagar Enjeti & Krystal Ball on social media:Twitter: @esaagar and @krystalballInstagram: @esaagar and @krystalmball","The Hill","NcSgSgN1l8I"
"646",1,"Krystal Ball: The woke Left tried to cancel me, that's why they keep losing","Krystal Ball responds to critics who accused her of treating racism like, """"some type of minor policy difference that can just be hand waved away,"""" for calling Tucker Carlson, an """"independent thinker,"""" for being willing to dissent from the Trump administration on immigration policy.About Rising: Rising is a weekday morning show with bipartisan hosts that breaks the mold of morning TV by taking viewers inside the halls of Washington power like never before. The show leans into the day's political cycle with cutting edge analysis from DC insiders who can predict what is going to happen. It also sets the day's political agenda by breaking exclusive news with a team of scoop-driven reporters and demanding answers during interviews with the country's most important political newsmakers. Follow Rising on social media:Website: Hill.TVFacebook: facebook.com/HillTVLive/Instagram: @HillTVLiveTwitter: @HillTVLiveFollow Saagar Enjeti & Krystal Ball on social media:Twitter: @esaagar and @krystalballInstagram: @esaagar and @krystalmball","The Hill","GxgUQ4ZVlUA"
"647",1,"Saagar Enjeti: What Ben Shapiro's bad take on bailouts exposes about the Republican Party","Saagar Enjeti makes an example out of Ben Shapiro and points out why conservatives are infighting about populist ideas from Sen. Josh Hawley's proposal, which if passed would be the largest jobs programs in American history.About Rising: Rising is a weekday morning show with bipartisan hosts that breaks the mold of morning TV by taking viewers inside the halls of Washington power like never before. The show leans into the day's political cycle with cutting edge analysis from DC insiders who can predict what is going to happen. It also sets the day's political agenda by breaking exclusive news with a team of scoop-driven reporters and demanding answers during interviews with the country's most important political newsmakers. Follow Rising on social media:Website: Hill.TVFacebook: facebook.com/HillTVLive/Instagram: @HillTVLiveTwitter: @HillTVLiveFollow Saagar Enjeti & Krystal Ball on social media:Twitter: @esaagar and @krystalballInstagram: @esaagar and @krystalmball","The Hill","n3h6BscU7LE"
"648",1,"Krystal and Saagar: AOC DID vote no on the bailout bill, Matt Gaetz predicts she is the future","Krystal and Saagar discuss AOC's decision to vote against the stimulus bill because of the slush fund provided to Wall Street, explore Matt Gaetz’s prediction that Bernie laid the groundwork for a future AOC presidency.About Rising: Rising is a weekday morning show with bipartisan hosts that breaks the mold of morning TV by taking viewers inside the halls of Washington power like never before. The show leans into the day's political cycle with cutting edge analysis from DC insiders who can predict what is going to happen. It also sets the day's political agenda by breaking exclusive news with a team of scoop-driven reporters and demanding answers during interviews with the country's most important political newsmakers. Follow Rising on social media:Website: Hill.TVFacebook: facebook.com/HillTVLive/Instagram: @HillTVLiveTwitter: @HillTVLiveFollow Saagar Enjeti & Krystal Ball on social media:Twitter: @esaagar and @krystalballInstagram: @esaagar and @krystalmball","The Hill","VjXMdFCMDuk"
"649",1,"Saagar Enjeti: Why This Crisis Is Destroying Millennials, Generation Z","Saagar Enjeti examines the financial hardships millennials, already in debt and without savings, face in the economic fallout.About Rising: Rising is a weekday morning show with bipartisan hosts that breaks the mold of morning TV by taking viewers inside the halls of Washington power like never before. The show leans into the day's political cycle with cutting edge analysis from DC insiders who can predict what is going to happen. It also sets the day's political agenda by breaking exclusive news with a team of scoop-driven reporters and demanding answers during interviews with the country's most important political newsmakers. Follow Rising on social media:Website: Hill.TVFacebook: facebook.com/HillTVLive/Instagram: @HillTVLiveTwitter: @HillTVLiveFollow Saagar Enjeti & Krystal Ball on social media:Twitter: @esaagar and @krystalballInstagram: @esaagar and @krystalmball","The Hill","7MJcRVxP2Qw"
"650",1,"Saagar Enjeti: THIS Is How The Next Political Revolution Will Begin","Saagar Enjeti delves into the financial uncertainty millions of Americans will face as layoffs and unemployment continue to soar.About Rising: Rising is a weekday morning show with bipartisan hosts that breaks the mold of morning TV by taking viewers inside the halls of Washington power like never before. The show leans into the day's political cycle with cutting edge analysis from DC insiders who can predict what is going to happen. It also sets the day's political agenda by breaking exclusive news with a team of scoop-driven reporters and demanding answers during interviews with the country's most important political newsmakers. Follow Rising on social media:Website: Hill.TVFacebook: facebook.com/HillTVLive/Instagram: @HillTVLiveTwitter: @HillTVLiveFollow Saagar Enjeti & Krystal Ball on social media:Twitter: @esaagar and @krystalballInstagram: @esaagar and @krystalmball","The Hill","nHoOgjs7cIY"
"651",1,"Saagar Enjeti: This Is How Populists Can Beat Corporate Establishment","Saagar Enjeti discusses the clash within the GOP over Senator Josh Hawley's plan to keep every single fired American on payroll.About Rising: Rising is a weekday morning show with bipartisan hosts that breaks the mold of morning TV by taking viewers inside the halls of Washington power like never before. The show leans into the day's political cycle with cutting edge analysis from DC insiders who can predict what is going to happen. It also sets the day's political agenda by breaking exclusive news with a team of scoop-driven reporters and demanding answers during interviews with the country's most important political newsmakers. Follow Rising on social media:Website: Hill.TVFacebook: facebook.com/HillTVLive/Instagram: @HillTVLiveTwitter: @HillTVLiveFollow Saagar Enjeti & Krystal Ball on social media:Twitter: @esaagar and @krystalballInstagram: @esaagar and @krystalmball","The Hill","WWIi9bPTDKw"
"652",1,"Joe Rogan shouts out Rising, explains why he can't vote for Joe Biden","Krystal and Saagar discuss Joe Rogan's claims that Joe Biden is mentally unfit to run against Trump, gives 'Rising' a shoutout on the Joe Rogan experience.About Rising: Rising is a weekday morning show with bipartisan hosts that breaks the mold of morning TV by taking viewers inside the halls of Washington power like never before. The show leans into the day's political cycle with cutting edge analysis from DC insiders who can predict what is going to happen. It also sets the day's political agenda by breaking exclusive news with a team of scoop-driven reporters and demanding answers during interviews with the country's most important political newsmakers. Follow Rising on social media:Website: Hill.TVFacebook: facebook.com/HillTVLive/Instagram: @HillTVLiveTwitter: @HillTVLiveFollow Saagar Enjeti & Krystal Ball on social media:Twitter: @esaagar and @krystalballInstagram: @esaagar and @krystalmball","The Hill","suennOHE5Xg"
"653",1,"Krystal and Saagar: Larry Kudlow MELTS DOWN after confronted with past statements on coronavirus","Krystal and Saagar look at Larry Kudlow's CNN interview, where he says no one could have seen this pandemic coming, after the administration and Nancy Pelosi initially downplayed the severity of the crisis.About Rising: Rising is a weekday morning show with bipartisan hosts that breaks the mold of morning TV by taking viewers inside the halls of Washington power like never before. The show leans into the day's political cycle with cutting edge analysis from DC insiders who can predict what is going to happen. It also sets the day's political agenda by breaking exclusive news with a team of scoop-driven reporters and demanding answers during interviews with the country's most important political newsmakers. Follow Rising on social media:Website: Hill.TVFacebook: facebook.com/HillTVLive/Instagram: @HillTVLiveTwitter: @HillTVLiveFollow Saagar Enjeti & Krystal Ball on social media:Twitter: @esaagar and @krystalballInstagram: @esaagar and @krystalmball","The Hill","z13quaPMFfk"
"654",1,"Krystal Ball: We have a terrible choice in 2020, two fake populists","Krystal Ball explains why young voters are apprehensive to vote for Joe Biden, debriefs on Joe Biden's track record of neoliberalism in Washington.About Rising: Rising is a weekday morning show with bipartisan hosts that breaks the mold of morning TV by taking viewers inside the halls of Washington power like never before. The show leans into the day's political cycle with cutting edge analysis from DC insiders who can predict what is going to happen. It also sets the day's political agenda by breaking exclusive news with a team of scoop-driven reporters and demanding answers during interviews with the country's most important political newsmakers. Follow Rising on social media:Website: Hill.TVFacebook: facebook.com/HillTVLive/Instagram: @HillTVLiveTwitter: @HillTVLiveFollow Saagar Enjeti & Krystal Ball on social media:Twitter: @esaagar and @krystalballInstagram: @esaagar and @krystalmball","The Hill","NGQnJidk_68"
"655",1,"NYT's Ben Smith: What the media got wrong with Tara Reade's allegations","New York Times Media Columnist Ben Smith, discusses how the Biden campaign tried to downplay sexual assault allegations through edits in the Tara Reade story, and explains how the media was influenced in reporting on the allegations.You can read Ben's column here: https://nyti.ms/3f7FJV9About Rising: Rising is a weekday morning show with bipartisan hosts that breaks the mold of morning TV by taking viewers inside the halls of Washington power like never before. The show leans into the day's political cycle with cutting edge analysis from DC insiders who can predict what is going to happen. It also sets the day's political agenda by breaking exclusive news with a team of scoop-driven reporters and demanding answers during interviews with the country's most important political newsmakers. Follow Rising on social media:Website: Hill.TVFacebook: facebook.com/HillTVLive/Instagram: @HillTVLiveTwitter: @HillTVLiveFollow Saagar Enjeti & Krystal Ball on social media:Twitter: @esaagar and @krystalballInstagram: @esaagar and @krystalmball","The Hill","g9dhPGfTN4g"
"656",1,"Saagar Enjeti: 26 MILLION UNEMPLOYED, Corporate Elites CHOSE To Make You Suffer","Saagar Enjeti discusses new unemployment claims at 26 million, and explains how the economic fallout is a choice by corrupt financial elitists refusing to supply laid off workers with more income.About Rising: Rising is a weekday morning show with bipartisan hosts that breaks the mold of morning TV by taking viewers inside the halls of Washington power like never before. The show leans into the day's political cycle with cutting edge analysis from DC insiders who can predict what is going to happen. It also sets the day's political agenda by breaking exclusive news with a team of scoop-driven reporters and demanding answers during interviews with the country's most important political newsmakers. Follow Rising on social media:Website: Hill.TVFacebook: facebook.com/HillTVLive/Instagram: @HillTVLiveTwitter: @HillTVLiveFollow Saagar Enjeti & Krystal Ball on social media:Twitter: @esaagar and @krystalballInstagram: @esaagar and @krystalmball","The Hill","qm7H3HRdPhg"
